ticker,title,link,pubDate,sentiment,p_negative,p_neutral,p_positive
AAPL,What to expect at the upcoming iPhone launch event,https://finnhub.io/api/news?id=01c082ebb6bcee7df3ef672e5f1d1b559ec7d9735bccaf10c7d62c4c2481ebfc,2025-08-30T09:30:02Z,positive,0.030291080474853516,0.032398536801338196,0.9373103380203247
GOOGL,"The Best Stocks to Invest $50,000 in Right Now",https://finnhub.io/api/news?id=b51ac094fce042dbf5d7fe4abe73f6475756c499f3506fada2fb900f05a9f1ab,2025-08-30T09:15:00Z,positive,0.05989164859056473,0.016105197370052338,0.9240031838417053
GOOGL,3 Red-Hot Growth Stocks to Buy in 2025,https://finnhub.io/api/news?id=d54e0fbaeb1186dd90b895d7f5f6e77daa3de5e7315a15ba2e6f09963eb88abb,2025-08-30T08:55:00Z,positive,0.13486015796661377,0.012901529669761658,0.8522382974624634
AAPL,Warren Buffett Just Sold $4 Billion of Apple Stock. He Used $1.5 Billion of the Money to Buy This Beaten-Down Stock.,https://finnhub.io/api/news?id=fce5b69a7b781f3d328e2fe60c6664a2d825d04bf673ce7255d9c7b62dc4636f,2025-08-30T08:44:00Z,positive,0.0358552448451519,0.051296770572662354,0.9128479361534119
NVDA,New to Growth Stocks? Here's 1 Every Investor Should Have on Their Radar.,https://finnhub.io/api/news?id=99ac9feee7d9f3d5d181ee4781fcc95a5515d2922c8c9912c09df96b070f1cd5,2025-08-30T08:40:00Z,positive,0.05789481848478317,0.019066642969846725,0.9230386018753052
NVDA,Investing.com’s stocks of the week,https://finnhub.io/api/news?id=cc61d556398a1af7c866e9a0f9be088e233b91a34ae0609c11091b79ba5480a9,2025-08-30T08:30:02Z,positive,0.03571844846010208,0.07578383386135101,0.8884977102279663
NVDA,2 Artificial Intelligence (AI) Stocks to Buy Before They Soar Under President Trump,https://finnhub.io/api/news?id=82847e7f985800c9ec518168ba5682970562005c10e27f55265ee857d435f825,2025-08-30T08:29:00Z,positive,0.12060566991567612,0.011277477256953716,0.8681168556213379
NVDA,Prediction: This Monster Artificial Intelligence (AI) Chip Stock Will Soar in September (Hint: It's Not Nvidia),https://finnhub.io/api/news?id=3d0cb5c1641b3c9b0e7aad4ab5a121ed0ab1b0c3f3927f84efea1b74e8253a7b,2025-08-30T08:20:00Z,positive,0.09660399705171585,0.0282438974827528,0.8751521110534668
AMZN,"Meta Platforms and Apple Just Gave This Fellow ""Magnificent Seven"" Stock Great News",https://finnhub.io/api/news?id=95fec353af6106b70eaaaf6efda97275cc2c31f592481a42e2571a723f911371,2025-08-30T08:10:00Z,positive,0.1968299299478531,0.011238962411880493,0.7919310927391052
AAPL,"Meta Platforms and Apple Just Gave This Fellow ""Magnificent Seven"" Stock Great News",https://finnhub.io/api/news?id=95fec353af6106b70eaaaf6efda97275cc2c31f592481a42e2571a723f911371,2025-08-30T08:10:00Z,positive,0.1968299299478531,0.011238962411880493,0.7919310927391052
NVDA,"Meta Platforms and Apple Just Gave This Fellow ""Magnificent Seven"" Stock Great News",https://finnhub.io/api/news?id=95fec353af6106b70eaaaf6efda97275cc2c31f592481a42e2571a723f911371,2025-08-30T08:10:00Z,positive,0.1968299299478531,0.011238962411880493,0.7919310927391052
AMZN,Waitrose trials AI-powered trolleys to scan while you shop,https://finnhub.io/api/news?id=b0841114ce51bb9ec96555fcd0b54a5e0132fb5643afecb903391aba3f3884c4,2025-08-30T08:00:00Z,positive,0.06397987902164459,0.013138352893292904,0.9228817820549011
NVDA,Should You Buy Nvidia After Its Blowout Earnings Report? Here's What History Says.,https://finnhub.io/api/news?id=6212d311d154854b153c7c459136addc34baa86dacbf685e9d140011c1a9c71f,2025-08-30T07:45:00Z,positive,0.041817981749773026,0.04605528712272644,0.9121267199516296
AAPL,Warren Buffett Turns 95 Today. 10 of His Biggest Investing Lessons.,https://finnhub.io/api/news?id=38d5d37ebd1a3da3841572f72409ecb0d663171306409da4a693d1b5cf4e5d1d,2025-08-30T05:30:00Z,positive,0.05242540314793587,0.03103853389620781,0.9165360331535339
AAPL,Meet the smart-meter boss who leads an army of engineers and thrives on change,https://finnhub.io/api/news?id=dfdb98f12e2970c2c69fa3a7d08654f1286a0a2f6745ac3ee65cb634fc661625,2025-08-30T05:00:42Z,positive,0.13259325921535492,0.010685237124562263,0.8567214608192444
MSFT,"Tempus AI, Inc. (TEM) Expands into Digital Pathology with Paige Acquisition",https://finnhub.io/api/news?id=f5d0951769a5b19c27a764506d8810f8dfeda2da0bf6ee86a01a508d4283735c,2025-08-30T03:42:52Z,positive,0.32792186737060547,0.007709166035056114,0.6643689274787903
NVDA,Lambda Taps Super Micro Computer Inc. (SMCI)’s GPUs Optimized for Servers,https://finnhub.io/api/news?id=67cf1cc6145b475b5b8ee4825696c778e4ed62d127d15109edc197a05cb17006,2025-08-30T03:42:49Z,positive,0.38587790727615356,0.0076188999228179455,0.6065032482147217
NVDA,JQUA: I Prefer This ETF Over SCHG Due To Concentration Risks,https://finnhub.io/api/news?id=8a86c230f8f752e96d97c538752f754b9b34d29450bc956f66a669f447575e80,2025-08-30T00:21:35Z,positive,0.15705636143684387,0.016722209751605988,0.8262214064598083
GOOGL,"Meta's AI leaders discuss using Google, OpenAI models in apps, The Information says",https://finnhub.io/api/news?id=086cb39327b7fcbd08c10a915157e3d4c825d1e3cd0211372f150803adfc53ea,2025-08-30T00:03:23Z,positive,0.07793885469436646,0.009895614348351955,0.9121655225753784
GOOGL,Your Boss Doesn’t Have Time to Talk to You,https://finnhub.io/api/news?id=93c6787cb33ca492bde88e1e15521398cbdd31c48308f0cb957ca332dd683a59,2025-08-30T00:00:00Z,positive,0.02401825599372387,0.4576570391654968,0.5183246731758118
AMZN,Your Boss Doesn’t Have Time to Talk to You,https://finnhub.io/api/news?id=93c6787cb33ca492bde88e1e15521398cbdd31c48308f0cb957ca332dd683a59,2025-08-30T00:00:00Z,positive,0.02401825599372387,0.4576570391654968,0.5183246731758118
NVDA,"Are IPOs Finally Back? CRCL, CRWV",https://finnhub.io/api/news?id=4e688ee0388f7f42f35591e2b6bebc7b2bd36ea885f061fe2a800b5d12925b8d,2025-08-29T23:21:00Z,positive,0.151877298951149,0.02533000148832798,0.8227927088737488
AAPL,"Some Boring Stocks Are Beating Big Techs. Plus, You Can Sleep at Night.",https://finnhub.io/api/news?id=f86ce36c7f25b3128ad8c9b2d9df6ba8e41ba323ec26032466fc22ed03b3d334,2025-08-29T23:00:00Z,positive,0.053988903760910034,0.043982360512018204,0.9020287990570068
GOOGL,"Some Boring Stocks Are Beating Big Techs. Plus, You Can Sleep at Night.",https://finnhub.io/api/news?id=f86ce36c7f25b3128ad8c9b2d9df6ba8e41ba323ec26032466fc22ed03b3d334,2025-08-29T23:00:00Z,positive,0.053988903760910034,0.043982360512018204,0.9020287990570068
NVDA,Wall Street ends lower as Dell and Nvidia drop,https://finnhub.io/api/news?id=fcc2e50cb70346cfb65a3600acea3cb7eeb48f3a46088a0348c65852e6141bb1,2025-08-29T22:03:59Z,neutral,0.009404215961694717,0.9630022644996643,0.027593474835157394
NVDA,NVIDIA Corporation (NVDA): Jim Cramer Says Biggest Concern Is NVIDIA Making Money While No One Else Does,https://finnhub.io/api/news?id=d9e7c4463eb75606285cff6e9cf2ef211f9cd99a52f37548b8f083c23735676f,2025-08-29T21:46:48Z,positive,0.0633503869175911,0.01822110451757908,0.9184284806251526
AAPL,"Apple Inc. (AAPL): The AI “Will Come Into Play Soon,” Says Jim Cramer",https://finnhub.io/api/news?id=7f8285841f53b7454e31d07585ee8cfad9ba457bce2c081c2cd352a8bb57d5f3,2025-08-29T21:46:08Z,negative,0.607704222202301,0.0126876849681139,0.3796080946922302
AMZN,"Jim Cramer Admits He Was Wrong About Amazon.com, Inc. (AMZN) & AI Spending",https://finnhub.io/api/news?id=6d38e467addc046e5a34f5caadd1397ebf89c444a8f97b1e8b8a90ccfb63202f,2025-08-29T21:45:27Z,positive,0.03664460778236389,0.2557610273361206,0.7075943350791931
NVDA,"Jim Cramer Admits He Was Wrong About Amazon.com, Inc. (AMZN) & AI Spending",https://finnhub.io/api/news?id=6d38e467addc046e5a34f5caadd1397ebf89c444a8f97b1e8b8a90ccfb63202f,2025-08-29T21:45:27Z,positive,0.03664460778236389,0.2557610273361206,0.7075943350791931
MSFT,"Everyoone Thinks Microsoft Corporation (MSFT) Spent More And Accelerated Its AI Business, Says Jim Cramer",https://finnhub.io/api/news?id=ae4fdce9271f4fc1058c38b408dae1a507fea51d1a0d08b2923c11ac2745f8fa,2025-08-29T21:45:09Z,negative,0.9475486278533936,0.015465009957551956,0.03698642924427986
NVDA,"Everyoone Thinks Microsoft Corporation (MSFT) Spent More And Accelerated Its AI Business, Says Jim Cramer",https://finnhub.io/api/news?id=ae4fdce9271f4fc1058c38b408dae1a507fea51d1a0d08b2923c11ac2745f8fa,2025-08-29T21:45:09Z,negative,0.9475486278533936,0.015465009957551956,0.03698642924427986
AMZN,"Everyoone Thinks Microsoft Corporation (MSFT) Spent More And Accelerated Its AI Business, Says Jim Cramer",https://finnhub.io/api/news?id=ae4fdce9271f4fc1058c38b408dae1a507fea51d1a0d08b2923c11ac2745f8fa,2025-08-29T21:45:09Z,negative,0.9475486278533936,0.015465009957551956,0.03698642924427986
NVDA,"Direxion Announces Reverse Split of NVDD, EDZ, FAZ, LABD & SPXS",https://finnhub.io/api/news?id=d3e3e6036dc6fb2f501e57388305f401f753a35dfbd32c40871b3b348a2fdc93,2025-08-29T21:45:00Z,positive,0.026975536718964577,0.0413663312792778,0.931658148765564
NVDA,"Palantir Technologies Inc. (PLTR)’s New Name Is “Karpe Diem,’ Says Jim Cramer",https://finnhub.io/api/news?id=0b7893fa3aa7a14d77187aef6b8aa2daa711438778de0f7531e975ede28c6125,2025-08-29T21:43:27Z,positive,0.07213841378688812,0.009557348676025867,0.9183042049407959
MSFT,Dustin Sedgwick joins Intapp as Chief Marketing Officer,https://finnhub.io/api/news?id=8386684deb66f352a6a74699f1b41f7ed81acb09ea676df002f300e33c301444,2025-08-29T21:43:00Z,positive,0.03614216297864914,0.04519549384713173,0.9186623096466064
GOOGL,Dustin Sedgwick joins Intapp as Chief Marketing Officer,https://finnhub.io/api/news?id=8386684deb66f352a6a74699f1b41f7ed81acb09ea676df002f300e33c301444,2025-08-29T21:43:00Z,positive,0.03614216297864914,0.04519549384713173,0.9186623096466064
NVDA,NVIDIA-linked crypto stock jumps 30% after record earnings,https://finnhub.io/api/news?id=da140b5aa5b055de03af01cd73d9012a7c37c845408086e60c605eefe32d140e,2025-08-29T21:40:44Z,negative,0.831762433052063,0.08628348261117935,0.08195407688617706
MSFT,Corrections & Amplifications,https://finnhub.io/api/news?id=52aebb81a358c37c205b298999a7520011486038bfd864a6252657e37ec9ba75,2025-08-29T21:35:00Z,positive,0.024790266528725624,0.03852730244398117,0.936682403087616
NVDA,Jensen Huang Declares 'A New Industrial Revolution Has Started': Sees 100x To 1000x Compute Demand Surge — $3–$4 Trillion 'Opportunity' For Nvidia,https://finnhub.io/api/news?id=e1e4ee81a790bc5c4c4e37071f2ff0d8d1d9b50962c4a1c85b09ff1282411ccf,2025-08-29T21:30:47Z,negative,0.8261362910270691,0.012453929521143436,0.16140975058078766
NVDA,"The Score: Cracker Barrel, Nvidia, Kohl’s and More Stocks That Defined the Week",https://finnhub.io/api/news?id=28c1b78264ad8a43215c1ef11d68a5da3cff803233359fabc1bd6a9fc1c0b0ec,2025-08-29T21:04:00Z,positive,0.06669896095991135,0.02441914938390255,0.9088819026947021
NVDA,How Nvidia is powering the next wave of cloud gaming,https://finnhub.io/api/news?id=80f7d4fd5c2b219501d0b0957ad8448644d437e36ab9a47d6e553c23f036be39,2025-08-29T21:02:43Z,positive,0.07059641182422638,0.01487489603459835,0.9145287275314331
GOOGL,Prediction: This Artificial Intelligence (AI) Stock Will Outperform Palantir Over the Next Decade,https://finnhub.io/api/news?id=5488902a956a7591b02c2f1a558ec59b9ad051beda7d722c5092e74e1fd1eb47,2025-08-29T21:00:00Z,negative,0.948128879070282,0.026466114446520805,0.02540498599410057
NVDA,"Dow Jones Futures: Alibaba News Hits Nvidia, AI Stocks. Why This Isn't DeepSeek 2.0.",https://finnhub.io/api/news?id=3b9c5265153780ed0ae2b75e64afea2d04e30adc12201b16ab4e7193843ade2b,2025-08-29T20:58:23Z,positive,0.039978478103876114,0.09630697965621948,0.8637145161628723
GOOGL,Wall Street’s Momentum Train Hits Full Speed Into September,https://finnhub.io/api/news?id=a39fc938980cf58752adb198268c84d95e68fea89d213bc12f58407dfa34a7be,2025-08-29T20:40:46Z,positive,0.4587843418121338,0.04063313826918602,0.5005825161933899
MSFT,Wall Street’s Momentum Train Hits Full Speed Into September,https://finnhub.io/api/news?id=a39fc938980cf58752adb198268c84d95e68fea89d213bc12f58407dfa34a7be,2025-08-29T20:40:46Z,positive,0.4587843418121338,0.04063313826918602,0.5005825161933899
MSFT,Bill Gates Told NBA's Steph Curry How He'd Answer 'What's Your Salary Expectation?' in a Job Interview — 'I Prefer Stock Options More Than Cash',https://finnhub.io/api/news?id=da230203bf87cb9150f39dd690678b28e2dc73d5377baad9f641a12f295699fe,2025-08-29T20:30:52Z,positive,0.04089682176709175,0.06019517406821251,0.8989080190658569
AMZN,Anthropic Gives Claude Users More Control On Data Use,https://finnhub.io/api/news?id=e98e9bedd471da8bdb6e7bc6a2deb675e688c7aba8a88b484f48438eb013bc47,2025-08-29T20:11:13Z,positive,0.09045504778623581,0.012848823331296444,0.8966960906982422
AAPL,Trump's 100% Chip Tariff Rocks Tech -- But Apple Just Scored the Biggest Exemption Deal Yet,https://finnhub.io/api/news?id=3a283ac2e3e6a8af23a141268d66924551f9851e26cfd7fd324ff3370658dac9,2025-08-29T20:07:34Z,negative,0.7936170101165771,0.011653282679617405,0.194729745388031
NVDA,"Stock market today: Dow, S&P 500, Nasdaq slide on inflation worries, ending 4th winning month lower",https://finnhub.io/api/news?id=9a3a2d07f54611f60654eef3ddc5d33bc43d93d354170d8638b77ccb2b08fa43,2025-08-29T20:03:16Z,neutral,0.014771285466849804,0.9611988067626953,0.024029986932873726
NVDA,"Alibaba, chip stocks, Kraft Heinz: Trending Tickers",https://finnhub.io/api/news?id=fa0b4f54d988f2430e76ad93abe599118010390f3dbfb90335ef6420057a5e97,2025-08-29T19:47:42Z,positive,0.050386618822813034,0.04775555059313774,0.901857852935791
GOOGL,DOJ antitrust head blasts Big Law for obstructive tactics,https://finnhub.io/api/news?id=0111d8426b7c1357bf047e42205a232415ca0ca0294e59e514f1a4be9ebcab3d,2025-08-29T19:35:52Z,positive,0.05856086313724518,0.2695096731185913,0.6719294786453247
AAPL,DOJ antitrust head blasts Big Law for obstructive tactics,https://finnhub.io/api/news?id=0111d8426b7c1357bf047e42205a232415ca0ca0294e59e514f1a4be9ebcab3d,2025-08-29T19:35:52Z,positive,0.05856086313724518,0.2695096731185913,0.6719294786453247
AAPL,TikTok now lets users send voice notes and images in DMs,https://finnhub.io/api/news?id=8290a754965a695f76b4d216c8dd3f2fd0ec8b8084025f56466bdf3c2f907161,2025-08-29T19:15:08Z,positive,0.07090263813734055,0.009338782168924809,0.9197585582733154
GOOGL,What’s New With Alphabet Inc’s (GOOGL) Pixel Smartphones?,https://finnhub.io/api/news?id=102e145f8d17dbbec02c3f81d087fd0ae8465c718a6e32651ea8ee93053960a8,2025-08-29T19:13:05Z,positive,0.03440254181623459,0.18162307143211365,0.7839744091033936
NVDA,NVIDIA Corporation (NVDA) Releases its FQ2 2026 Results,https://finnhub.io/api/news?id=60f3eb3ad6ea7aa365533b615d28f4d9cf531dba60d7e1a973366df1243cfeb3,2025-08-29T19:13:03Z,positive,0.019953569397330284,0.03380536288022995,0.9462410807609558
MSFT,What Does Wall Street Think About Microsoft Corporation (MSFT)?,https://finnhub.io/api/news?id=8cb4aca11242aea3f9da768f473362e4736eb77065fabf2904496c91e71f0d40,2025-08-29T19:13:02Z,positive,0.03303113952279091,0.053652144968509674,0.9133167862892151
NVDA,Dan Ives drops blunt 4-word message on Nvidia’s next phase,https://finnhub.io/api/news?id=0a5c964d61f51a82686b1cfd4b466b0514f720b42a8506d095bb308cd245a804,2025-08-29T19:13:00Z,positive,0.025391891598701477,0.2055612951517105,0.7690469026565552
AMZN,"Citi Reiterates a Buy Rating on Amazon.com (AMZN), Keeps PT",https://finnhub.io/api/news?id=fddf75828e69597d969c8752360ca8decdf6c609e250b07234b5a515d6856036,2025-08-29T19:13:00Z,positive,0.07241765409708023,0.014467606320977211,0.9131147265434265
NVDA,Jim Cramer Recommends Buying or “At Least Hold” NVIDIA,https://finnhub.io/api/news?id=e7b3d18f652eff7bb6d9288519b1cdeabd36c150c5c1bfeafa70b64b883b90f0,2025-08-29T19:05:25Z,positive,0.10623589158058167,0.0173175111413002,0.8764466047286987
NVDA,Oracle Stock Slides In Choppy Market For AI Stocks. What To Watch Next.,https://finnhub.io/api/news?id=ffcd8e511d80099afa55640f8fd03c2b2197cd9d6a73857597229e9dcd89e773,2025-08-29T19:04:52Z,neutral,0.021096650511026382,0.6344307065010071,0.34447264671325684
AMZN,"NVIDIA, Meta and Amazon: Top Momentum Plays in the Mag 7",https://finnhub.io/api/news?id=4ebdcac541d8ba5ee5e1792ec1a686c7c15c78d6ea4ecdd0977a63022d3e8e70,2025-08-29T19:00:00Z,positive,0.10689761489629745,0.012387743219733238,0.8807146549224854
NVDA,Baidu-Backed Kunlunxin Lands $139M AI Chip Deal Amid China’s Nvidia Pivot,https://finnhub.io/api/news?id=a5d21238629f6a7c585185d80f52fce3ea8c3c6e46576fc25d25827089a7fadb,2025-08-29T18:58:19Z,negative,0.8484851717948914,0.04050737991929054,0.11100740730762482
NVDA,Nvidia: Not All That Glitters Is Growth,https://finnhub.io/api/news?id=3db42eb9407e8245552a8841e8bf2bda22248402a539296e701de4816275136e,2025-08-29T18:51:19Z,positive,0.047139909118413925,0.03249925374984741,0.9203608632087708
MSFT,Nvidia: Not All That Glitters Is Growth,https://finnhub.io/api/news?id=3db42eb9407e8245552a8841e8bf2bda22248402a539296e701de4816275136e,2025-08-29T18:51:19Z,positive,0.047139909118413925,0.03249925374984741,0.9203608632087708
GOOGL,Nvidia: Not All That Glitters Is Growth,https://finnhub.io/api/news?id=3db42eb9407e8245552a8841e8bf2bda22248402a539296e701de4816275136e,2025-08-29T18:51:19Z,positive,0.047139909118413925,0.03249925374984741,0.9203608632087708
NVDA,"Nvidia (NVDA) Stock Trades Down, Here Is Why",https://finnhub.io/api/news?id=ac8fbdff72929f1426d5dfa25266b4a7ddcb8166463d058a1472a406594c0627,2025-08-29T18:40:41Z,neutral,0.01626177504658699,0.8023765683174133,0.1813616305589676
NVDA,What the Stock Market Learned About Earnings and Consumers This Summer,https://finnhub.io/api/news?id=879abddab0c839489e3ad8e6087853a87e6e1d01c27cf292d5c8ef65310c4a5d,2025-08-29T18:26:00Z,positive,0.04684332758188248,0.033200304955244064,0.9199563264846802
AMZN,What's Going On With Broadcom Stock Friday?,https://finnhub.io/api/news?id=046d038d598705bc4112b66172886c2f4bbf9790259631af98af1926a6cbc493,2025-08-29T18:24:19Z,positive,0.02512091025710106,0.4622242748737335,0.5126547813415527
MSFT,What's Going On With Broadcom Stock Friday?,https://finnhub.io/api/news?id=046d038d598705bc4112b66172886c2f4bbf9790259631af98af1926a6cbc493,2025-08-29T18:24:19Z,positive,0.02512091025710106,0.4622242748737335,0.5126547813415527
NVDA,What's Going On With Broadcom Stock Friday?,https://finnhub.io/api/news?id=046d038d598705bc4112b66172886c2f4bbf9790259631af98af1926a6cbc493,2025-08-29T18:24:19Z,positive,0.02512091025710106,0.4622242748737335,0.5126547813415527
NVDA,Nvidia and Other AI Stocks Are Falling. Why Investors Are Souring on Artificial Intelligence.,https://finnhub.io/api/news?id=61e8ecdf332993b7342c4cf826cdf0349ec2094f182e26953705b9e5eda92056,2025-08-29T18:19:00Z,neutral,0.011461599729955196,0.9250674843788147,0.06347096711397171
AAPL,WhatsApp fixes ‘zero-click’ bug used to hack Apple users with spyware,https://finnhub.io/api/news?id=81c3b8fcc43fd03240f16e324fd7234b08d258f383ab15dd5bc0b6159eea2bc8,2025-08-29T18:15:55Z,positive,0.07339338958263397,0.21386341750621796,0.7127431631088257
AMZN,The Stock Market’s End-of-August Slide Abated a Bit. Breadth Is Improving.,https://finnhub.io/api/news?id=798606666192fd537e4662721059a0ecef2b06b945864bf4aa993420f96fb70f,2025-08-29T18:13:37Z,negative,0.9484370350837708,0.023371387273073196,0.028191598132252693
AAPL,The Stock Market’s End-of-August Slide Abated a Bit. Breadth Is Improving.,https://finnhub.io/api/news?id=798606666192fd537e4662721059a0ecef2b06b945864bf4aa993420f96fb70f,2025-08-29T18:13:37Z,negative,0.9484370350837708,0.023371387273073196,0.028191598132252693
GOOGL,The Stock Market’s End-of-August Slide Abated a Bit. Breadth Is Improving.,https://finnhub.io/api/news?id=798606666192fd537e4662721059a0ecef2b06b945864bf4aa993420f96fb70f,2025-08-29T18:13:37Z,negative,0.9484370350837708,0.023371387273073196,0.028191598132252693
NVDA,The Stock Market’s End-of-August Slide Abated a Bit. Breadth Is Improving.,https://finnhub.io/api/news?id=798606666192fd537e4662721059a0ecef2b06b945864bf4aa993420f96fb70f,2025-08-29T18:13:37Z,negative,0.9484370350837708,0.023371387273073196,0.028191598132252693
MSFT,The Stock Market’s End-of-August Slide Abated a Bit. Breadth Is Improving.,https://finnhub.io/api/news?id=798606666192fd537e4662721059a0ecef2b06b945864bf4aa993420f96fb70f,2025-08-29T18:13:37Z,negative,0.9484370350837708,0.023371387273073196,0.028191598132252693
AMZN,"Layoffs hit International Paper, J.B. Hunt, Hormel and more",https://finnhub.io/api/news?id=341c89d121d09c1b7cd809520c1e19899b1c7b409fdff770ac5664ba3b3015d2,2025-08-29T18:03:11Z,neutral,0.007787084206938744,0.9704149961471558,0.021797962486743927
GOOGL,"Google set to face modest EU antitrust fine in adtech investigation, sources say",https://finnhub.io/api/news?id=945f07a823d4a43feebae96866b230af40f723cf3e9c2da9e255328ee065e881,2025-08-29T18:01:02Z,neutral,0.11517776548862457,0.8260730504989624,0.05874929577112198
GOOGL,"Exclusive-Google set to face modest EU antitrust fine in adtech investigation, sources say",https://finnhub.io/api/news?id=310056b6240fc40c9242bb1e799bda8228fb681f7f70ad3f682a77efa164662b,2025-08-29T18:01:02Z,neutral,0.16777274012565613,0.7851447463035583,0.04708249866962433
GOOGL,Top Stocks at 52-Week Highs: They Aren't What You Think,https://finnhub.io/api/news?id=dd34c147bf135ea8eb8696a12fccb59642eb25118c5e209ac92eceb1240a4a9b,2025-08-29T18:00:00Z,positive,0.044161729514598846,0.2685813009738922,0.6872569918632507
GOOGL,"Top Stock Reports for Alphabet, Morgan Stanley & ServiceNow",https://finnhub.io/api/news?id=b4100188f16242cf76570a667100e1c01d43c0d81d0036c287266d5d80a39745,2025-08-29T17:53:00Z,positive,0.021998319774866104,0.04283364862203598,0.9351680278778076
NVDA,Why Marvell Technology (MRVL) Shares Are Sliding Today,https://finnhub.io/api/news?id=082fc8674f52dbdc6360516aeb344b110b632e83a064351a0bd83b3f4386a858,2025-08-29T17:46:40Z,neutral,0.009959003888070583,0.9640578031539917,0.025983218103647232
NVDA,Why AMD (AMD) Shares Are Sliding Today,https://finnhub.io/api/news?id=12087331c30a8cbf2e5418aa40a7a8ae460124b73099cbeb2bddde8a92726e23,2025-08-29T17:46:31Z,neutral,0.011770164594054222,0.9498159289360046,0.0384138822555542
GOOGL,Why Broadcom (AVGO) Shares Are Falling Today,https://finnhub.io/api/news?id=ebb65e3d4867d78ca8036234f07c35ff5395316dfcc1117f078ea1db7336111e,2025-08-29T17:46:16Z,neutral,0.00940033420920372,0.9607627391815186,0.029836902394890785
NVDA,Why Broadcom (AVGO) Shares Are Falling Today,https://finnhub.io/api/news?id=ebb65e3d4867d78ca8036234f07c35ff5395316dfcc1117f078ea1db7336111e,2025-08-29T17:46:16Z,neutral,0.00940033420920372,0.9607627391815186,0.029836902394890785
MSFT,Why Broadcom (AVGO) Shares Are Falling Today,https://finnhub.io/api/news?id=ebb65e3d4867d78ca8036234f07c35ff5395316dfcc1117f078ea1db7336111e,2025-08-29T17:46:16Z,neutral,0.00940033420920372,0.9607627391815186,0.029836902394890785
GOOGL,Why Duolingo (DUOL) Shares Are Falling Today,https://finnhub.io/api/news?id=72df164e5e4eeb9bf7cc9d95b693d7aebcb24668f11872f295a1a5be3e470f22,2025-08-29T17:46:00Z,neutral,0.008345616981387138,0.9673784971237183,0.0242758858948946
AMZN,OLN Inc Calls for a Return to Real Connection in a Digital World,https://finnhub.io/api/news?id=28e230423e4fb69e2a43fc5cf40cbb4863408f716dac83dd79aa7d2a4e5b280f,2025-08-29T17:45:00Z,positive,0.1773959994316101,0.008604886010289192,0.8139991760253906
GOOGL,Broadcom Seen Getting AI Lift In Quarterly Report,https://finnhub.io/api/news?id=5abc41d330abd1e450cf71456719320d0670e493b848f69d9ea71084ecbfea21,2025-08-29T17:39:33Z,negative,0.9317041635513306,0.027405500411987305,0.04089023172855377
NVDA,monday.com (MNDY) Sees 11% Price Jump Last Week Amid Broader Tech Market Volatility,https://finnhub.io/api/news?id=5b175cd3c14748dd09bedfea1704fe48cb956e7846acd02a6fa42ce2ad1f135b,2025-08-29T17:35:57Z,negative,0.9196581244468689,0.0549296960234642,0.02541220933198929
AAPL,Musk's xAI sues engineer for allegedly taking secrets to OpenAI,https://finnhub.io/api/news?id=145b75b9dab0319ae20baac9744fbe46134057966bbbb12f664a942ac901cdbc,2025-08-29T17:24:25Z,neutral,0.01974276825785637,0.8635808229446411,0.11667642742395401
MSFT,Marvell Technology (MRVL) Reports Surging US$2 Billion Sales with Positive Earnings Guidance,https://finnhub.io/api/news?id=5b0503c7840afa57dc58b1596ac96f7bc84b861f03807f0745e6b17628e32a16,2025-08-29T17:16:38Z,negative,0.9544714689254761,0.021205319091677666,0.024323241785168648
GOOGL,Google’s new blockchain ledger is set to compete with XRPL,https://finnhub.io/api/news?id=96a65bba5db7fc25c0ed940c5cd79fc3656d624a2585c4d88df900ba45549541,2025-08-29T17:14:51Z,negative,0.6115107536315918,0.007843791507184505,0.3806454837322235
AMZN,Amazon.com (AMZN) Expands Amazon Business With LPL Financial Nationwide Partnership,https://finnhub.io/api/news?id=45b59c0f1d61d57c0a6f3f997b0c79cd802353e411fa5b08e71a4183c02263c3,2025-08-29T17:14:19Z,negative,0.9107221364974976,0.010564611293375492,0.07871322333812714
NVDA,"Nvidia stock slides 3% amid broader chip sell-off after Dell results, Alibaba competition",https://finnhub.io/api/news?id=72494e96faeef55750ae637d64f90aa27ee68f67b5a0fd913d04ebc22c36e8b1,2025-08-29T17:07:56Z,neutral,0.017250942066311836,0.9523859620094299,0.030363112688064575
NVDA,"Nvidia Can Hit $1 Trillion in Annual Revenue in 5 Years, Analyst Says",https://finnhub.io/api/news?id=977a3ce044db1f6a3174d973dff0582399a08ff7b64a4b9e34fef10a2c8941bb,2025-08-29T16:55:00Z,negative,0.8988959789276123,0.009254266507923603,0.09184970706701279
GOOGL,Analyst sends surprising message on AppLovin stock,https://finnhub.io/api/news?id=44a2a051479f466fd9feba757db89517876dd5f453ab380e39300e6e08b758be,2025-08-29T16:33:00Z,negative,0.7097242474555969,0.016300788149237633,0.2739748954772949
NVDA,"Nvidia & Marvell data centers, Duolingo & Google, Gap price target",https://finnhub.io/api/news?id=96321362d847bb93c915cb8ef9d2d90c628622ea02129d79913e645169c4c281,2025-08-29T16:23:21Z,positive,0.08109628409147263,0.04949898272752762,0.8694047331809998
