ticker,title,link,pubDate,sentiment,p_negative,p_neutral,p_positive
AAPL,"Nvidia Is Leading a Mag 7 Selloff, But Breadth Is Mixed",https://finnhub.io/api/news?id=7dda6c214e35a882f712165fa3bf94c9699a39de9f3283c9c2ab1386735fd1d5,2025-08-29T14:35:19Z,neutral,0.14861810207366943,0.7810993790626526,0.07028257846832275
MSFT,"Nvidia Is Leading a Mag 7 Selloff, But Breadth Is Mixed",https://finnhub.io/api/news?id=7dda6c214e35a882f712165fa3bf94c9699a39de9f3283c9c2ab1386735fd1d5,2025-08-29T14:35:19Z,neutral,0.14861810207366943,0.7810993790626526,0.07028257846832275
AAPL,"U.S. Stocks Are Expensive, and Still Set to Outperform the World",https://finnhub.io/api/news?id=06a9e997cb85d58f979010fef8bb97c69beffae4e75a27113d1cfa6a38ec5140,2025-08-29T14:35:00Z,negative,0.5538287162780762,0.3805622160434723,0.06560906767845154
AAPL,Do you wish you'd started investing earlier? Yahoo Finance readers have their say,https://finnhub.io/api/news?id=35057fc996ab0df7915f5fbcf98cf515d995182412e3b23333bb04e6ec417dd8,2025-08-29T14:34:33Z,positive,0.03829583898186684,0.029550446197390556,0.9321537017822266
MSFT,Will Expanding Partnerships Shape the Next Phase of Growth for C3.ai?,https://finnhub.io/api/news?id=ef2239a8892a67612c09b76eb160c414ff5dadc94851181f45a644408cf1585a,2025-08-29T14:32:00Z,positive,0.22261568903923035,0.008191864006221294,0.7691923975944519
AMZN,Will Expanding Partnerships Shape the Next Phase of Growth for C3.ai?,https://finnhub.io/api/news?id=ef2239a8892a67612c09b76eb160c414ff5dadc94851181f45a644408cf1585a,2025-08-29T14:32:00Z,positive,0.22261568903923035,0.008191864006221294,0.7691923975944519
GOOGL,Will Expanding Partnerships Shape the Next Phase of Growth for C3.ai?,https://finnhub.io/api/news?id=ef2239a8892a67612c09b76eb160c414ff5dadc94851181f45a644408cf1585a,2025-08-29T14:32:00Z,positive,0.22261568903923035,0.008191864006221294,0.7691923975944519
MSFT,5 Ways Steve Ballmer Went From Assistant to 8th Richest Person in the World,https://finnhub.io/api/news?id=1557f2065df4a5a3cbf1c67ac369bbadf4d00cea62c29d2f695bda4a0c83995a,2025-08-29T14:16:06Z,positive,0.14251649379730225,0.020784422755241394,0.8366991281509399
NVDA,"Buyers Push Broadcom Stock Higher Ahead Of Quarterly Results, Along With This Fast-Growing AI Name",https://finnhub.io/api/news?id=07941fc073da7ce19e4b46c4ca70809cf9352955ebd4841bf0e256420e196076,2025-08-29T14:14:05Z,negative,0.9394234418869019,0.023272482678294182,0.0373041070997715
GOOGL,"Buyers Push Broadcom Stock Higher Ahead Of Quarterly Results, Along With This Fast-Growing AI Name",https://finnhub.io/api/news?id=07941fc073da7ce19e4b46c4ca70809cf9352955ebd4841bf0e256420e196076,2025-08-29T14:14:05Z,negative,0.9394234418869019,0.023272482678294182,0.0373041070997715
MSFT,Is Oracle Stock Outperforming the Nasdaq?,https://finnhub.io/api/news?id=801966d28af76bc2b5e9f80eeba1cde73db91313fcfa482eddfbc2de92c82062,2025-08-29T14:13:12Z,neutral,0.032218288630247116,0.9092555642127991,0.058526210486888885
AAPL,How Is Alphabet's Stock Performance Compared to Other Internet Stocks?,https://finnhub.io/api/news?id=25f40152ac5fa262c9ba0afeb0d587e4b34ba91fac47592592421458702ee954,2025-08-29T14:05:25Z,positive,0.12453543394804001,0.09420062601566315,0.7812638878822327
AMZN,COSRX's Viral Snail Essence Hits Lowest Price Ever on Amazon Lightning Deal - Over 50% Off for 12 Hours Only,https://finnhub.io/api/news?id=af7db30739689782daff4495716fa0f5069c13998502221692db1ab3e75b01e0,2025-08-29T14:00:00Z,neutral,0.015247087925672531,0.9223275780677795,0.062425363808870316
NVDA,Elon Musk Spotlighted in New Presentation on America’s Next Technological Leap,https://finnhub.io/api/news?id=8f877f4a8e8e1eaed44a5592189b4da5cb952be1c5f21cb2961170e5a9bda138,2025-08-29T14:00:00Z,positive,0.2930038273334503,0.01112124789506197,0.6958749294281006
AAPL,Is Apple Stock Underperforming the Nasdaq?,https://finnhub.io/api/news?id=60c13c5faed272e932c1bd2afe2b5c587442f3ab6e614cf0a577e473264f22b8,2025-08-29T13:58:56Z,neutral,0.029355356469750404,0.8948383927345276,0.07580620795488358
NVDA,"Stocks to Watch Friday: Alibaba, Dell, Caterpillar, Ulta",https://finnhub.io/api/news?id=99c0069b838111b6cc10f1fa4ac55a466afa6887a7e4d99fd89af78eaa38e3c2,2025-08-29T13:54:01Z,positive,0.04005658999085426,0.029836438596248627,0.9301069974899292
NVDA,"Stocks to Watch Friday: Dell, Alibaba, Caterpillar, Ulta",https://finnhub.io/api/news?id=c16339f0777a134493a462ff3ebbe6f55b7a980597809c6e7494d44c930446b3,2025-08-29T13:54:01Z,positive,0.041995447129011154,0.03262585401535034,0.9253787398338318
AMZN,Americans kept spending last month despite elevated inflation,https://finnhub.io/api/news?id=88472db745cab33f1ef7e48c0dbfa161f893c9c833abbc4c26f6d5c74bf02ab1,2025-08-29T13:52:40Z,negative,0.8179059028625488,0.10863710939884186,0.0734570175409317
NVDA,"Nvidia Has Huge Opportunity in China, Munster Says",https://finnhub.io/api/news?id=9c2f774330d650d8a1534c3328651acdeefbfd6c4e302768da0831ac431ad2d9,2025-08-29T13:47:16Z,negative,0.7960556149482727,0.006387318018823862,0.19755709171295166
AAPL,Nvidia’s Hyper-Growth Keeps Stock Valuation Out of Bubble Zone,https://finnhub.io/api/news?id=d4d78747ba85bcf194f892d694e6a22293ca2d7100b17c1bd96b18f7b2af76dc,2025-08-29T13:47:05Z,neutral,0.2555336058139801,0.6938629746437073,0.050603318959474564
GOOGL,Nvidia’s Hyper-Growth Keeps Stock Valuation Out of Bubble Zone,https://finnhub.io/api/news?id=d4d78747ba85bcf194f892d694e6a22293ca2d7100b17c1bd96b18f7b2af76dc,2025-08-29T13:47:05Z,neutral,0.2555336058139801,0.6938629746437073,0.050603318959474564
MSFT,Nvidia’s Hyper-Growth Keeps Stock Valuation Out of Bubble Zone,https://finnhub.io/api/news?id=d4d78747ba85bcf194f892d694e6a22293ca2d7100b17c1bd96b18f7b2af76dc,2025-08-29T13:47:05Z,neutral,0.2555336058139801,0.6938629746437073,0.050603318959474564
NVDA,Dell Falls After Reporting Tighter Profit Margins on Servers,https://finnhub.io/api/news?id=00bbbc57b0020fb3c0ae049bb92d0190a738c2e369f9b03eb40819d912d7eb67,2025-08-29T13:46:41Z,neutral,0.02087823674082756,0.9635267853736877,0.01559491641819477
NVDA,Wall Street Roundup: Valuation Concerns And Uncharted Waters,https://finnhub.io/api/news?id=2d4e43a13b64fb765f958ec277c1e78c50afa85b080a365cef73de0d4fd50465,2025-08-29T13:45:00Z,positive,0.05931217223405838,0.1478365659713745,0.7928513288497925
NVDA,PCE Inflation Data Passes First Test Of Fed Rate-Cut Shift (Live Coverage),https://finnhub.io/api/news?id=a58df3aad071a7e31142ffa0c2d401de0d2ce260c4d99833eb42d71f66048d05,2025-08-29T13:41:29Z,positive,0.08273399621248245,0.02026713825762272,0.8969988822937012
MSFT,"Marvell downgraded, Dollar Tree upgraded: Wall Street's top analyst calls",https://finnhub.io/api/news?id=ce54f17cd59d36ff86737a5c22faf76008fc0b20196a61f44f1a50ba9cf96dd0,2025-08-29T13:38:54Z,positive,0.2820087671279907,0.09544160217046738,0.6225495934486389
AMZN,"Marvell downgraded, Dollar Tree upgraded: Wall Street's top analyst calls",https://finnhub.io/api/news?id=ce54f17cd59d36ff86737a5c22faf76008fc0b20196a61f44f1a50ba9cf96dd0,2025-08-29T13:38:54Z,positive,0.2820087671279907,0.09544160217046738,0.6225495934486389
NVDA,"What to watch next week: US jobs data, Salesforce, Broadcom, American Eagle and Berkeley",https://finnhub.io/api/news?id=e365f3b7d4c0ef4f9072cd513c1e996c1bf983270988a5ae306b6fc04a9b74d1,2025-08-29T13:38:44Z,positive,0.02321326732635498,0.04092160612344742,0.9358651041984558
NVDA,"Stock market today: Dow, S&P 500, Nasdaq fall from records after PCE inflation data",https://finnhub.io/api/news?id=f560e815972597b72794a228f58eb990b71427e8eb24583c8bf12c84c47617a5,2025-08-29T13:38:00Z,neutral,0.009716535918414593,0.960453987121582,0.029829468578100204
NVDA,Bitcoin Miner And AI Play Iren Jumps 26% On Earnings And This New Nvidia Status,https://finnhub.io/api/news?id=1b130b1cbc5acc2122153b57f0af96f7e321daeed1e78ae2dccfc762e1db5171,2025-08-29T13:33:15Z,negative,0.9363025426864624,0.026812631636857986,0.03688487410545349
NVDA,Podcast: Alibaba Develops New AI Chip to Fill Nvidia Void,https://finnhub.io/api/news?id=0dbc8d861bc64c97abf94f2fe50fb1ee9300daa78563ded04f0abcc6a28883e1,2025-08-29T13:25:08Z,positive,0.3964327871799469,0.011965764686465263,0.5916014313697815
NVDA,IREN Stock Is Climbing 21%. Here’s How Nvidia Is Playing a Part.,https://finnhub.io/api/news?id=91b6daa0b09645d41e941c899ee4e6aecdae7b2feb96696e6895426537dce877,2025-08-29T13:20:00Z,positive,0.1709594428539276,0.013185899704694748,0.8158546686172485
GOOGL,"Billionaire Ambani taps Google, Meta to build India’s AI backbone",https://finnhub.io/api/news?id=63fbc891f974a0044ec09c91fb25ecb9b41ef829a59f89e4aac0caf347806a7b,2025-08-29T13:19:10Z,positive,0.3394530117511749,0.012003229930996895,0.6485437750816345
AMZN,"Should You Buy the Low-Cost ETF With 62% Invested in ""Ten Titans"" Growth Stocks?",https://finnhub.io/api/news?id=51a8cf1dbc7a28c77f0dfe6552dc6b26f5bb6ba695fdfdfb98f77097f04f4b7c,2025-08-29T13:15:00Z,positive,0.07996353507041931,0.010581879876554012,0.9094545841217041
MSFT,"Should You Buy the Low-Cost ETF With 62% Invested in ""Ten Titans"" Growth Stocks?",https://finnhub.io/api/news?id=51a8cf1dbc7a28c77f0dfe6552dc6b26f5bb6ba695fdfdfb98f77097f04f4b7c,2025-08-29T13:15:00Z,positive,0.07996353507041931,0.010581879876554012,0.9094545841217041
AAPL,"Should You Buy the Low-Cost ETF With 62% Invested in ""Ten Titans"" Growth Stocks?",https://finnhub.io/api/news?id=51a8cf1dbc7a28c77f0dfe6552dc6b26f5bb6ba695fdfdfb98f77097f04f4b7c,2025-08-29T13:15:00Z,positive,0.07996353507041931,0.010581879876554012,0.9094545841217041
GOOGL,"Should You Buy the Low-Cost ETF With 62% Invested in ""Ten Titans"" Growth Stocks?",https://finnhub.io/api/news?id=51a8cf1dbc7a28c77f0dfe6552dc6b26f5bb6ba695fdfdfb98f77097f04f4b7c,2025-08-29T13:15:00Z,positive,0.07996353507041931,0.010581879876554012,0.9094545841217041
NVDA,Nvidia Stock Slips. Why Wall Street Still Loves the Shares.,https://finnhub.io/api/news?id=08256d02f0840b0dcd1db913b3f9924fa1fb158c3b5b2b23e1a577879c486213,2025-08-29T13:09:00Z,neutral,0.029000699520111084,0.8057562112808228,0.16524308919906616
AMZN,Will Sterling Continue to Expand Further Into the E-Commerce Space?,https://finnhub.io/api/news?id=c5d58d7449c53e9a904538a4b38287899122711674516d8395192e0ee7894e41,2025-08-29T13:03:00Z,negative,0.7493283748626709,0.008171739988029003,0.2424999624490738
AAPL,Investors Heavily Search Apple Inc. (AAPL): Here is What You Need to Know,https://finnhub.io/api/news?id=b26a5fd665ed5bfd0c93d0a6de562e6513bf26400b0e19c43f46b25b5db11cfe,2025-08-29T13:00:03Z,positive,0.029638158157467842,0.03046168014407158,0.9399001598358154
MSFT,Oracle Corporation (ORCL) Benefited From Strong Cloud Operations,https://finnhub.io/api/news?id=fd6afd5e5c659fadf6306c1b4fbb80c72cbe0ba3874cad2dad7a589e9a59833a,2025-08-29T12:50:38Z,negative,0.94491046667099,0.010435432195663452,0.04465418681502342
GOOGL,Oracle Corporation (ORCL) Benefited From Strong Cloud Operations,https://finnhub.io/api/news?id=fd6afd5e5c659fadf6306c1b4fbb80c72cbe0ba3874cad2dad7a589e9a59833a,2025-08-29T12:50:38Z,negative,0.94491046667099,0.010435432195663452,0.04465418681502342
NVDA,"These Stocks Are Moving the Most Today: Marvell, Dell, Nvidia, Alibaba, Affirm, Autodesk, Elastic, Celsius, and More",https://finnhub.io/api/news?id=dcdceb746244dcc3788dabde66882c3129896dfbb6cb13b058d1689b35592a49,2025-08-29T12:50:00Z,positive,0.18174363672733307,0.02533533237874508,0.7929210066795349
MSFT,Is Microsoft Stock Outperforming the S&P 500?,https://finnhub.io/api/news?id=756c7bebfe6de93818642c33416e34bbe5b008ab1a8f997f71f839ea9248f40a,2025-08-29T12:46:17Z,neutral,0.05078230798244476,0.8457110524177551,0.10350657999515533
NVDA,BofA update shows where active managers are putting money,https://finnhub.io/api/news?id=c6b7c927995db0d134e5e0aba674663a789a8010a56e033c9e33b94cd7161cd8,2025-08-29T12:44:27Z,positive,0.022822769358754158,0.04183412343263626,0.9353431463241577
MSFT,BofA update shows where active managers are putting money,https://finnhub.io/api/news?id=c6b7c927995db0d134e5e0aba674663a789a8010a56e033c9e33b94cd7161cd8,2025-08-29T12:44:27Z,positive,0.022822769358754158,0.04183412343263626,0.9353431463241577
GOOGL,Latest News In Cloud AI - Expanding AI Infrastructure: Applied Digital's Major Lease Agreement,https://finnhub.io/api/news?id=d27d3bb6e23fe1ab7a28bd054692b916fbe067d1b447b02c72d056c047151847,2025-08-29T12:37:58Z,negative,0.7679492235183716,0.008570854552090168,0.22347991168498993
AAPL,Latest News In Cloud AI - Expanding AI Infrastructure: Applied Digital's Major Lease Agreement,https://finnhub.io/api/news?id=d27d3bb6e23fe1ab7a28bd054692b916fbe067d1b447b02c72d056c047151847,2025-08-29T12:37:58Z,negative,0.7679492235183716,0.008570854552090168,0.22347991168498993
MSFT,Latest News In Cloud AI - Expanding AI Infrastructure: Applied Digital's Major Lease Agreement,https://finnhub.io/api/news?id=d27d3bb6e23fe1ab7a28bd054692b916fbe067d1b447b02c72d056c047151847,2025-08-29T12:37:58Z,negative,0.7679492235183716,0.008570854552090168,0.22347991168498993
NVDA,The Market Is Teaching The Bears A Lesson,https://finnhub.io/api/news?id=ec0f8ee77792fa283a49e91432d3a0d8fad833bd8f37f64564ae92fa8f39604f,2025-08-29T12:36:13Z,positive,0.21009854972362518,0.028710678219795227,0.7611907124519348
MSFT,Marvell Stock Tumbles. Why the AI Chip Player Keeps Disappointing the Market.,https://finnhub.io/api/news?id=b0c0f246d6190277deb8606af8eef5c60a0ad4fa67031c7110f620753d4254fe,2025-08-29T12:25:00Z,neutral,0.017793478444218636,0.8985195159912109,0.08368705213069916
AMZN,Marvell Stock Tumbles. Why the AI Chip Player Keeps Disappointing the Market.,https://finnhub.io/api/news?id=b0c0f246d6190277deb8606af8eef5c60a0ad4fa67031c7110f620753d4254fe,2025-08-29T12:25:00Z,neutral,0.017793478444218636,0.8985195159912109,0.08368705213069916
NVDA,Marvell Stock Tumbles. Why the AI Chip Player Keeps Disappointing the Market.,https://finnhub.io/api/news?id=b0c0f246d6190277deb8606af8eef5c60a0ad4fa67031c7110f620753d4254fe,2025-08-29T12:25:00Z,neutral,0.017793478444218636,0.8985195159912109,0.08368705213069916
GOOGL,Alphabet Stock Continues to Rise on Urban Mobility Innovation,https://finnhub.io/api/news?id=feb0d47ca9f8a4e8a8b26616b114cb6a29316c4e1683e06f488746a3499be5b2,2025-08-29T12:24:00Z,negative,0.9436001181602478,0.01583394594490528,0.04056595638394356
AMZN,Alphabet Stock Continues to Rise on Urban Mobility Innovation,https://finnhub.io/api/news?id=feb0d47ca9f8a4e8a8b26616b114cb6a29316c4e1683e06f488746a3499be5b2,2025-08-29T12:24:00Z,negative,0.9436001181602478,0.01583394594490528,0.04056595638394356
NVDA,"Dow Jones Futures Fall, Fed Inflation Data Due; 7 New Buys After Nvidia Test",https://finnhub.io/api/news?id=91c3795ad9c9b6563855f7cd95d3a669003b0d9a77e31185e78e51d334b92576,2025-08-29T12:13:15Z,neutral,0.1326424777507782,0.540104329586029,0.32725319266319275
NVDA,AMD: Left In Nvidia's Dust As Valuations Reach Excessive Levels (Downgrade),https://finnhub.io/api/news?id=9d24b5c7819b318f6cb33e19cb75841609ff8babf87483ea5570025e0db74d04,2025-08-29T12:09:29Z,neutral,0.008103487081825733,0.9310846328735352,0.06081189960241318
AAPL,Apple's 'Invisible' AI Strategy Weighs On Its Stock. What Worries Wall Street.,https://finnhub.io/api/news?id=51d53d4e20e2711d1d88b6a8e0d10461a1a0bf7d6716f041d398b52b61d53a41,2025-08-29T12:00:42Z,neutral,0.019562184810638428,0.7199560403823853,0.26048174500465393
AAPL,Omnipod Maker Insulet Is In A Buy Zone As Its Market Expands To Millions,https://finnhub.io/api/news?id=2c40d6d49c1478b81806de9bcd3664308614ad8d6a778df49c0f669cb0d1b10f,2025-08-29T12:00:20Z,negative,0.8751687407493591,0.009023348800837994,0.1158079132437706
GOOGL,5 Things to Know Before the Stock Market Opens,https://finnhub.io/api/news?id=0a92d9419844b856c09bd2bfd0ee9ac8c65ff4e08760fcd7c98cbe1d84c88461,2025-08-29T11:43:02Z,positive,0.029239438474178314,0.03756119683384895,0.933199405670166
GOOGL,Google and Fox Renew YouTube TV Deal. Why It Makes Sense for Both.,https://finnhub.io/api/news?id=f48202230bad46d0caae7ce2ed797fbd7766689422ee3dae114810daa7e88b74,2025-08-29T11:38:00Z,positive,0.1057204157114029,0.01579558290541172,0.8784840106964111
MSFT,BofA downgrades Marvell to Neutral on AI growth concerns,https://finnhub.io/api/news?id=875458c3113446ed83e020795a71a8f47ee2a0d66598cc9812e86a684631850c,2025-08-29T11:35:47Z,neutral,0.030257124453783035,0.8529133796691895,0.11682946979999542
AMZN,BofA downgrades Marvell to Neutral on AI growth concerns,https://finnhub.io/api/news?id=875458c3113446ed83e020795a71a8f47ee2a0d66598cc9812e86a684631850c,2025-08-29T11:35:47Z,neutral,0.030257124453783035,0.8529133796691895,0.11682946979999542
AAPL,"As Warren Buffett Continues to Trim Apple Stake, Should Investors Be Worried?",https://finnhub.io/api/news?id=07edcde1e5715bd000f1f47b653f0c4b12e7c641c3681db65ad9a6850b831d9f,2025-08-29T11:30:00Z,neutral,0.04695955663919449,0.4976731240749359,0.4553673267364502
NVDA,"NVDY: Nvidia Implied Volatility Drops Hard Post Earnings, Weak Calendar Stretch",https://finnhub.io/api/news?id=74c31dc2987bfdcf5f892a29cfb8624573be0b9a6095b8951b29fecca774e0b7,2025-08-29T11:26:48Z,neutral,0.01615617610514164,0.9647670388221741,0.0190767552703619
NVDA,AI Earnings Lead To Record Gains,https://finnhub.io/api/news?id=72c5ec7c2aa21074f8e40598b24226760aeb4bb78edb63e339ab5c7b57542b08,2025-08-29T11:05:00Z,negative,0.9295765161514282,0.033650048077106476,0.036773473024368286
AMZN,Is Amazon.com Stock Outperforming the S&P 500?,https://finnhub.io/api/news?id=3d2f64d6a865b357470a538fc33c7f15b09cf1307108398313c9999412ab2c8d,2025-08-29T10:59:43Z,neutral,0.030420608818531036,0.9080309867858887,0.06154846027493477
NVDA,AMD: There Is Still Time To Accumulate Shares,https://finnhub.io/api/news?id=a346e3a0d8a653e17b5ebf2ea1ca4cbb715df92eeb352cf84e8e7e94dd99c08c,2025-08-29T10:49:36Z,positive,0.07630856335163116,0.02620832249522209,0.8974831700325012
MSFT,Microsoft unveils MAI-Voice-1 and MAI-1 Preview models,https://finnhub.io/api/news?id=8ccae2d5da9acf3cf10bf3861d394dde8ac9578d8e4f1c13efd69597936adc6b,2025-08-29T10:37:33Z,positive,0.052758291363716125,0.011394399218261242,0.9358473420143127
AAPL,Here Are Billionaire Warren Buffett's 5 Biggest Stock Holdings,https://finnhub.io/api/news?id=7d7b2d053f24da8fcb809d527711ce48a6c1167ebf6606e23aed518b9a8ac7c6,2025-08-29T10:22:00Z,positive,0.02603120356798172,0.035513248294591904,0.9384555220603943
MSFT,Why Rubrik (RBRK) Is Up 9.1% After Strong Revenue Growth and Free Cash Flow Milestone,https://finnhub.io/api/news?id=d7325415b47aed66f060f8f471603f2cc39405b951a7cf6d8fac29ce06e127b5,2025-08-29T10:15:35Z,negative,0.9561673402786255,0.01998063549399376,0.02385208010673523
MSFT,Is Datadog’s Rebound a Sign of More Growth After Microsoft Azure Partnership?,https://finnhub.io/api/news?id=92097cb1051cf2d37f17051e552a9ac4f3ddb66a841114eb1cdf2af9857b95e4,2025-08-29T10:14:06Z,negative,0.837389349937439,0.04133901372551918,0.12127160280942917
GOOGL,A Fresh Look at Google's (GOOGL) Valuation After Defense AI Deal and New Pixel Launch,https://finnhub.io/api/news?id=cad2feec4247c6b1d857e6b1ee09162d12eedf247bc8d752a36118f4916de5ff,2025-08-29T10:12:43Z,positive,0.1031380444765091,0.011633521877229214,0.8852284550666809
AAPL,What the New TuneIn Partnership Means for Apple Stock’s Valuation in 2025,https://finnhub.io/api/news?id=b09f377f565aa52847610673d2c9474ce9ed35d17ae880a5ccb0e7ae61c1c68b,2025-08-29T10:11:00Z,positive,0.040873512625694275,0.014564202167093754,0.9445621967315674
MSFT,Nvidia's Big Tech clientele looks like a vulnerability but acts like a chokehold,https://finnhub.io/api/news?id=cc15cb2085bde397cf26c3eedc2b578fc21b2ef45f3c9eb3e9f477f917213574,2025-08-29T10:00:11Z,positive,0.032824479043483734,0.07466906309127808,0.8925065398216248
AMZN,Nvidia's Big Tech clientele looks like a vulnerability but acts like a chokehold,https://finnhub.io/api/news?id=cc15cb2085bde397cf26c3eedc2b578fc21b2ef45f3c9eb3e9f477f917213574,2025-08-29T10:00:11Z,positive,0.032824479043483734,0.07466906309127808,0.8925065398216248
GOOGL,Nvidia's Big Tech clientele looks like a vulnerability but acts like a chokehold,https://finnhub.io/api/news?id=cc15cb2085bde397cf26c3eedc2b578fc21b2ef45f3c9eb3e9f477f917213574,2025-08-29T10:00:11Z,positive,0.032824479043483734,0.07466906309127808,0.8925065398216248
GOOGL,Is Alphabet A Buy As It Retests The All Time Peak?,https://finnhub.io/api/news?id=6bafb55116f13ca9b40be5328a97eade5823a9ad2ac5a6a369de2ef8922c8c6f,2025-08-29T10:00:03Z,positive,0.1704457700252533,0.021982526406645775,0.8075717687606812
GOOGL,"When You Look Back in a Few Years, You'll Wish You'd Bought These 2 ""Magnificent Seven"" Stocks",https://finnhub.io/api/news?id=d4d4be0b6f2dbb8dd3aa2df5053ef1f13558d1fb8b9eda993798fb311115fd07,2025-08-29T09:59:00Z,positive,0.050952062010765076,0.017825322225689888,0.9312226176261902
MSFT,"When You Look Back in a Few Years, You'll Wish You'd Bought These 2 ""Magnificent Seven"" Stocks",https://finnhub.io/api/news?id=d4d4be0b6f2dbb8dd3aa2df5053ef1f13558d1fb8b9eda993798fb311115fd07,2025-08-29T09:59:00Z,positive,0.050952062010765076,0.017825322225689888,0.9312226176261902
AMZN,"When You Look Back in a Few Years, You'll Wish You'd Bought These 2 ""Magnificent Seven"" Stocks",https://finnhub.io/api/news?id=d4d4be0b6f2dbb8dd3aa2df5053ef1f13558d1fb8b9eda993798fb311115fd07,2025-08-29T09:59:00Z,positive,0.050952062010765076,0.017825322225689888,0.9312226176261902
AAPL,"When You Look Back in a Few Years, You'll Wish You'd Bought These 2 ""Magnificent Seven"" Stocks",https://finnhub.io/api/news?id=d4d4be0b6f2dbb8dd3aa2df5053ef1f13558d1fb8b9eda993798fb311115fd07,2025-08-29T09:59:00Z,positive,0.050952062010765076,0.017825322225689888,0.9312226176261902
MSFT,"Telecom Vendors Report 2Q 2025: Telco NI Vendor Revenues Hit $54.3 Billion in 2Q25, Signaling Recovery",https://finnhub.io/api/news?id=03977aee0b7dd86ca51f5167582309bf3c527b4daabdd30095a979c257beae1b,2025-08-29T09:44:00Z,negative,0.9334239363670349,0.02006351947784424,0.046512532979249954
GOOGL,"Telecom Vendors Report 2Q 2025: Telco NI Vendor Revenues Hit $54.3 Billion in 2Q25, Signaling Recovery",https://finnhub.io/api/news?id=03977aee0b7dd86ca51f5167582309bf3c527b4daabdd30095a979c257beae1b,2025-08-29T09:44:00Z,negative,0.9334239363670349,0.02006351947784424,0.046512532979249954
AMZN,"Telecom Vendors Report 2Q 2025: Telco NI Vendor Revenues Hit $54.3 Billion in 2Q25, Signaling Recovery",https://finnhub.io/api/news?id=03977aee0b7dd86ca51f5167582309bf3c527b4daabdd30095a979c257beae1b,2025-08-29T09:44:00Z,negative,0.9334239363670349,0.02006351947784424,0.046512532979249954
AAPL,Why Peloton Could Triple (Or More) In The Next 5 Years,https://finnhub.io/api/news?id=01c67494684a2adf25d00eaacffa90a1e2e42bb795338f3bcf9f904976946b3e,2025-08-29T09:41:04Z,positive,0.35308903455734253,0.01493997685611248,0.6319710612297058
MSFT,Microsoft Corporation (MSFT) Announces its Quantum Safe Program Strategy; UBS Reaffirms ‘Buy’ Rating With $650 PT,https://finnhub.io/api/news?id=e3ebb4415d864ea682edec8fc0f8417efe02dc1d53993e74489e6724231bcb52,2025-08-29T09:32:08Z,positive,0.3485550284385681,0.028081756085157394,0.623363196849823
NVDA,Intel: Some Hope Is Better Than None (Upgrade),https://finnhub.io/api/news?id=5efaee350bf757c41adbf4cc96549c53b0af49b7942c230ecaf35a1d60a54ea0,2025-08-29T09:30:33Z,positive,0.23549431562423706,0.01190393790602684,0.7526018023490906
GOOGL,"Argus Research Initiates Coverage on Reddit, Inc. (RDDT) With $250 PT; Deutsche Bank Raises PT to $205",https://finnhub.io/api/news?id=222ba70fb68da377e9603be7d3b63728a1cff8c05a67ae65ccdfcc5ff02faac8,2025-08-29T09:24:32Z,negative,0.776838481426239,0.009984586387872696,0.2131769359111786
AMZN,Intel Corporation (INTC) Talks about New Xeon 6 Processors; Bank of American Reaffirms ‘Neutral’ Rating,https://finnhub.io/api/news?id=0e5f9ef0de246da9112477be45318f5fc38bfb7378049598133909d54db18a8b,2025-08-29T09:22:18Z,positive,0.2995268404483795,0.03183774650096893,0.6686354279518127
AAPL,"Prediction: This ""Ten Titans"" Growth Stock Will Join the $3 Trillion Club Before the End of 2027",https://finnhub.io/api/news?id=9a0ba26e4bab2f1d379f0f5e8fee0ebb03d24dd86b12befcb2256c3c4e5f98db,2025-08-29T09:00:00Z,positive,0.07064943015575409,0.010398110374808311,0.918952465057373
MSFT,"Prediction: This ""Ten Titans"" Growth Stock Will Join the $3 Trillion Club Before the End of 2027",https://finnhub.io/api/news?id=9a0ba26e4bab2f1d379f0f5e8fee0ebb03d24dd86b12befcb2256c3c4e5f98db,2025-08-29T09:00:00Z,positive,0.07064943015575409,0.010398110374808311,0.918952465057373
GOOGL,Artifical Intelligence (AI) Is on Sale: 2 Stocks Smart Investors Are Buying Now,https://finnhub.io/api/news?id=9a9c117034d7fa1a88a75b861e9796305a6c5a7fa959374681b982c770e7f1b0,2025-08-29T09:00:00Z,positive,0.09873928129673004,0.010834833607077599,0.8904259204864502
GOOGL,"Prediction: This ""Ten Titans"" Growth Stock Will Join the $3 Trillion Club Before the End of 2027",https://finnhub.io/api/news?id=9a0ba26e4bab2f1d379f0f5e8fee0ebb03d24dd86b12befcb2256c3c4e5f98db,2025-08-29T09:00:00Z,positive,0.07064943015575409,0.010398110374808311,0.918952465057373
AMZN,"Prediction: This ""Ten Titans"" Growth Stock Will Join the $3 Trillion Club Before the End of 2027",https://finnhub.io/api/news?id=9a0ba26e4bab2f1d379f0f5e8fee0ebb03d24dd86b12befcb2256c3c4e5f98db,2025-08-29T09:00:00Z,positive,0.07064943015575409,0.010398110374808311,0.918952465057373
GOOGL,Billionaire Ambani plans to take Reliance Jio public by mid-2026,https://finnhub.io/api/news?id=2063171bad5e0850f0e8aed45d02ae71b2a33ceef1266b958f76f00df233437a,2025-08-29T08:59:15Z,positive,0.07810874283313751,0.009968570433557034,0.9119226932525635
AAPL,"3 Fantastic (but Overlooked) Growth Stocks to Invest $1,000 in Right Now",https://finnhub.io/api/news?id=bc27603a9033f7473538ed00af67d28922df5fbb991c21a9e0bb733ad57f43cc,2025-08-29T08:55:00Z,positive,0.06638877093791962,0.016153568401932716,0.917457640171051
