ticker,title,link,pubDate,sentiment,p_negative,p_neutral,p_positive
GOOGL,Google's AI Overviews hit by EU antitrust complaint from independent publishers,https://finnhub.io/api/news?id=53b699eaa479ef605f67ce78103145fe3e1cfd26b59fbbb15aed8cbb6f7322bf,2025-07-04T07:32:21Z,neutral,0.014527857303619385,0.9565936326980591,0.02887851931154728
AMZN,Jefferies Maintains Buy on Nike Amid HOKA’s Slowing Sales Growth,https://finnhub.io/api/news?id=8e9fe84136752d4f902c04d1258d011c1bb821ddb4ff8b3175f52efd90b46a84,2025-07-04T07:31:49Z,neutral,0.025552621111273766,0.9509237408638,0.023523716256022453
AMZN,Billionaire Bill Ackman May Be the Next Warren Buffett. He's Buying 2 Magnificent Stocks Up 160% and 270% Since 2023.,https://finnhub.io/api/news?id=5e5418242434fa7fb91839bf674676a7e10a871a28db51c3026989d06cc24d3e,2025-07-04T07:12:00Z,positive,0.308087557554245,0.01435976941138506,0.6775527000427246
GOOGL,4 Of The Hottest Great American SWANs For The 4th Of July,https://finnhub.io/api/news?id=dfaec0a584272a4a57fdf3b61ced853bfd9b287e52cd978cbb7f3774e5db259d,2025-07-04T07:00:00Z,positive,0.06511232256889343,0.020976120606064796,0.9139115810394287
NVDA,Markets' 90-day tariff pause rollercoaster nears an uncertain end,https://finnhub.io/api/news?id=3f18acd35d58b2bd9fe45882ea194b5041f9080230181a0a05b1cda23b344df2,2025-07-04T06:59:21Z,neutral,0.10551556944847107,0.6138296127319336,0.28065481781959534
MSFT,Jim Cramer Says “Meta is a Ridiculously Cheap Stock”,https://finnhub.io/api/news?id=5670ebe0f236e8eab0f819055eefa6e44ba2aeb7c4cd0d0aad3e703d3838a621,2025-07-04T06:55:08Z,positive,0.03934222087264061,0.09196143597364426,0.8686963319778442
MSFT,Jim Cramer Says “NVIDIA’s Artificial Intelligence Chips Remain Unrivaled”,https://finnhub.io/api/news?id=285821f57b3bf6ba04dda269d1a08dadc63526bfed329c645ec14cd306901651,2025-07-04T06:55:06Z,neutral,0.040515102446079254,0.8670008778572083,0.09248405694961548
MSFT,Jim Cramer Notes “Microsoft Doesn’t Miss More Than Once”,https://finnhub.io/api/news?id=91e821ca3a2ac8924d16ad8de703350fd165b997a125e55102e3d2237f8f0871,2025-07-04T06:55:04Z,positive,0.07455029338598251,0.0710483118891716,0.8544014096260071
GOOGL,Google Invests in Nuclear Fusion with Power Purchase Agreement for Virginia Plant,https://finnhub.io/api/news?id=c816ea3ec6bf6eba88e088249a96608179fef2e1c778fc2751428dd7fe6d0cf3,2025-07-04T06:53:39Z,positive,0.24510157108306885,0.0063803852535784245,0.7485180497169495
MSFT,"Microsoft Unveils MAI-DxO, AI System Outperforming Human Doctors in Disease Diagnosis",https://finnhub.io/api/news?id=1ac8cc84b60dd8dc0a7764af8609edb50787672f998764a89627bb03c635e28b,2025-07-04T06:53:35Z,negative,0.845342218875885,0.09628020972013474,0.05837763845920563
MSFT,"Robinhood Launches Tokenized US Stocks, ETFs for EU Customers, Partners with Arbitrum",https://finnhub.io/api/news?id=7cda45e3b8cbd5d96413fcc378b2b9ca4ce5051fcaec4cee6be523b55336e56f,2025-07-04T06:43:01Z,positive,0.19577656686306,0.007112863007932901,0.7971105575561523
AAPL,"Robinhood Launches Tokenized US Stocks, ETFs for EU Customers, Partners with Arbitrum",https://finnhub.io/api/news?id=7cda45e3b8cbd5d96413fcc378b2b9ca4ce5051fcaec4cee6be523b55336e56f,2025-07-04T06:43:01Z,positive,0.19577656686306,0.007112863007932901,0.7971105575561523
AAPL,"Circus SE Gets Awarded International Red Dot Award ""Best of Best"" for Outstanding Industrial Design",https://finnhub.io/api/news?id=cc2ec16300e4d61164e03990583bf138d56ef505f39c6077d31d75a32885f388,2025-07-04T06:03:00Z,negative,0.9024980068206787,0.014555566944181919,0.08294645696878433
AAPL,The most popular stocks and funds investors bought in June,https://finnhub.io/api/news?id=2d26eb406c6c915e0b2b419250b98a96c158331cb43b78b04c129a144aaae3f7,2025-07-04T05:01:00Z,positive,0.07033314555883408,0.01857464388012886,0.9110921621322632
GOOGL,Alphabet: About To Go Into Beast Mode With AI,https://finnhub.io/api/news?id=9c19f4d8e56edaba9a6d77f946e8fcaa1d8bc1f2119fdaa7cd24fdd20060e204,2025-07-04T04:53:54Z,positive,0.05699018016457558,0.1530310958623886,0.7899787425994873
AAPL,Alphabet: About To Go Into Beast Mode With AI,https://finnhub.io/api/news?id=9c19f4d8e56edaba9a6d77f946e8fcaa1d8bc1f2119fdaa7cd24fdd20060e204,2025-07-04T04:53:54Z,positive,0.05699018016457558,0.1530310958623886,0.7899787425994873
MSFT,1 Profitable Stock to Target This Week and 2 to Approach with Caution,https://finnhub.io/api/news?id=d77484ed9d3179456e6ba3eed544cb15e0f5d90051fc8a5641b97cd33bdde0a5,2025-07-04T04:40:28Z,positive,0.2060198187828064,0.010114336386322975,0.7838658690452576
NVDA,Take Five: The tariff man cometh,https://finnhub.io/api/news?id=30e25628fea3a17dbfcc781ce9d647ab4c0c76e227769036eaf000e278974b42,2025-07-04T03:40:19Z,positive,0.03418181091547012,0.04309011995792389,0.9227281212806702
AMZN,What Amazon Needs To Break Out,https://finnhub.io/api/news?id=65b76d5a45d8e12b2595e6d5c7d2d241fe9fe2df9c4fb26b59865c8011bbc927,2025-07-04T03:38:14Z,positive,0.061317846179008484,0.015736669301986694,0.922945499420166
AAPL,Consumer Electronics Stocks Q1 Highlights: Apple (NASDAQ:AAPL),https://finnhub.io/api/news?id=74f862e14434c179b0ef98af71d27a09d7c7c9168ebb35ebb53995570433d220,2025-07-04T03:34:25Z,positive,0.04777867719531059,0.028378119692206383,0.9238432049751282
NVDA,Dell's AI Orders Are Surging - Thanks To Nvidia,https://finnhub.io/api/news?id=a64f6fe34b623d9f1425b354a2ce2cc898be11452f6ab4a70dcba6cf368033b8,2025-07-04T02:55:37Z,negative,0.9377191066741943,0.03162107616662979,0.030659930780529976
AMZN,"Amazon Hits 1 Million Robots, Should Human Workers Be Worried?: Company Says 'Creating New Career Opportunities'",https://finnhub.io/api/news?id=230a37d8cd9a32432bb9df9284bae49472461281a404a4ee5984c1e12e4c084a,2025-07-04T01:31:12Z,negative,0.6399736404418945,0.020958952605724335,0.3390674293041229
GOOGL,Could This Surprise Company Become Nvidia's Biggest Competitor?,https://finnhub.io/api/news?id=23818208f9e9c397e42ffef5274ca681d9372d5222ff6baa7a76f0386805988d,2025-07-04T00:23:00Z,positive,0.0731264278292656,0.02347312867641449,0.9034004211425781
NVDA,Could This Surprise Company Become Nvidia's Biggest Competitor?,https://finnhub.io/api/news?id=23818208f9e9c397e42ffef5274ca681d9372d5222ff6baa7a76f0386805988d,2025-07-04T00:23:00Z,positive,0.0731264278292656,0.02347312867641449,0.9034004211425781
NVDA,Prediction: 2 Stocks That Will Be Worth More Than Nvidia 5 Years From Now,https://finnhub.io/api/news?id=662e130c14540d76a18b3253e402d128a0f0abe3292121e4de9ff12b377e65fb,2025-07-04T00:14:00Z,positive,0.3280777037143707,0.009043114259839058,0.6628791093826294
NVDA,Asian Fund Pivots to Samsung Bet After Riding Pop Mart Rally,https://finnhub.io/api/news?id=60466fc5cfef74ce50668b6f5bd2cf0190077cb89ac2dc75fb2e4935fb3566c9,2025-07-03T23:00:00Z,positive,0.3178543746471405,0.04329734668135643,0.6388482451438904
NVDA,"XSD: Relative Strength Emerging In SMID Semis, Reiterate Buy Amid The AI Boom",https://finnhub.io/api/news?id=7e7b4086d7ac05cf3c4fe87bb29088221f4e470399a5855551b5146063b6e779,2025-07-03T22:49:00Z,negative,0.9473066926002502,0.016970502212643623,0.03572281822562218
NVDA,Nvidia (NVDA) Outpaces Stock Market Gains: What You Should Know,https://finnhub.io/api/news?id=29c1480528b71d8120e783928da043b0fbb8c0f662f0d0f4d107ee29eb49fc27,2025-07-03T21:45:04Z,positive,0.18607695400714874,0.015727242454886436,0.7981957793235779
NVDA,$3.92 Trillion Shock: Nvidia Is Coming for Apple's Throne,https://finnhub.io/api/news?id=1341b17a8fa8efc4df92c274ee62e3a6355e93c6f92a22fecde0ecaced882254,2025-07-03T21:44:45Z,positive,0.08488170057535172,0.023871401324868202,0.8912468552589417
GOOGL,La Caisse firmly rejects allegations that it facilitates or encourages international crimes through its investments,https://finnhub.io/api/news?id=fd1486cb31b4797854a57591c1ac832a8867c02a0af9715fb023b3c73a7f59df,2025-07-03T21:35:00Z,positive,0.06648743897676468,0.146845281124115,0.7866672873497009
MSFT,"Microsoft Slashes 9,000 Jobs While Mark Zuckerberg's Meta Poaches $20 Million Worth Of AI Talent From OpenAI: Investor Warns Of 'Jealousy, Envy, And Helplessness' Among Tech Workers In Silicon Valley",https://finnhub.io/api/news?id=57d992c02f64c496ee3e43c8cca89ae09214ff971ca4e6849e319bce0310b3d7,2025-07-03T21:31:18Z,neutral,0.009244411252439022,0.9586827158927917,0.03207283467054367
MSFT,Microsoft Stock Climbs as Layoffs Force Cancellation of Top Xbox Games,https://finnhub.io/api/news?id=f2a5aa4839edcafc0ea5e0fa0ccc77ae9a34d4d9cd5e9fc992f22b5806b0264d,2025-07-03T21:13:42Z,neutral,0.02064535766839981,0.9602768421173096,0.01907775178551674
AMZN,"Stock Market Week: OPEC, Big 12, Amazon Prime Day And Tariffs Deadline",https://finnhub.io/api/news?id=1931a2bfae0fc620d2b18df4107498573d308fe8f62e776a91f8217007b0a673,2025-07-03T21:09:11Z,positive,0.0351850651204586,0.01971776783466339,0.9450972080230713
MSFT,"Microsoft Lays Off 9,000; Trims Layers, Reorganizes for Speed",https://finnhub.io/api/news?id=88687dfd9e175231b7fd25089e75ca471849f24631a7a9f46741ba361c790759,2025-07-03T21:04:03Z,positive,0.265941321849823,0.03288641944527626,0.7011722922325134
MSFT,"Veteran fund manager makes bold move on Apple, Marvell",https://finnhub.io/api/news?id=7e321798df69afe3a18d6960e45f613ca63cc33ce5e5d174ffa124737852be63,2025-07-03T20:50:34Z,negative,0.5316473245620728,0.011948657222092152,0.45640406012535095
AMZN,"Veteran fund manager makes bold move on Apple, Marvell",https://finnhub.io/api/news?id=7e321798df69afe3a18d6960e45f613ca63cc33ce5e5d174ffa124737852be63,2025-07-03T20:50:34Z,negative,0.5316473245620728,0.011948657222092152,0.45640406012535095
AAPL,"Veteran fund manager makes bold move on Apple, Marvell",https://finnhub.io/api/news?id=7e321798df69afe3a18d6960e45f613ca63cc33ce5e5d174ffa124737852be63,2025-07-03T20:50:34Z,negative,0.5316473245620728,0.011948657222092152,0.45640406012535095
AAPL,"Top Research Reports for Apple, Oracle & Goldman Sachs",https://finnhub.io/api/news?id=269e5c37778439a934e597a5247b0230b578ba3f2e69dbe1b0cefdca3a76bee6,2025-07-03T20:25:00Z,positive,0.033757053315639496,0.027058681473135948,0.9391842484474182
NVDA,Stocks Hit Record Highs. What’s Behind the Rally.,https://finnhub.io/api/news?id=7ee056f5fba6637ef5ad62d31c50c0c7c06d9c03f30752886ee3f434ee07fac7,2025-07-03T20:22:00Z,positive,0.08258967101573944,0.04327070340514183,0.8741396069526672
NVDA,Nvidia Just Made History -- And Wall Street's Still Buying,https://finnhub.io/api/news?id=e580164108cc5088120069d718d720188ecacf6a9a3f3cae5364cd1a6b37c114,2025-07-03T19:55:35Z,positive,0.22720825672149658,0.011073718778789043,0.7617180347442627
GOOGL,Alphabet Breakup Could Unleash Cloud Growth -- Analyst Calls It a 'Top Pick',https://finnhub.io/api/news?id=b61b826b63e5182684b695c5c802e4cbbf99f32b2835a4077fe829c1fa708878,2025-07-03T19:30:57Z,negative,0.7900246977806091,0.010679138824343681,0.19929613173007965
AMZN,Looking for a summer read? Barnes & Noble is on track to open more than 60 new bookstores this year. Here’s where,https://finnhub.io/api/news?id=6e9231a14d975116fc0d79624d3a041ab9997b587c55b71ae6b857782d3c9bdd,2025-07-03T19:30:00Z,positive,0.10182707011699677,0.013368363492190838,0.8848045468330383
NVDA,Market Talk: Nvidia's soaring value shows tech's long-term dominance,https://finnhub.io/api/news?id=9130906f2c81ea2b1bf28c26462542655fc2f1f1470a9d5f431971fa1beb7838,2025-07-03T19:06:05Z,negative,0.9054172039031982,0.01670786179602146,0.07787492126226425
AMZN,UPS drivers to receive buyout offer as company shrinks parcel network,https://finnhub.io/api/news?id=f9be295d8331b3eab57c1c9c0f4accfebe5efcbf3adc490318875e6009448d86,2025-07-03T19:03:07Z,negative,0.5643364787101746,0.17867901921272278,0.25698456168174744
AMZN,Better AI Stock for 2H25: NVIDIA or Palantir?,https://finnhub.io/api/news?id=913e3b0ab000c8e8d598c946d316144687e381bb3d585198ca6f134b2a732c5e,2025-07-03T19:00:00Z,positive,0.12245205044746399,0.013888382352888584,0.8636595606803894
NVDA,Better AI Stock for 2H25: NVIDIA or Palantir?,https://finnhub.io/api/news?id=913e3b0ab000c8e8d598c946d316144687e381bb3d585198ca6f134b2a732c5e,2025-07-03T19:00:00Z,positive,0.12245205044746399,0.013888382352888584,0.8636595606803894
GOOGL,Better AI Stock for 2H25: NVIDIA or Palantir?,https://finnhub.io/api/news?id=913e3b0ab000c8e8d598c946d316144687e381bb3d585198ca6f134b2a732c5e,2025-07-03T19:00:00Z,positive,0.12245205044746399,0.013888382352888584,0.8636595606803894
MSFT,Better AI Stock for 2H25: NVIDIA or Palantir?,https://finnhub.io/api/news?id=913e3b0ab000c8e8d598c946d316144687e381bb3d585198ca6f134b2a732c5e,2025-07-03T19:00:00Z,positive,0.12245205044746399,0.013888382352888584,0.8636595606803894
AAPL,Dow Jones Futures: Market Hits Highs Into Holiday; Tesla Rival Uber Leads 5 Stocks In Buy Zones,https://finnhub.io/api/news?id=c7b08f8e6a743c19c42fb12a5400f6f9a32317a9c4af03afdbf1fde027435060,2025-07-03T18:54:47Z,negative,0.7470481395721436,0.06021907180547714,0.19273287057876587
NVDA,Dow Jones Futures: Market Hits Highs Into Holiday; Tesla Rival Uber Leads 5 Stocks In Buy Zones,https://finnhub.io/api/news?id=c7b08f8e6a743c19c42fb12a5400f6f9a32317a9c4af03afdbf1fde027435060,2025-07-03T18:54:47Z,negative,0.7470481395721436,0.06021907180547714,0.19273287057876587
MSFT,Nvidia Could Be About To Do Something No Company Has Ever Done,https://finnhub.io/api/news?id=14ab142511210465e4b4eff959aa05d92ba2019d9c28382e1cc6e1d96704d3cf,2025-07-03T18:51:18Z,positive,0.03962120786309242,0.06477348506450653,0.8956052660942078
AAPL,Nvidia Could Be About To Do Something No Company Has Ever Done,https://finnhub.io/api/news?id=14ab142511210465e4b4eff959aa05d92ba2019d9c28382e1cc6e1d96704d3cf,2025-07-03T18:51:18Z,positive,0.03962120786309242,0.06477348506450653,0.8956052660942078
NVDA,Nvidia Could Be About To Do Something No Company Has Ever Done,https://finnhub.io/api/news?id=14ab142511210465e4b4eff959aa05d92ba2019d9c28382e1cc6e1d96704d3cf,2025-07-03T18:51:18Z,positive,0.03962120786309242,0.06477348506450653,0.8956052660942078
NVDA,Advanced Micro Devices Stock Gets RS Rating Lift,https://finnhub.io/api/news?id=454e588f3b34b98ecdf089b3e9f5dad579cd2ea69517a90176d3aedc0658dbe4,2025-07-03T18:37:26Z,negative,0.5911648273468018,0.02165367640554905,0.38718152046203613
AMZN,"Archaeologists in Peru unveil 3,500-year-old city that linked coast and Andes",https://finnhub.io/api/news?id=2665d6f9ca5dd3cc6d108e1e88513aca099981038913509e84ee72a30d22cfc5,2025-07-03T18:25:11Z,positive,0.08790821582078934,0.02072904072701931,0.8913627862930298
NVDA,"These Stocks Moved the Most Today: Tesla, Lucid, Datadog, Nvidia, Synopsys, Tripadvisor, Olo, and More",https://finnhub.io/api/news?id=d290d53cef887f51144830f59029997bd0e07190329e3fd5a7cb864f58c638e5,2025-07-03T18:11:00Z,positive,0.15676605701446533,0.022713804617524147,0.8205201029777527
NVDA,Coreweave Gets First Nvidia GB300 AI Servers From Dell,https://finnhub.io/api/news?id=2ece458ff7e072dc19e5f3a69b520185b225fb799a4df7097b7238236506487c,2025-07-03T18:05:40Z,positive,0.19034503400325775,0.009137127548456192,0.8005178570747375
NVDA,5 tech stock picks for the second half of 2025: Dan Ives,https://finnhub.io/api/news?id=0fbba5d27b64653769aa89b70eb954064d27a8d2b591c082052ec66289e6371d,2025-07-03T17:43:21Z,positive,0.047428492456674576,0.02987581491470337,0.9226956367492676
MSFT,5 tech stock picks for the second half of 2025: Dan Ives,https://finnhub.io/api/news?id=0fbba5d27b64653769aa89b70eb954064d27a8d2b591c082052ec66289e6371d,2025-07-03T17:43:21Z,positive,0.047428492456674576,0.02987581491470337,0.9226956367492676
MSFT,Clean-energy backers blast US budget bill as a setback,https://finnhub.io/api/news?id=b7223e76d6ea63345cc4e6de8b8abfda07e601cea8b4e970bb06110ce6cd3b32,2025-07-03T17:40:12Z,neutral,0.012532738037407398,0.9600647687911987,0.027402585372328758
MSFT,Top AI Stocks to Add to Your Portfolio for Impressive Returns,https://finnhub.io/api/news?id=547b6f56711e9aac738b997b2752c0b40372c9500d3db3f50667f7c062c4351f,2025-07-03T17:34:00Z,positive,0.42549291253089905,0.012111716903746128,0.5623953342437744
NVDA,3 Top Value Stocks at 52-Week Highs,https://finnhub.io/api/news?id=ab54fa1c1e08eb8d0e6c71904d67cd3e3ea17a7652e9a7e517110eadac5478dc,2025-07-03T17:32:00Z,positive,0.1334761381149292,0.15503306686878204,0.71149080991745
NVDA,NVIDIA (NasdaqGS:NVDA) Powers IREN's AI Cloud Growth with Blackwell GPU Expansion,https://finnhub.io/api/news?id=d2142c3be5c2ca72bd8735288fc6d70e6473fd58f9ba52dc9a7793a9fabfd6d9,2025-07-03T17:19:56Z,negative,0.7585943937301636,0.006955071818083525,0.23445048928260803
NVDA,Nvidia stock closes at record as AI chipmaker nears being crowned most valuable company in history,https://finnhub.io/api/news?id=f1f15469bfd399a0172dc28363641da3fe19afc00f661b14bdac9bc82cb95e14,2025-07-03T17:17:43Z,negative,0.5535923838615417,0.2503645122051239,0.19604308903217316
AAPL,Nvidia stock closes at record as AI chipmaker nears being crowned most valuable company in history,https://finnhub.io/api/news?id=f1f15469bfd399a0172dc28363641da3fe19afc00f661b14bdac9bc82cb95e14,2025-07-03T17:17:43Z,negative,0.5535923838615417,0.2503645122051239,0.19604308903217316
NVDA,CoreWeave Is First to Deploy Nvidia Blackwell Ultra GPUs. Dell Is Providing the Servers.,https://finnhub.io/api/news?id=7b8c8a000f94acae0e18e0a71e97e71b488d737ffcacb1bfac43eef555cac718,2025-07-03T17:17:00Z,positive,0.0904160737991333,0.010482173413038254,0.8991017937660217
AMZN,What Makes Atlas the Core Driver of MongoDB's Revenue Growth?,https://finnhub.io/api/news?id=5881140ee664c200341dd480fb776fad64028a1b0dcdfb060b6d4517cf186e49,2025-07-03T17:16:00Z,positive,0.07450135052204132,0.0113122733309865,0.9141863584518433
AAPL,Apple Edges Higher After Surprise iPhone Growth in China,https://finnhub.io/api/news?id=61382ef73f760e346fc09a9cd8c7a3c8184c0a9fc77cb1825ee77d7e90bbe553,2025-07-03T17:11:53Z,negative,0.9131515026092529,0.05149516463279724,0.03535328060388565
AAPL,Stock Market Today: Dow Rallies 300 Points Amid Hawkish Fed Talk; Four Stocks Break Out(Live Coverage),https://finnhub.io/api/news?id=4c5908a39dca7e39e45916bdb5157d2f77d846350e40aa115bb0c663c700d168,2025-07-03T16:49:15Z,positive,0.3133389949798584,0.2321580946445465,0.4545028805732727
AMZN,UPS to offer voluntary buyout packages to its US drivers,https://finnhub.io/api/news?id=1490369721ffcd8952a6a1b785b52be96be9b0b580653dbe9a6bd4775a57330b,2025-07-03T16:34:05Z,negative,0.6765823364257812,0.007544809021055698,0.3158729076385498
AMZN,Truist Lifts Amazon Target to $250 Ahead of Q2,https://finnhub.io/api/news?id=617628f4bbc1c3786ac9a60442de6d281636a87a6df0a92910bb497572c0f1a5,2025-07-03T16:32:04Z,negative,0.8714598417282104,0.02322913333773613,0.10531105101108551
AAPL,Foxconn's China Pullback Won't Slow iPhone Output,https://finnhub.io/api/news?id=f0a18831ebc04db6ca7c29f56cd20505ad52723a9cc119ec59f7dbe664742d5c,2025-07-03T16:25:09Z,neutral,0.1391545683145523,0.5117689967155457,0.3490764796733856
AMZN,TSX posts record closing high as investors cheer U.S. jobs data,https://finnhub.io/api/news?id=40dd67272d42aa5f3b5d19615c3119ef186d889f727ceccd8c2f743c8dd17721,2025-07-03T16:20:10Z,negative,0.8508455753326416,0.08366882055997849,0.06548561155796051
MSFT,Okta Eyes 15% Revenue CAGR by FY26: What's the Upside Potential?,https://finnhub.io/api/news?id=d35f6b548a144d46060ea4f4d507fdd6e8a446a8eb982ba105fcea6be7899fdc,2025-07-03T16:17:00Z,positive,0.05669144541025162,0.1047167032957077,0.8385918736457825
NVDA,CoreWeave Becomes First Hyperscaler to Deploy NVIDIA GB300 NVL72 Platform,https://finnhub.io/api/news?id=09cad58d26e1db004d8dab078de04f86c4750af5e7740c5ae196c35648b3238b,2025-07-03T16:14:00Z,positive,0.45861905813217163,0.008313004858791828,0.5330678820610046
GOOGL,D-Wave's Quantum Rally Keeps Defying Gravity,https://finnhub.io/api/news?id=71f3079d6f66a75e96c814bb1606a21f73d92b02d8d67dc684f786f6ca8d64f7,2025-07-03T16:04:14Z,negative,0.6231105327606201,0.026632143184542656,0.35025733709335327
MSFT,Who Won and Lost in Trump’s Tax Bill,https://finnhub.io/api/news?id=7d5dff599ac87a1048e4a8bfce067ad3577f665bd2645c01e39e28ee474855e8,2025-07-03T16:00:00Z,positive,0.09220828860998154,0.05300283804535866,0.8547888398170471
NVDA,Nvidia Stock One of the Best to Own in Q3,https://finnhub.io/api/news?id=bb01aad6183b1d118034d5d53ec0c41b66c5e5793146380acb9cd1c881fc5e34,2025-07-03T15:57:41Z,negative,0.6704767346382141,0.009215380996465683,0.3203078806400299
GOOGL,Google's Dual-Box Plan Seeks to Avert DMA Fines,https://finnhub.io/api/news?id=bfaa5492a58f930ecb267a04129218a3f6186bd13fe23c0b2a4c4ade1aff5ad7,2025-07-03T15:52:01Z,positive,0.3302176594734192,0.011530398391187191,0.6582520008087158
MSFT,NYLI Epoch Capital Growth Fund Q1 2025 Commentary,https://finnhub.io/api/news?id=44ce4aa1183d54d1cc68a60977a76860f8e6ba94986335e2391c2f688557a0ba,2025-07-03T15:52:00Z,positive,0.049391090869903564,0.014692849479615688,0.9359160661697388
AMZN,NYLI Epoch Capital Growth Fund Q1 2025 Commentary,https://finnhub.io/api/news?id=44ce4aa1183d54d1cc68a60977a76860f8e6ba94986335e2391c2f688557a0ba,2025-07-03T15:52:00Z,positive,0.049391090869903564,0.014692849479615688,0.9359160661697388
NVDA,NYLI Epoch Capital Growth Fund Q1 2025 Commentary,https://finnhub.io/api/news?id=44ce4aa1183d54d1cc68a60977a76860f8e6ba94986335e2391c2f688557a0ba,2025-07-03T15:52:00Z,positive,0.049391090869903564,0.014692849479615688,0.9359160661697388
GOOGL,NYLI Epoch Capital Growth Fund Q1 2025 Commentary,https://finnhub.io/api/news?id=44ce4aa1183d54d1cc68a60977a76860f8e6ba94986335e2391c2f688557a0ba,2025-07-03T15:52:00Z,positive,0.049391090869903564,0.014692849479615688,0.9359160661697388
AAPL,NYLI Epoch Capital Growth Fund Q1 2025 Commentary,https://finnhub.io/api/news?id=44ce4aa1183d54d1cc68a60977a76860f8e6ba94986335e2391c2f688557a0ba,2025-07-03T15:52:00Z,positive,0.049391090869903564,0.014692849479615688,0.9359160661697388
NVDA,‘It's a Miracle’: Nvidia CEO Says Their New Technology Takes ‘AI Supercomputing to a Whole New Level’,https://finnhub.io/api/news?id=8c270955a28539fb79ae4ea5e3e36355443859d54d976576b615e87e42ded369,2025-07-03T15:40:09Z,negative,0.7273781895637512,0.009827484376728535,0.2627943754196167
NVDA,"Nvidia, AI Data Center Stocks Get Price-Target Hikes",https://finnhub.io/api/news?id=01e76f985c533a55379520787b8f1f704318e0da4ec20ef8b85dcf0d303b0d4c,2025-07-03T15:26:05Z,neutral,0.04851691424846649,0.8647685647010803,0.08671453595161438
AMZN,BofA sees improving ad market boosting Roku’s outlook as it lifts target,https://finnhub.io/api/news?id=984a80e25e295af94e1e4f1731207add9f646839e2ff4e1580224a502c071d96,2025-07-03T15:20:53Z,negative,0.9532926082611084,0.01760260947048664,0.029104802757501602
MSFT,Microsoft Recalibrates Its AI Chip Roadmap,https://finnhub.io/api/news?id=fe0f0289416bfc8a637979c5ead90d6ceea9d3dc991304a52891bcbdee351267,2025-07-03T15:12:42Z,positive,0.0742364451289177,0.015130060724914074,0.9106334447860718
MSFT,Ex-OpenAI Board Member Questions Meta Hiring Spree,https://finnhub.io/api/news?id=788eea815d6b08c49d04d159abd465c3f9c20af1f455b0b6d0557226381fc814,2025-07-03T15:09:00Z,neutral,0.023823585361242294,0.7079776525497437,0.26819872856140137
NVDA,Dell Technologies Partners With Lowe to Provide Its AI and PC Technology Solutions,https://finnhub.io/api/news?id=0302a409e3c808a674f63ddc48b12fee4a184f47a555a0e1bf71e3d2b4b9196f,2025-07-03T14:57:36Z,negative,0.534640371799469,0.007749264128506184,0.45761042833328247
GOOGL,Don't Sleep on Alphabet Stock This July,https://finnhub.io/api/news?id=0232cd5e77a2f553799ab4dfab78fbd0b45fec000d13588cbe0c0e154cdefadd,2025-07-03T14:55:01Z,positive,0.038138117641210556,0.05469098687171936,0.907170832157135
NVDA,"Microsoft, Nvidia to Lead AI-Driven Tech Rally in H2, Wedbush Says",https://finnhub.io/api/news?id=820fb946c9fcf4192ef767266dd35022425ee48f7e7439101b1466a525a61e0a,2025-07-03T14:53:07Z,negative,0.8129088282585144,0.009525162167847157,0.17756597697734833
MSFT,"Microsoft, Nvidia to Lead AI-Driven Tech Rally in H2, Wedbush Says",https://finnhub.io/api/news?id=820fb946c9fcf4192ef767266dd35022425ee48f7e7439101b1466a525a61e0a,2025-07-03T14:53:07Z,negative,0.8129088282585144,0.009525162167847157,0.17756597697734833
AAPL,"'I Still Feel Responsibility,' Says Ex-Apple Executive Sir Jony Ive, Pledging to Fix Tech's Harms With $6.4 Billion AI Device",https://finnhub.io/api/news?id=40fdc733f1fa3c6a09e1f39d22b33f8ef32e1f737a987634e7d1cd8b81c409bc,2025-07-03T14:47:56Z,negative,0.8017110824584961,0.024660971015691757,0.17362786829471588
AMZN,NYLI Fiera SMID Growth Fund Q1 2025 Commentary,https://finnhub.io/api/news?id=3c03cd0f06f0718c414d1203caa71674924fe036afea734df88029bd2d501d5c,2025-07-03T14:40:00Z,positive,0.050415631383657455,0.014311905018985271,0.9352723956108093
NVDA,NYLI Fiera SMID Growth Fund Q1 2025 Commentary,https://finnhub.io/api/news?id=3c03cd0f06f0718c414d1203caa71674924fe036afea734df88029bd2d501d5c,2025-07-03T14:40:00Z,positive,0.050415631383657455,0.014311905018985271,0.9352723956108093
GOOGL,NYLI Fiera SMID Growth Fund Q1 2025 Commentary,https://finnhub.io/api/news?id=3c03cd0f06f0718c414d1203caa71674924fe036afea734df88029bd2d501d5c,2025-07-03T14:40:00Z,positive,0.050415631383657455,0.014311905018985271,0.9352723956108093
MSFT,Canada needs to get serious about digital sovereignty and scrapping the DST won't help,https://finnhub.io/api/news?id=3678fcbce94502c0122f18b0af84601755b4f11245499c26a7aafb3a374072d7,2025-07-03T14:28:09Z,positive,0.08720256388187408,0.12436538934707642,0.7884320616722107
AMZN,Nvidia set to become world's most valuable company in history,https://finnhub.io/api/news?id=86320375b38362ed934fa99c2c7691ef94c2941d858bf4ccd281d346ddc597d8,2025-07-03T14:25:12Z,negative,0.7480471730232239,0.010852393694221973,0.24110041558742523
MSFT,Nvidia set to become world's most valuable company in history,https://finnhub.io/api/news?id=052822546cd1d2ac3b76746066e836b4683db5f7b593272f016e9ac3bb1010b3,2025-07-03T14:25:12Z,negative,0.7480471730232239,0.010852393694221973,0.24110041558742523
