ticker,title,link,pubDate,sentiment,p_negative,p_neutral,p_positive
AAPL,Apple: Think Different? Time To Think Again About Innovation,https://finnhub.io/api/news?id=8a6700fd2efa78ce7eddde32177ed61a088dddc843925ee127d1fa8c10c2bac4,2025-06-30T11:19:43Z,positive,0.04607825726270676,0.03989899903535843,0.9140227437019348
GOOGL,Apple: Think Different? Time To Think Again About Innovation,https://finnhub.io/api/news?id=8a6700fd2efa78ce7eddde32177ed61a088dddc843925ee127d1fa8c10c2bac4,2025-06-30T11:19:43Z,positive,0.04607825726270676,0.03989899903535843,0.9140227437019348
NVDA,Apple: Think Different? Time To Think Again About Innovation,https://finnhub.io/api/news?id=8a6700fd2efa78ce7eddde32177ed61a088dddc843925ee127d1fa8c10c2bac4,2025-06-30T11:19:43Z,positive,0.04607825726270676,0.03989899903535843,0.9140227437019348
AMZN,Apple: Think Different? Time To Think Again About Innovation,https://finnhub.io/api/news?id=8a6700fd2efa78ce7eddde32177ed61a088dddc843925ee127d1fa8c10c2bac4,2025-06-30T11:19:43Z,positive,0.04607825726270676,0.03989899903535843,0.9140227437019348
AAPL,"Backed Finance Debuts Tokenized Stocks on Bybit, Kraken and Solana DeFi Protocols",https://finnhub.io/api/news?id=d98f7373df4bc24a35e91e0860d13d3dd93f146a34ae85b21f2776bbd5c14efd,2025-06-30T11:04:47Z,positive,0.04157574847340584,0.015779094770550728,0.9426451921463013
GOOGL,Options Flow Alert: Bulls Making Their Move in GOOGL Stock,https://finnhub.io/api/news?id=b22e0d1f1714e7524db47c0d672cd8fc3a7fdb90659a83f27ace1b91047055f1,2025-06-30T11:00:02Z,positive,0.046817950904369354,0.10323189944028854,0.8499501943588257
AAPL,Apple Inc.(NasdaqGS: AAPL) added to Russell 1000 Dynamic Index,https://finnhub.io/api/news?id=bc889fc3e5e7b5da7f830b0bfc9d45d574739c6027563f842e7e72d7c09c3c02,2025-06-30T10:51:03Z,positive,0.11780216544866562,0.013036364689469337,0.8691614866256714
GOOGL,Trump Tariffs and Inflation Could Rain on Stock Markets’ Summer Surge. Here’s Why and 5 More Things to Know Today.,https://finnhub.io/api/news?id=a7cd3c271a925f9002e6380feb6b991d3866397fb9a7fd4f269e4224c56f0c41,2025-06-30T10:46:00Z,positive,0.024658236652612686,0.09576255083084106,0.8795792460441589
AAPL,Trump Tariffs and Inflation Could Rain on Stock Markets’ Summer Surge. Here’s Why and 5 More Things to Know Today.,https://finnhub.io/api/news?id=a7cd3c271a925f9002e6380feb6b991d3866397fb9a7fd4f269e4224c56f0c41,2025-06-30T10:46:00Z,positive,0.024658236652612686,0.09576255083084106,0.8795792460441589
GOOGL,The Trade Desk's Amazon Threat Is Misguided,https://finnhub.io/api/news?id=9da769a84f1045c77576795fde66748872107211c379cad7de19f52b837cefab,2025-06-30T10:45:16Z,neutral,0.03421672061085701,0.6117185354232788,0.35406479239463806
AMZN,The Trade Desk's Amazon Threat Is Misguided,https://finnhub.io/api/news?id=9da769a84f1045c77576795fde66748872107211c379cad7de19f52b837cefab,2025-06-30T10:45:16Z,neutral,0.03421672061085701,0.6117185354232788,0.35406479239463806
AAPL,Takeaways From Apple WWDC 2025: Is It Time To Upgrade?,https://finnhub.io/api/news?id=9a0e090bb1097c6b8574c51434b716981f7c4cc6711d074ca46490c9c47d02e7,2025-06-30T10:40:00Z,positive,0.18958568572998047,0.013822375796735287,0.7965918779373169
AMZN,Vietnam's Viettel Group Excels at the Prestigious Global Technology Awards,https://finnhub.io/api/news?id=d9ad9017c4b4bcced818ba62093dddf9c62c7169ca8b0d9b4524d54a5750fc6e,2025-06-30T10:01:00Z,negative,0.9009782075881958,0.010473820380866528,0.0885479599237442
MSFT,AI stock plays you may be overlooking,https://finnhub.io/api/news?id=858f2e1600b821487bb779994acb663962e37fa38cb945b0ec3b1c7a4779a0ab,2025-06-30T10:00:32Z,positive,0.06909983605146408,0.2092839628458023,0.7216162085533142
AMZN,AI stock plays you may be overlooking,https://finnhub.io/api/news?id=858f2e1600b821487bb779994acb663962e37fa38cb945b0ec3b1c7a4779a0ab,2025-06-30T10:00:32Z,positive,0.06909983605146408,0.2092839628458023,0.7216162085533142
AAPL,Apple: The World's Most Expensive Utility? (Rating Downgrade),https://finnhub.io/api/news?id=d913f6512eabfb1d97bdaebaa26238288f0d4b7f6b90b9c92457956cedb59c4b,2025-06-30T09:51:37Z,positive,0.03460564464330673,0.13284143805503845,0.8325528502464294
GOOGL,Cintas: Beautiful And Boring But Trading At A Premium,https://finnhub.io/api/news?id=3448c18a73067dccb0016541b0b6bfd98201e6cea2d83cdc4fc95ec8f55a72dc,2025-06-30T09:32:15Z,positive,0.05013314262032509,0.06316810846328735,0.8866987228393555
NVDA,"These Stocks Are Moving the Most Today: Enphase, Tesla, Juniper Networks, Wells Fargo, Palantir, and More",https://finnhub.io/api/news?id=a3a0db4b1752660f2fd7d29c650558376a294cf13f6233fbf17686a5112d5bc6,2025-06-30T09:23:00Z,positive,0.1424998939037323,0.03249372914433479,0.825006365776062
MSFT,Nvidia Stock Heads for Another Record. Why This Rally Still Has Legs.,https://finnhub.io/api/news?id=47caf002d2772f1bfaec21b3392610d95562aa8675f87da00dcbfbf4799846c8,2025-06-30T09:18:00Z,positive,0.14191082119941711,0.031780216842889786,0.8263090252876282
MSFT,"Will This ""Magnificent Seven"" Stock Overtake Microsoft and Nvidia As the Largest Company in the World By 2030?",https://finnhub.io/api/news?id=b27bd4edd2b6f892ee30fdd644fb86ac085f2223519d1902a58a0425f99304dc,2025-06-30T09:15:00Z,positive,0.14909009635448456,0.00910992082208395,0.8417999148368835
AMZN,"Will This ""Magnificent Seven"" Stock Overtake Microsoft and Nvidia As the Largest Company in the World By 2030?",https://finnhub.io/api/news?id=b27bd4edd2b6f892ee30fdd644fb86ac085f2223519d1902a58a0425f99304dc,2025-06-30T09:15:00Z,positive,0.14909009635448456,0.00910992082208395,0.8417999148368835
AAPL,2 Dividend Stocks to Buy on the Dip and Hold Forever,https://finnhub.io/api/news?id=f5a42c3b88f6f8792825edf3c8faa9634390c9f9ed88a84ff2a2e56c723faabb,2025-06-30T09:05:00Z,positive,0.06147249788045883,0.022546542808413506,0.9159809947013855
AMZN,Trade Latest: Canada Pulls Digital Tax to Revive Talks With Trump,https://finnhub.io/api/news?id=4f5b01a5a2115ec8d9aff79d50b38e04a58665a3e43e317bb14279500ce17e99,2025-06-30T09:04:00Z,neutral,0.09088791161775589,0.6356527805328369,0.2734593152999878
GOOGL,Trade Latest: Canada Pulls Digital Tax to Revive Talks With Trump,https://finnhub.io/api/news?id=4f5b01a5a2115ec8d9aff79d50b38e04a58665a3e43e317bb14279500ce17e99,2025-06-30T09:04:00Z,neutral,0.09088791161775589,0.6356527805328369,0.2734593152999878
GOOGL,Alphabet Inc.(NasdaqGS: GOOG) added to Russell 1000 Value Index,https://finnhub.io/api/news?id=deefb6e8f7178a1258ac58ccdc66f63037983d989530f8ff62bb1361abd6b4be,2025-06-30T09:02:17Z,positive,0.10922535508871078,0.011558586731553078,0.8792161345481873
GOOGL,Alphabet Inc.(NasdaqGS: GOOGL) added to Russell 1000 Value Index,https://finnhub.io/api/news?id=c8a634147f593e0d29cb819508cc6a8efbbd2223c164624c85d3667b68992bba,2025-06-30T09:00:33Z,positive,0.11896990984678268,0.011388062499463558,0.8696420192718506
AMZN,"Amazon.com, Inc.(NasdaqGS: AMZN) added to Russell 1000 Value Index",https://finnhub.io/api/news?id=8829c75fbae4f04cb392fe04c3407fe9529c71ecbfba6a7257192515a1a9624f,2025-06-30T08:57:00Z,negative,0.5434038043022156,0.016344338655471802,0.44025182723999023
NVDA,Nvidia: A Titan At An Inflection Point,https://finnhub.io/api/news?id=e82ed115e308b91f3a4a300e7f6b6306ce030d9005db640c25dbbedea35ff10d,2025-06-30T08:45:15Z,positive,0.04200446605682373,0.035678863525390625,0.9223167300224304
AAPL,Trump Tax Bill Hits Senate as GOP Torn by Competing Demands,https://finnhub.io/api/news?id=fd84991fdc0099a7c77c89299916f74f6d7c38237248fe063ed582d8fb5445d6,2025-06-30T08:30:04Z,neutral,0.0802386999130249,0.7697296142578125,0.15003174543380737
AMZN,My Smartest Growth Stock to Buy Today,https://finnhub.io/api/news?id=ce380bf2087987081103d72e316323f75962b56cf7d2ddcc499a64b97ce76e38,2025-06-30T08:15:00Z,positive,0.1362108290195465,0.016536112874746323,0.8472530841827393
AMZN,Should You Forget Sirius XM? This Stock Has Made Far More Millionaires.,https://finnhub.io/api/news?id=035c2ad6ce7459798141bacd13a328b9cc360eae405ef491ca9d95b8afa735e6,2025-06-30T08:10:00Z,positive,0.126234769821167,0.013916718773543835,0.8598484992980957
AAPL,SPY: Why The Real Correction May Start After Q2,https://finnhub.io/api/news?id=da7e0a1a0e925eee0fe07d6c355afa0dee353211f88771c07a08b11f17cede08,2025-06-30T08:00:00Z,positive,0.02954261377453804,0.4593568742275238,0.5111005306243896
MSFT,SPY: Why The Real Correction May Start After Q2,https://finnhub.io/api/news?id=da7e0a1a0e925eee0fe07d6c355afa0dee353211f88771c07a08b11f17cede08,2025-06-30T08:00:00Z,positive,0.02954261377453804,0.4593568742275238,0.5111005306243896
AMZN,SPY: Why The Real Correction May Start After Q2,https://finnhub.io/api/news?id=da7e0a1a0e925eee0fe07d6c355afa0dee353211f88771c07a08b11f17cede08,2025-06-30T08:00:00Z,positive,0.02954261377453804,0.4593568742275238,0.5111005306243896
NVDA,SPY: Why The Real Correction May Start After Q2,https://finnhub.io/api/news?id=da7e0a1a0e925eee0fe07d6c355afa0dee353211f88771c07a08b11f17cede08,2025-06-30T08:00:00Z,positive,0.02954261377453804,0.4593568742275238,0.5111005306243896
GOOGL,SPY: Why The Real Correction May Start After Q2,https://finnhub.io/api/news?id=da7e0a1a0e925eee0fe07d6c355afa0dee353211f88771c07a08b11f17cede08,2025-06-30T08:00:00Z,positive,0.02954261377453804,0.4593568742275238,0.5111005306243896
NVDA,"Quantum Computing: McKinsey, Morgan Stanley Radiate Upbeat Outlooks",https://finnhub.io/api/news?id=498de7674443a48ff2b172af51764e643144152e9f05b49f1028e3ea21cfc497,2025-06-30T07:55:02Z,negative,0.8603143692016602,0.01614491082727909,0.12354068458080292
NVDA,Two Less Popular ETFs That Are Better Than SCHD And Perfect For Retirees,https://finnhub.io/api/news?id=6cf663cad748015e53a72fd28723e41c2dc72295f777d566b81cd5a894e3b03d,2025-06-30T07:15:00Z,positive,0.2964698076248169,0.024473801255226135,0.6790564060211182
AAPL,Two Less Popular ETFs That Are Better Than SCHD And Perfect For Retirees,https://finnhub.io/api/news?id=6cf663cad748015e53a72fd28723e41c2dc72295f777d566b81cd5a894e3b03d,2025-06-30T07:15:00Z,positive,0.2964698076248169,0.024473801255226135,0.6790564060211182
MSFT,Two Less Popular ETFs That Are Better Than SCHD And Perfect For Retirees,https://finnhub.io/api/news?id=6cf663cad748015e53a72fd28723e41c2dc72295f777d566b81cd5a894e3b03d,2025-06-30T07:15:00Z,positive,0.2964698076248169,0.024473801255226135,0.6790564060211182
NVDA,Philip Morris: ZYN And IQOS Are Killing The 'Tobacco Is Dead' Myth,https://finnhub.io/api/news?id=73b0de6307c7128c59ef5a4e308a3dcbca4c18d64a126440cfd2200d6d82a25d,2025-06-30T07:15:00Z,positive,0.02516063116490841,0.4345257580280304,0.5403136014938354
AMZN,Two Less Popular ETFs That Are Better Than SCHD And Perfect For Retirees,https://finnhub.io/api/news?id=6cf663cad748015e53a72fd28723e41c2dc72295f777d566b81cd5a894e3b03d,2025-06-30T07:15:00Z,positive,0.2964698076248169,0.024473801255226135,0.6790564060211182
GOOGL,"Stock Market News for Jun 30, 2025",https://finnhub.io/api/news?id=795cce2d9c710d421744079bb541c66e55168d66f2a9e1e9a35b6f3458e034d8,2025-06-30T07:11:00Z,positive,0.023877445608377457,0.05823562294244766,0.9178869128227234
AMZN,"Stock Market News for Jun 30, 2025",https://finnhub.io/api/news?id=795cce2d9c710d421744079bb541c66e55168d66f2a9e1e9a35b6f3458e034d8,2025-06-30T07:11:00Z,positive,0.023877445608377457,0.05823562294244766,0.9178869128227234
AMZN,My 5 Favorite Stocks to Buy Right Now,https://finnhub.io/api/news?id=161376b2b26c19cb3cd0c0110865e2d24eff885c30c8f952dd1c2401e6736c47,2025-06-30T07:08:00Z,positive,0.04338774085044861,0.029382165521383286,0.9272301197052002
AAPL,"EU trade chief bound for US, seeking deal fair for both sides",https://finnhub.io/api/news?id=f33306720f6a1d5b832e9ca773f904b4ea1ba42700873a4166219f4d1ccd27a4,2025-06-30T07:07:11Z,negative,0.9140853881835938,0.018265504390001297,0.06764919310808182
AAPL,"EU tech rules not included in U.S. trade talks, EU Commission says",https://finnhub.io/api/news?id=02c7b0f952661e3685a6af78e5f13f714e1d286329edaf98dfeb0b3cb0f78cc2,2025-06-30T07:07:11Z,positive,0.04739592224359512,0.03869128227233887,0.9139127731323242
AMZN,"United Natural Foods Restores Systems After Hack, Expects Financial Hit",https://finnhub.io/api/news?id=fc19ed9ac7e89a89399a611ee11ffda3f809296e28234735df9254646aa10400,2025-06-30T07:01:00Z,neutral,0.09189294278621674,0.8797616362571716,0.0283453818410635
NVDA,Nebius Group: My Biggest AI Portfolio Position,https://finnhub.io/api/news?id=74b191599d9675208701416b781933386d5c4fe60ad49b3e197d094c146cc275,2025-06-30T06:06:58Z,positive,0.14301596581935883,0.012582623399794102,0.8444014191627502
AAPL,Don’t Be So Fast to Welcome a Company’s Share Buyback Program,https://finnhub.io/api/news?id=27e947b3c0f2041632ba5c67ed4723b3e98c258278b4c29f27e532c38dcd7a9c,2025-06-30T06:00:00Z,positive,0.12275945395231247,0.02937466651201248,0.847865879535675
AAPL,"Apple's 'F1: The Movie' roars to top of US, Canada box office",https://finnhub.io/api/news?id=cb98ddcbe12c887764debeb31cbcd84923d54feb543375db02defc486a041e69,2025-06-30T05:22:51Z,negative,0.6082067489624023,0.02327064611017704,0.3685225546360016
NVDA,BUZZ Index Leads Amid Rising Geopolitical Tensions,https://finnhub.io/api/news?id=cfd8e41ea6f5c6d5be280b92eaff1253e3b17f2c4299d210542ccc79a26a0f33,2025-06-30T05:11:00Z,negative,0.7897846102714539,0.146626278758049,0.06358913332223892
GOOGL,BUZZ Index Leads Amid Rising Geopolitical Tensions,https://finnhub.io/api/news?id=cfd8e41ea6f5c6d5be280b92eaff1253e3b17f2c4299d210542ccc79a26a0f33,2025-06-30T05:11:00Z,negative,0.7897846102714539,0.146626278758049,0.06358913332223892
AMZN,"Bitcoin Soars, Altcoins Fade in $300 Billion Crypto Shakeout",https://finnhub.io/api/news?id=cf11ea05a7a6015335c19cc0d217c8bbaa176757f346002162b6aae3dcc17a62,2025-06-30T05:00:00Z,neutral,0.05834423378109932,0.8195626139640808,0.12209304422140121
NVDA,Nvidia Poised to Hit $4 Trillion Market Value,https://finnhub.io/api/news?id=57838060d244a3bd430da6ead89e1931a8814d3de1b33f24a7c751fd13efccbf,2025-06-30T04:44:11Z,negative,0.5789908170700073,0.02541707456111908,0.3955921232700348
NVDA,NYLI Winslow Large Cap Growth ETF Q1 2025 Commentary,https://finnhub.io/api/news?id=e79bed6fad86c26b589d787960d7f934f162ace796b9079c86a739dc1d1ed262,2025-06-30T04:12:00Z,negative,0.9351171851158142,0.012967669405043125,0.05191519111394882
AMZN,NYLI Winslow Large Cap Growth ETF Q1 2025 Commentary,https://finnhub.io/api/news?id=e79bed6fad86c26b589d787960d7f934f162ace796b9079c86a739dc1d1ed262,2025-06-30T04:12:00Z,negative,0.9351171851158142,0.012967669405043125,0.05191519111394882
GOOGL,NYLI Winslow Large Cap Growth ETF Q1 2025 Commentary,https://finnhub.io/api/news?id=e79bed6fad86c26b589d787960d7f934f162ace796b9079c86a739dc1d1ed262,2025-06-30T04:12:00Z,negative,0.9351171851158142,0.012967669405043125,0.05191519111394882
MSFT,NYLI Winslow Large Cap Growth ETF Q1 2025 Commentary,https://finnhub.io/api/news?id=e79bed6fad86c26b589d787960d7f934f162ace796b9079c86a739dc1d1ed262,2025-06-30T04:12:00Z,negative,0.9351171851158142,0.012967669405043125,0.05191519111394882
AAPL,NYLI Winslow Large Cap Growth ETF Q1 2025 Commentary,https://finnhub.io/api/news?id=e79bed6fad86c26b589d787960d7f934f162ace796b9079c86a739dc1d1ed262,2025-06-30T04:12:00Z,negative,0.9351171851158142,0.012967669405043125,0.05191519111394882
MSFT,Why AI will eat McKinsey’s lunch —  but not today,https://finnhub.io/api/news?id=726f6218ce3622dfb8334519e2525cfa5a462b973416ea07700b09730511ba20,2025-06-30T04:10:16Z,positive,0.053903162479400635,0.03848238289356232,0.907614529132843
AMZN,Canada cancelled its digital services tax. What was it and why did the U.S. hate it?,https://finnhub.io/api/news?id=af5ed85745b6ea17d8a54ee21efd96c3c9333238cf5e90ec70dba7ab9f4c765f,2025-06-30T04:02:08Z,positive,0.027862565591931343,0.33724504709243774,0.634892463684082
GOOGL,Dealmakers Hit $1.8 Trillion as They Get Used to Trade Chaos,https://finnhub.io/api/news?id=7bbfe4929a608542b01449cc76e387056bd9fd1386c2fe4486b721e06c99c3eb,2025-06-30T04:01:00Z,negative,0.6117960810661316,0.02830103412270546,0.35990285873413086
NVDA,European Markets Are Becoming Increasingly Difficult to Ignore,https://finnhub.io/api/news?id=ef339ead47de74e1dc75af1b488e414c4ae0c712817e75108f9443b309314a1f,2025-06-30T04:00:33Z,neutral,0.02721845731139183,0.726699948310852,0.24608159065246582
AAPL,European Markets Are Becoming Increasingly Difficult to Ignore,https://finnhub.io/api/news?id=ef339ead47de74e1dc75af1b488e414c4ae0c712817e75108f9443b309314a1f,2025-06-30T04:00:33Z,neutral,0.02721845731139183,0.726699948310852,0.24608159065246582
GOOGL,Inside The Robotaxi Wars: Tesla Vs. The World,https://finnhub.io/api/news?id=04568be6dedcc5a7e7ecb1befcda57c6ae5ee29b813f00d7504ef2a8405d4260,2025-06-30T03:58:34Z,positive,0.06089421734213829,0.023814013227820396,0.9152917861938477
GOOGL,Alphabet Inc.(NasdaqGS: GOOG) added to Russell Top 200 Value Index,https://finnhub.io/api/news?id=9b3faa5e929a3f7b85aa1bfb52f0adc50d749238c053a4f1c80ab3bb10cdfe34,2025-06-30T03:40:24Z,negative,0.5888627767562866,0.022255567833781242,0.38888174295425415
GOOGL,Canada rescinds tax on US tech firms in hopes of Trump trade deal,https://finnhub.io/api/news?id=ce5700228a6bc90b555fa59ad2e6d0d092f6e134c4533909a98550ad2faa4804,2025-06-30T03:39:30Z,neutral,0.12203123420476913,0.5961675047874451,0.2818012833595276
AMZN,Canada rescinds tax on US tech firms in hopes of Trump trade deal,https://finnhub.io/api/news?id=ce5700228a6bc90b555fa59ad2e6d0d092f6e134c4533909a98550ad2faa4804,2025-06-30T03:39:30Z,neutral,0.12203123420476913,0.5961675047874451,0.2818012833595276
GOOGL,Alphabet Inc.(NasdaqGS: GOOGL) added to Russell Top 200 Value Index,https://finnhub.io/api/news?id=e5da12c5d791a19793844b94350dcf6b7c6e68dbda600666bc88187271ce8443,2025-06-30T03:38:40Z,negative,0.6639005541801453,0.024286041036248207,0.3118133842945099
AMZN,"Amazon.com, Inc.(NasdaqGS: AMZN) added to Russell Top 200 Value Index",https://finnhub.io/api/news?id=9c363357859e15925c7b0ae3cbfdd908775b15b8bd721294a11dc13622ebc16f,2025-06-30T03:37:54Z,negative,0.8694586157798767,0.027326082810759544,0.103215292096138
AAPL,Chinese Robot Startup Reaps Rewards After High-Profile Race,https://finnhub.io/api/news?id=89d10df497a7cc989b2a78e1715aed4d06f99217de4e783ba79f202ddde65c5d,2025-06-30T03:27:53Z,negative,0.9375385046005249,0.018840987235307693,0.043620530515909195
GOOGL,Trump Deals Poised to Fall Short of Sweeping Trade Reforms,https://finnhub.io/api/news?id=224406813cf16550555c8e7750fb4467079416de5540e1b8bfc30ca5f3b2651e,2025-06-30T02:54:46Z,neutral,0.16864816844463348,0.5492862462997437,0.28206560015678406
AMZN,Canada rescinds digital services tax to advance stalled US trade talks,https://finnhub.io/api/news?id=225d4edd154211467aa00ade51a879529b9cdc02c4920743afd1bde6039d901b,2025-06-30T02:25:09Z,neutral,0.06433454155921936,0.6108159422874451,0.32484954595565796
NVDA,London called higher on possible tax hikes,https://finnhub.io/api/news?id=daacd960957d3e31cfde33c174376f23d77baa99a016bc21d97c50dfe38768e4,2025-06-30T01:48:59Z,negative,0.4814067482948303,0.3342929482460022,0.1843002587556839
NVDA,HPE Collaborates with NVIDIA Corporation (NVDA) to Drive Next Gen of AI Innovation,https://finnhub.io/api/news?id=5e110cb550de31ca6dd427bf1ee85c680e6d606136488bfebf8348a2aadabc87,2025-06-30T01:48:28Z,positive,0.4302457571029663,0.007424612995237112,0.5623296499252319
AAPL,Bond Traders Basking in Gains Bet Fed Will Fuel Winning Streak,https://finnhub.io/api/news?id=5c17f92c20737a7937336fae9d6f79b98565ca4be621e752c32b111e4e4f5ba2,2025-06-30T00:30:24Z,negative,0.8539136648178101,0.03094649873673916,0.11513976752758026
AMZN,"Shopify: Continued Growth Potential, Waiting For A Discount",https://finnhub.io/api/news?id=7f666ba61400e72193de80a009aba92e32e000fd15af091c8f9d276be48c7ec6,2025-06-29T23:53:55Z,negative,0.6677413582801819,0.009809724986553192,0.32244887948036194
MSFT,Alphabet Is Building An AI Empire You'll Want To Be In,https://finnhub.io/api/news?id=ecebea587dedb11ee8a061f2f4a98af0d7dbf35c85c8f02076dea19a06ab4ac6,2025-06-29T23:28:31Z,positive,0.09735938161611557,0.010807260870933533,0.8918333649635315
NVDA,Alphabet Is Building An AI Empire You'll Want To Be In,https://finnhub.io/api/news?id=ecebea587dedb11ee8a061f2f4a98af0d7dbf35c85c8f02076dea19a06ab4ac6,2025-06-29T23:28:31Z,positive,0.09735938161611557,0.010807260870933533,0.8918333649635315
GOOGL,Alphabet Is Building An AI Empire You'll Want To Be In,https://finnhub.io/api/news?id=ecebea587dedb11ee8a061f2f4a98af0d7dbf35c85c8f02076dea19a06ab4ac6,2025-06-29T23:28:31Z,positive,0.09735938161611557,0.010807260870933533,0.8918333649635315
GOOGL,Alphabet Inc.(NasdaqGS: GOOG) added to Russell 3000E Value Index,https://finnhub.io/api/news?id=382908274904ef6557bffd683074978ab879cb67da107764342a60087b1bfa2d,2025-06-29T23:02:56Z,positive,0.0808933675289154,0.015212243422865868,0.9038943648338318
GOOGL,Alphabet Inc.(NasdaqGS: GOOGL) added to Russell 3000E Value Index,https://finnhub.io/api/news?id=9e43639df5798d11005609ed29f5dd2e73ea81d0c7da954357a471c7225e45a4,2025-06-29T22:50:36Z,positive,0.08448546379804611,0.015041335485875607,0.9004731774330139
AMZN,Shares firm in Asia as US-Canada trade talks resume,https://finnhub.io/api/news?id=0a99eb4a0d4fd1e501e1b791fecbf8f95e547bc2c4c5dd058f25180a18dbfdc8,2025-06-29T22:45:10Z,neutral,0.3722347021102905,0.3760736286640167,0.25169166922569275
AMZN,Shares rise in Asia as US-Canada trade talks revived,https://finnhub.io/api/news?id=e816f43472d668831bcbc66c0e8035c520c2d20e00c513758e8900951542de2e,2025-06-29T22:45:10Z,negative,0.6789733171463013,0.14039501547813416,0.18063171207904816
GOOGL,"US, Canada to resume trade talks after Ottawa drops digital tax",https://finnhub.io/api/news?id=03f6672f35e03a77463552bbb71f7b4bf6b83aac20b6a2745ca556768a1a8d3e,2025-06-29T22:42:08Z,positive,0.2220655083656311,0.13379830121994019,0.6441362500190735
GOOGL,Canada rescinds digital services tax to advance stalled trade talks with US,https://finnhub.io/api/news?id=59517c478ec0233fd4ee3a306c91a579691b7a73ae0317100a6fd02a3f86a02c,2025-06-29T22:42:08Z,neutral,0.05218997597694397,0.736454963684082,0.21135511994361877
GOOGL,Canada rescinds digital services tax to advance stalled US trade talks,https://finnhub.io/api/news?id=f2178cefba0b88937b7614fb0823ae7076b403606093124fa9ae2afd6a672458,2025-06-29T22:42:08Z,neutral,0.06433454155921936,0.6108159422874451,0.32484954595565796
AMZN,"Amazon.com, Inc.(NasdaqGS: AMZN) added to Russell 3000E Value Index",https://finnhub.io/api/news?id=47a418f887a422b3f46fe7527b5c4a0d50ccbe8760a7c92623446c22e9558578,2025-06-29T22:37:58Z,positive,0.146194726228714,0.017945488914847374,0.8358598351478577
MSFT,Billionaire Bill Gates Has 66% of His Foundation's $45 Billion Portfolio Invested in 3 Outstanding Stocks,https://finnhub.io/api/news?id=86323ad74f2d21cd70fc907b80bccbbecf4d75f2e7d31601e9bd13688e18beee,2025-06-29T22:35:00Z,positive,0.06760242581367493,0.012318071909248829,0.9200795292854309
NVDA,Where Will Nvidia Be in the Next 3 Years?,https://finnhub.io/api/news?id=2006e84e517e10beda86106373db99eef72dff602c4085e0220b8af19489f7c4,2025-06-29T22:30:00Z,positive,0.02721043862402439,0.03141742944717407,0.9413721561431885
NVDA,"Which ""Magnificent Seven"" Stock Makes the Best Buy for the Second Half?",https://finnhub.io/api/news?id=07d73b9be68c49a1af5bf9461948ecf9990b3742e2de2151e674e1957388dc55,2025-06-29T19:15:00Z,positive,0.04161503165960312,0.024211335927248,0.934173583984375
AMZN,Tracking Lone Pine Capital Portfolio - Q1 2025 Update,https://finnhub.io/api/news?id=673b1022a7930f49529e4716c5ea85ab7f65f8e6c2a89fdd7845d5412a76b194,2025-06-29T19:12:33Z,positive,0.027791982516646385,0.025776982307434082,0.946431040763855
MSFT,Tracking Lone Pine Capital Portfolio - Q1 2025 Update,https://finnhub.io/api/news?id=673b1022a7930f49529e4716c5ea85ab7f65f8e6c2a89fdd7845d5412a76b194,2025-06-29T19:12:33Z,positive,0.027791982516646385,0.025776982307434082,0.946431040763855
MSFT,"'God, Please Give Us Legislators Who Care,' Says Microsoft President As He Warns Washington Is 'Taking Tech For Granted'",https://finnhub.io/api/news?id=9232b19a420cbf40b4dae0fa37ba9ec4bf698579efde47eb223f2f786d882383,2025-06-29T18:30:40Z,neutral,0.07096853852272034,0.6393411159515381,0.2896903455257416
NVDA,"CoreWeave, Inc. (CRWV): The Short Sellers Were “Stupid,” Says Jim Cramer",https://finnhub.io/api/news?id=b405caa375542bb921ae0124f9f15a1da61d423114857363dbb0864ef109a06c,2025-06-29T17:37:10Z,neutral,0.017330165952444077,0.9018269181251526,0.08084284514188766
MSFT,"Best Buy Co., Inc. (BBY): Jim Cramer Shares Major Catalyst",https://finnhub.io/api/news?id=8716296386b6e36f7c1a8f69b4c0ac306a18a83b682ef659b5f1eb22e680a9f0,2025-06-29T17:34:54Z,positive,0.13789072632789612,0.012791037559509277,0.8493182063102722
MSFT,"Microsoft Corporation (MSFT) Could Finally Benefit From A Major Catalyst, Says Jim Cramer",https://finnhub.io/api/news?id=bbc6eec8dbd010a578e66f55fe46713701567ee8ef759d00dda326836360ea4f,2025-06-29T17:33:34Z,negative,0.9123741388320923,0.009496409446001053,0.07812950760126114
AAPL,"Apple Inc. (AAPL): I Will Support It Until It Loses To Samsung, Says Jim Cramer",https://finnhub.io/api/news?id=3d01e37f74ca750f3004b54e0dfa63f8f5f4ac2873b46f7dca083d00b69cf7b4,2025-06-29T17:31:03Z,negative,0.7509636282920837,0.012418008409440517,0.2366182655096054
NVDA,"Micron Technology, Inc. (MU): “It’s The Old Micron!” Says Jim Cramer",https://finnhub.io/api/news?id=db2908e7365783d4b4db0254566df0d92e2afe72f010f6e4f525c5e8cc82bc5a,2025-06-29T17:22:09Z,positive,0.04912429675459862,0.01960041932761669,0.9312752485275269
NVDA,"NVIDIA Corporation (NVDA): The Robots Are Coming, Asserts Jim Cramer",https://finnhub.io/api/news?id=a1c0b775ec8cc190bbb3873448f8350f7d8edc6b576bbbb4c096734637573a2c,2025-06-29T17:15:39Z,negative,0.6347880959510803,0.012402418069541454,0.35280948877334595
