ticker,title,link,pubDate,sentiment,p_negative,p_neutral,p_positive
GOOGL,The Only 2 Places I'd Put New Dividend Money Right Now,https://finnhub.io/api/news?id=2a0d372a067c526b7d1899385fa5d40a4af41d5d0ef0eb0f1c3acb37ecdb121d,2025-08-04T07:35:00Z,positive,0.05686120688915253,0.025173211470246315,0.9179655909538269
MSFT,The Only 2 Places I'd Put New Dividend Money Right Now,https://finnhub.io/api/news?id=2a0d372a067c526b7d1899385fa5d40a4af41d5d0ef0eb0f1c3acb37ecdb121d,2025-08-04T07:35:00Z,positive,0.05686120688915253,0.025173211470246315,0.9179655909538269
NVDA,CoreWeave And Core Scientific Merger: Looking For A Trade,https://finnhub.io/api/news?id=d2d93810d0c6c00ebbf1b2bc1410a7d21fa084d0cde47db689240dbd86f7608f,2025-08-04T07:12:06Z,positive,0.060734059661626816,0.016309469938278198,0.9229564666748047
AMZN,Janus Henderson Contrarian Fund Q2 2025 Commentary,https://finnhub.io/api/news?id=a126cc40226cb31ecdd9c51da5fda8d44c183321657b121dca84eff3c4d1998c,2025-08-04T05:50:00Z,positive,0.03169964626431465,0.026729576289653778,0.9415706992149353
AMZN,Janus Henderson Balanced Fund Q2 2025 Commentary,https://finnhub.io/api/news?id=1da633fe654ca05e3209e13dc6a8b1b031b96ccaa6d9638f7fd5a20e89598094,2025-08-04T05:40:00Z,positive,0.04498535767197609,0.01974622905254364,0.9352684617042542
NVDA,Janus Henderson Balanced Fund Q2 2025 Commentary,https://finnhub.io/api/news?id=1da633fe654ca05e3209e13dc6a8b1b031b96ccaa6d9638f7fd5a20e89598094,2025-08-04T05:40:00Z,positive,0.04498535767197609,0.01974622905254364,0.9352684617042542
MSFT,Janus Henderson Balanced Fund Q2 2025 Commentary,https://finnhub.io/api/news?id=1da633fe654ca05e3209e13dc6a8b1b031b96ccaa6d9638f7fd5a20e89598094,2025-08-04T05:40:00Z,positive,0.04498535767197609,0.01974622905254364,0.9352684617042542
AAPL,Janus Henderson Balanced Fund Q2 2025 Commentary,https://finnhub.io/api/news?id=1da633fe654ca05e3209e13dc6a8b1b031b96ccaa6d9638f7fd5a20e89598094,2025-08-04T05:40:00Z,positive,0.04498535767197609,0.01974622905254364,0.9352684617042542
NVDA,"Dow Jones Futures: Market Tries To Steady After Sell-Off; Palantir, AMD Earnings Ahead",https://finnhub.io/api/news?id=66bf1e920db7198ee065f3c1db92e7dac50072db4890641c608bae486dca380b,2025-08-04T05:07:58Z,negative,0.8169497847557068,0.1366259753704071,0.046424150466918945
AMZN,3 Unpopular Stocks We’re Skeptical Of,https://finnhub.io/api/news?id=da257fa3f77de501db6fc4034298c678cc853c40c600d965b46d832bcea0bd11,2025-08-04T04:35:31Z,positive,0.10859120637178421,0.1114971861243248,0.7799116373062134
MSFT,Putnam Large Cap Value Fund Q2 2025 Commentary,https://finnhub.io/api/news?id=1ef9fb42bf3abda571edf6ffa36b63367d13511c955be46f8b113e0d257665ca,2025-08-04T04:09:00Z,positive,0.10745512694120407,0.011005447246134281,0.8815394043922424
AMZN,Putnam Large Cap Value Fund Q2 2025 Commentary,https://finnhub.io/api/news?id=1ef9fb42bf3abda571edf6ffa36b63367d13511c955be46f8b113e0d257665ca,2025-08-04T04:09:00Z,positive,0.10745512694120407,0.011005447246134281,0.8815394043922424
GOOGL,Putnam Large Cap Value Fund Q2 2025 Commentary,https://finnhub.io/api/news?id=1ef9fb42bf3abda571edf6ffa36b63367d13511c955be46f8b113e0d257665ca,2025-08-04T04:09:00Z,positive,0.10745512694120407,0.011005447246134281,0.8815394043922424
MSFT,The AI job cuts are accelerating,https://finnhub.io/api/news?id=73239f23cb080047ca05c8f133b96bd5e14bc89df6df15b37d5c195b148570ac,2025-08-04T04:00:11Z,neutral,0.02956921048462391,0.91485995054245,0.055570878088474274
GOOGL,FNDB: A Well-Rounded Value ETF,https://finnhub.io/api/news?id=24025c3508fdb10cf0da4f7eb233569776aa8e40ae9fe7e280f7d0c57e16c173,2025-08-04T02:17:24Z,positive,0.11147744208574295,0.014069978147745132,0.8744525909423828
AAPL,FNDB: A Well-Rounded Value ETF,https://finnhub.io/api/news?id=24025c3508fdb10cf0da4f7eb233569776aa8e40ae9fe7e280f7d0c57e16c173,2025-08-04T02:17:24Z,positive,0.11147744208574295,0.014069978147745132,0.8744525909423828
MSFT,FNDB: A Well-Rounded Value ETF,https://finnhub.io/api/news?id=24025c3508fdb10cf0da4f7eb233569776aa8e40ae9fe7e280f7d0c57e16c173,2025-08-04T02:17:24Z,positive,0.11147744208574295,0.014069978147745132,0.8744525909423828
AMZN,FNDB: A Well-Rounded Value ETF,https://finnhub.io/api/news?id=24025c3508fdb10cf0da4f7eb233569776aa8e40ae9fe7e280f7d0c57e16c173,2025-08-04T02:17:24Z,positive,0.11147744208574295,0.014069978147745132,0.8744525909423828
NVDA,Greer Says US-China Talks ‘About Halfway There’ on Rare Earths,https://finnhub.io/api/news?id=f6c0201eb041c8ce7beaaf34215ae91837fab9943f3003bba83167372c015c9e,2025-08-04T02:04:37Z,positive,0.18258140981197357,0.016141854226589203,0.8012767434120178
MSFT,"Prediction: This Unstoppable Stock Will Join Nvidia, Microsoft, and Apple in the $3 Trillion Club Before 2029",https://finnhub.io/api/news?id=9a51afea9b2b0b1f2802405fc865a6501648f1db9671855758cdfee665cac2e7,2025-08-04T01:02:00Z,positive,0.4380986988544464,0.008990378119051456,0.5529108643531799
NVDA,"Prediction: This Unstoppable Stock Will Join Nvidia, Microsoft, and Apple in the $3 Trillion Club Before 2029",https://finnhub.io/api/news?id=9a51afea9b2b0b1f2802405fc865a6501648f1db9671855758cdfee665cac2e7,2025-08-04T01:02:00Z,positive,0.4380986988544464,0.008990378119051456,0.5529108643531799
AAPL,"Prediction: This Unstoppable Stock Will Join Nvidia, Microsoft, and Apple in the $3 Trillion Club Before 2029",https://finnhub.io/api/news?id=9a51afea9b2b0b1f2802405fc865a6501648f1db9671855758cdfee665cac2e7,2025-08-04T01:02:00Z,positive,0.4380986988544464,0.008990378119051456,0.5529108643531799
AMZN,Watch These Amazon Stock Price Levels After Post-Earnings Tumble,https://finnhub.io/api/news?id=0ad9b602406ab640dd87ca71c39d68790746efed1aa699ff1bd51d029db781fe,2025-08-04T00:02:19Z,positive,0.034926868975162506,0.021749822422862053,0.9433233141899109
MSFT,Watch These Amazon Stock Price Levels After Post-Earnings Tumble,https://finnhub.io/api/news?id=0ad9b602406ab640dd87ca71c39d68790746efed1aa699ff1bd51d029db781fe,2025-08-04T00:02:19Z,positive,0.034926868975162506,0.021749822422862053,0.9433233141899109
GOOGL,Watch These Amazon Stock Price Levels After Post-Earnings Tumble,https://finnhub.io/api/news?id=0ad9b602406ab640dd87ca71c39d68790746efed1aa699ff1bd51d029db781fe,2025-08-04T00:02:19Z,positive,0.034926868975162506,0.021749822422862053,0.9433233141899109
AMZN,The Trade Desk: Continue Riding The Bull Wave,https://finnhub.io/api/news?id=6a49a3d23177eef7880539b75f5ce6a23d704be7cf591ed058fc264dbf426372,2025-08-03T23:46:00Z,positive,0.13694614171981812,0.0174384918063879,0.8456153273582458
GOOGL,The Trade Desk: Continue Riding The Bull Wave,https://finnhub.io/api/news?id=6a49a3d23177eef7880539b75f5ce6a23d704be7cf591ed058fc264dbf426372,2025-08-03T23:46:00Z,positive,0.13694614171981812,0.0174384918063879,0.8456153273582458
NVDA,Prediction: This Will Be Nvidia's Stock Price 3 Years From Now,https://finnhub.io/api/news?id=bcd11d26f1c27e0672670fc379c50a76cccaaa16e180396cf18ae76e4ffaed47,2025-08-03T23:45:00Z,positive,0.02363268844783306,0.03007451631128788,0.9462927579879761
AMZN,Should You Forget Amazon? Why You Might Want to Buy This Unstoppable Growth Stock Instead,https://finnhub.io/api/news?id=7bf0e2bd46f346b91846e18a04f816f2489ee5ebca83630e10fed87b2308b06f,2025-08-03T23:00:00Z,positive,0.04427982121706009,0.02455904893577099,0.931161105632782
NVDA,4 Genius Artificial Intelligence (AI) Stocks to Buy in August,https://finnhub.io/api/news?id=4f0d24cfcb06de53a9c562186b8a68d32aff63cd46c68929557a371d8bd8c43a,2025-08-03T22:30:00Z,positive,0.2291453331708908,0.012977258302271366,0.7578774094581604
GOOGL,4 Genius Artificial Intelligence (AI) Stocks to Buy in August,https://finnhub.io/api/news?id=4f0d24cfcb06de53a9c562186b8a68d32aff63cd46c68929557a371d8bd8c43a,2025-08-03T22:30:00Z,positive,0.2291453331708908,0.012977258302271366,0.7578774094581604
NVDA,"Bitcoin vs Stocks: Which $15,000 Investment Would Make You a Billionaire?",https://finnhub.io/api/news?id=849859788040fe0700a6378128801c1b0462b2b686ed7035a2e19475719524e9,2025-08-03T22:06:23Z,positive,0.04011721909046173,0.032451048493385315,0.9274317622184753
AAPL,Apple might be building its own AI ‘answer engine’,https://finnhub.io/api/news?id=898e1a41a5701b5359fa9b4960787f139805393d4bda22c7c462ca9d52a2a4c4,2025-08-03T21:49:00Z,positive,0.08779193460941315,0.014908213168382645,0.8972998857498169
GOOGL,Apple might be building its own AI ‘answer engine’,https://finnhub.io/api/news?id=898e1a41a5701b5359fa9b4960787f139805393d4bda22c7c462ca9d52a2a4c4,2025-08-03T21:49:00Z,positive,0.08779193460941315,0.014908213168382645,0.8972998857498169
AAPL,Apple CEO drops bombshell about its future,https://finnhub.io/api/news?id=5dce610b609efb0a8ed34bf3c71eca88ab460982558e4b4059e2268f6c54f664,2025-08-03T21:03:00Z,positive,0.07617801427841187,0.28652042150497437,0.6373015642166138
GOOGL,Apple CEO drops bombshell about its future,https://finnhub.io/api/news?id=5dce610b609efb0a8ed34bf3c71eca88ab460982558e4b4059e2268f6c54f664,2025-08-03T21:03:00Z,positive,0.07617801427841187,0.28652042150497437,0.6373015642166138
AAPL,Apple: A $500 Billion Problem,https://finnhub.io/api/news?id=286f2271f2db82948385e6382d6e0a6542e5cdc29fda4e1eb411d1832d2bcd82,2025-08-03T20:42:17Z,positive,0.03791423141956329,0.029731029644608498,0.932354748249054
GOOGL,More Self-Driving Controversy Isn’t Bad For Tesla. It’s Bad For Everyone.,https://finnhub.io/api/news?id=0d28c57b70fa6e61d95061a87d4b34b68cca25565ec8829f268fb92ba63ec9da,2025-08-03T20:16:00Z,neutral,0.014907926321029663,0.8617405891418457,0.12335145473480225
AAPL,The Fate of a Little-Known Company Behind Goldman’s Apple Card Is in Limbo,https://finnhub.io/api/news?id=cc1dcdde13be620ed2dd3c4b1b6f4d4ca5eb2691419e45193534a15a3b6ae2b2,2025-08-03T19:39:00Z,neutral,0.015896694734692574,0.7099242210388184,0.27417904138565063
NVDA,Better Artificial Intelligence Stock: BigBear.ai vs. Nvidia,https://finnhub.io/api/news?id=31e9bb64059da64792753047511e77b64344d0bb3971749017806052920e1c14,2025-08-03T18:15:00Z,negative,0.49302661418914795,0.015585985966026783,0.49138739705085754
AAPL,"Berkshire Earnings Key Takeaways: Strong Profit, No Buybacks, High Cash Levels",https://finnhub.io/api/news?id=a0f978b5e2b7996a9c84d29b1abb86bbc7cbc01295e6e8a6f2007e10e1dff781,2025-08-03T17:57:00Z,negative,0.9065902829170227,0.028766527771949768,0.0646432638168335
AAPL,"Here’s what’s worth streaming in August 2025 on Netflix, Hulu, HBO Max, Disney+ and more",https://finnhub.io/api/news?id=c0c63c19828a5569e165f30f338fb202b22c29fcc5edaa1ed9ff8c45db123430,2025-08-03T17:21:00Z,positive,0.03511427715420723,0.019196145236492157,0.9456895589828491
AMZN,"Here’s what’s worth streaming in August 2025 on Netflix, Hulu, HBO Max, Disney+ and more",https://finnhub.io/api/news?id=c0c63c19828a5569e165f30f338fb202b22c29fcc5edaa1ed9ff8c45db123430,2025-08-03T17:21:00Z,positive,0.03511427715420723,0.019196145236492157,0.9456895589828491
AMZN,I Asked ChatGPT How Long It Would Take for Jeff Bezos To Spend All His Money,https://finnhub.io/api/news?id=2640bf28c0c58cb61e97bc4fb1f79b908e7d2a07eae6a0991fa7404d160a34ec,2025-08-03T17:02:24Z,positive,0.03799339011311531,0.024121904745697975,0.9378847479820251
AMZN,7 Things to Know About Amazon -- Some May Surprise You,https://finnhub.io/api/news?id=3d5b26cfb186dd4fbe8b3d52cd20a6b382675e2f311099996dbfb1a87172512d,2025-08-03T14:32:00Z,positive,0.04220689460635185,0.02753494866192341,0.9302582144737244
GOOGL,Mag 7 Plans to 'FOMO' Into $650B Tech Investment Despite Trump's U.S. Manufacturing Push,https://finnhub.io/api/news?id=a0bfcbd43b1116c2a3ea9d3ab049b3b2c3fa156f5773e46b39d49c4c67d96d92,2025-08-03T14:00:00Z,negative,0.7892700433731079,0.012339437380433083,0.19839061796665192
MSFT,Mag 7 Plans to 'FOMO' Into $650B Tech Investment Despite Trump's U.S. Manufacturing Push,https://finnhub.io/api/news?id=a0bfcbd43b1116c2a3ea9d3ab049b3b2c3fa156f5773e46b39d49c4c67d96d92,2025-08-03T14:00:00Z,negative,0.7892700433731079,0.012339437380433083,0.19839061796665192
AAPL,Mag 7 Plans to 'FOMO' Into $650B Tech Investment Despite Trump's U.S. Manufacturing Push,https://finnhub.io/api/news?id=a0bfcbd43b1116c2a3ea9d3ab049b3b2c3fa156f5773e46b39d49c4c67d96d92,2025-08-03T14:00:00Z,negative,0.7892700433731079,0.012339437380433083,0.19839061796665192
NVDA,Mag 7 Plans to 'FOMO' Into $650B Tech Investment Despite Trump's U.S. Manufacturing Push,https://finnhub.io/api/news?id=a0bfcbd43b1116c2a3ea9d3ab049b3b2c3fa156f5773e46b39d49c4c67d96d92,2025-08-03T14:00:00Z,negative,0.7892700433731079,0.012339437380433083,0.19839061796665192
AMZN,Mag 7 Plans to 'FOMO' Into $650B Tech Investment Despite Trump's U.S. Manufacturing Push,https://finnhub.io/api/news?id=a0bfcbd43b1116c2a3ea9d3ab049b3b2c3fa156f5773e46b39d49c4c67d96d92,2025-08-03T14:00:00Z,negative,0.7892700433731079,0.012339437380433083,0.19839061796665192
GOOGL,Meta Just Crushed Earnings. Is It a Better Buy Than Alphabet?,https://finnhub.io/api/news?id=015e5ff0971d537b336b23424c714e5d332019d781e7e2d681b0faae0fec69fc,2025-08-03T13:45:00Z,positive,0.17444589734077454,0.08783861249685287,0.7377154231071472
GOOGL,Want to Invest in Quantum Computing? 2 Stocks That Are Great Buys Right Now.,https://finnhub.io/api/news?id=dc715a12cfe8381955e8f609ae0d6bc13e2e282f6e667f614a59cf1aef42973a,2025-08-03T13:30:00Z,positive,0.13829036056995392,0.010725006461143494,0.8509846329689026
MSFT,Want to Invest in Quantum Computing? 2 Stocks That Are Great Buys Right Now.,https://finnhub.io/api/news?id=dc715a12cfe8381955e8f609ae0d6bc13e2e282f6e667f614a59cf1aef42973a,2025-08-03T13:30:00Z,positive,0.13829036056995392,0.010725006461143494,0.8509846329689026
AAPL,"'Tariffs are starting to bite': Latest inflation, jobs data sparks Wall Street concern over US economy",https://finnhub.io/api/news?id=105a0356bb1387a499e4067df6c18ea5b5450ac04026429864e538e4869dbb02,2025-08-03T13:00:11Z,neutral,0.029314517974853516,0.9342103004455566,0.03647514060139656
AAPL,"If You'd Invested $1,000 in AbbVie (ABBV) Stock 10 Years Ago, Here's How Much You'd Have Today",https://finnhub.io/api/news?id=60dfce8870cc2c43e99c8e41dd76f41cb53ffaebcd8dba71938c9db4b388f041,2025-08-03T13:00:00Z,positive,0.043729498982429504,0.018104856833815575,0.9381656050682068
NVDA,1 Reason Wall Street Is Obsessed With SoundHound AI,https://finnhub.io/api/news?id=2e2cb64e7184f878b5ebcafd571c0e1bfabf064fba57024a9ed3061542b989ae,2025-08-03T12:29:00Z,positive,0.052347492426633835,0.040854644030332565,0.9067978262901306
NVDA,"If You Bought Only 1 Share of Nvidia at Its IPO, Here's How Many Shares You'd Own Now",https://finnhub.io/api/news?id=d29c6c9872c573ee53a12a161de63cf47661e69d9f8ddf2be097c03ad1854341,2025-08-03T12:11:00Z,positive,0.030234871432185173,0.026374228298664093,0.9433908462524414
AAPL,Apple's Innovation Slows as Valuation Stays Rich,https://finnhub.io/api/news?id=465b123ce770b8595b40de42d8700f86db0294157a4afa69094ed4613612432c,2025-08-03T11:20:36Z,neutral,0.009526855312287807,0.9473713040351868,0.04310177266597748
GOOGL,JPMorgan breaks down how the DOJ-Google case could impact Apple’s bottom line,https://finnhub.io/api/news?id=e77ad752023340e9b6a0a5693b8c503009a1510a69f6090891d6c3aacd9304fa,2025-08-03T11:05:01Z,positive,0.03463674709200859,0.33896294236183167,0.6264002323150635
AAPL,JPMorgan breaks down how the DOJ-Google case could impact Apple’s bottom line,https://finnhub.io/api/news?id=e77ad752023340e9b6a0a5693b8c503009a1510a69f6090891d6c3aacd9304fa,2025-08-03T11:05:01Z,positive,0.03463674709200859,0.33896294236183167,0.6264002323150635
GOOGL,5 Reasons Alphabet Is the Smartest Stock to Buy Right Now,https://finnhub.io/api/news?id=5e802e4091cd711c5acc13448bcd337575034595e5758c27cd3f97ce188872d5,2025-08-03T10:45:00Z,positive,0.12324760109186172,0.013483217917382717,0.8632692098617554
GOOGL,"Microsoft Is an AI Darling, but Its Core Businesses Are Booming Too",https://finnhub.io/api/news?id=594bc9752ba3085f00d8f61ad8f40cd8dad1c2e6434dd14ec3a917f693b78c4f,2025-08-03T10:39:00Z,negative,0.5319787263870239,0.034454964101314545,0.43356624245643616
MSFT,"Microsoft Is an AI Darling, but Its Core Businesses Are Booming Too",https://finnhub.io/api/news?id=594bc9752ba3085f00d8f61ad8f40cd8dad1c2e6434dd14ec3a917f693b78c4f,2025-08-03T10:39:00Z,negative,0.5319787263870239,0.034454964101314545,0.43356624245643616
GOOGL,The AI Boom Continues: 3 Top AI Stocks to Buy for the Rest of 2025,https://finnhub.io/api/news?id=d38d58c224fd99b8a154ea95df883680656f0859cb962cc30971a458c4097d2d,2025-08-03T10:15:00Z,positive,0.17670826613903046,0.01281228382140398,0.8104794025421143
NVDA,"The Ultimate Growth Stock to Buy With $1,000 Right Now",https://finnhub.io/api/news?id=c1caadfa8bdac2ca3aecd297d3408a1b7b86654d594bb8728fd7577c0be06e0a,2025-08-03T09:41:00Z,positive,0.0615491084754467,0.013901163823902607,0.9245497584342957
AAPL,Mark Zuckerberg Just Declared War on the iPhone,https://finnhub.io/api/news?id=c4fb6e3c053935b66013d9ded2c666c83995d5c9249d066cf3eee57f3e8d1a3c,2025-08-03T09:30:00Z,positive,0.06713850796222687,0.2095487415790558,0.7233127355575562
GOOGL,Disney: How Key Forces Steer Between Streaming Dust-Ups And Park Triumphs,https://finnhub.io/api/news?id=4c44f635cfb6aab81ec11fe31a96bb0852e14c56a13b434b528615e21d4329a6,2025-08-03T09:30:00Z,positive,0.04725492745637894,0.038941189646720886,0.9138038754463196
GOOGL,"Brookfield Renewable Partners: Hydro Play, Growth, And Attractive Dividend; It Is A Buy",https://finnhub.io/api/news?id=f5f3ac15b0e9c2fd08f04c9161ee52706bd50d59a0fafc3653d1100dbfeae15e,2025-08-03T09:15:10Z,negative,0.7818692326545715,0.007192510645836592,0.2109382599592209
MSFT,"Brookfield Renewable Partners: Hydro Play, Growth, And Attractive Dividend; It Is A Buy",https://finnhub.io/api/news?id=f5f3ac15b0e9c2fd08f04c9161ee52706bd50d59a0fafc3653d1100dbfeae15e,2025-08-03T09:15:10Z,negative,0.7818692326545715,0.007192510645836592,0.2109382599592209
GOOGL,Alphabet Has a Brilliant Fallback Plan on AI Even if Search Is Disrupted,https://finnhub.io/api/news?id=307f491d3bf572bcf16efb9a948243377424af53c43a56a728eca975dd1ca7d7,2025-08-03T09:15:00Z,negative,0.5644428730010986,0.009891897439956665,0.4256651699542999
AMZN,Amazon: Panic Selloff Could Be Short Lived (Rating Upgrade),https://finnhub.io/api/news?id=a57e30c792f9e0ebf1770e2a2de4499fc8f7aaa7ba16240e0e5bed83e1e72f9f,2025-08-03T09:09:13Z,neutral,0.022211726754903793,0.721189022064209,0.2565993070602417
NVDA,Meet the Monster Stock that Continues to Crush the Market,https://finnhub.io/api/news?id=e2828b137f9a21219c01eb2d0e70e8a97c5647ec23cab075ad5c515796f72589,2025-08-03T08:35:00Z,neutral,0.07298234850168228,0.6456150412559509,0.2814026176929474
AAPL,Mag-7: My Top Pick For 2025 (Year-End),https://finnhub.io/api/news?id=afddb0feca3602702fd49c4dff1d2c4747cc926c2ea4ddd8daee93ee6ee4dded,2025-08-03T08:30:00Z,positive,0.096221424639225,0.021205410361289978,0.882573127746582
NVDA,Mag-7: My Top Pick For 2025 (Year-End),https://finnhub.io/api/news?id=afddb0feca3602702fd49c4dff1d2c4747cc926c2ea4ddd8daee93ee6ee4dded,2025-08-03T08:30:00Z,positive,0.096221424639225,0.021205410361289978,0.882573127746582
AMZN,Mag-7: My Top Pick For 2025 (Year-End),https://finnhub.io/api/news?id=afddb0feca3602702fd49c4dff1d2c4747cc926c2ea4ddd8daee93ee6ee4dded,2025-08-03T08:30:00Z,positive,0.096221424639225,0.021205410361289978,0.882573127746582
MSFT,Mag-7: My Top Pick For 2025 (Year-End),https://finnhub.io/api/news?id=afddb0feca3602702fd49c4dff1d2c4747cc926c2ea4ddd8daee93ee6ee4dded,2025-08-03T08:30:00Z,positive,0.096221424639225,0.021205410361289978,0.882573127746582
NVDA,Largest Negative Momentum Signal Since February On Technology Breakdown,https://finnhub.io/api/news?id=a863ef4ea23cedcb40fb0c979a0ab23b94645825f67485dfa565c264b473ce6d,2025-08-03T08:27:10Z,neutral,0.015866205096244812,0.9592626690864563,0.024871142581105232
AMZN,IonQ: Is This Quantum Computing Stock A Buy Ahead Of Earnings,https://finnhub.io/api/news?id=ae0a508782f7aa05cea49b2bb4604d4fbd2feae4372fc5c16898610c4adfca3d,2025-08-03T06:27:25Z,positive,0.045148447155952454,0.017023032531142235,0.937828540802002
MSFT,IonQ: Is This Quantum Computing Stock A Buy Ahead Of Earnings,https://finnhub.io/api/news?id=ae0a508782f7aa05cea49b2bb4604d4fbd2feae4372fc5c16898610c4adfca3d,2025-08-03T06:27:25Z,positive,0.045148447155952454,0.017023032531142235,0.937828540802002
NVDA,IonQ: Is This Quantum Computing Stock A Buy Ahead Of Earnings,https://finnhub.io/api/news?id=ae0a508782f7aa05cea49b2bb4604d4fbd2feae4372fc5c16898610c4adfca3d,2025-08-03T06:27:25Z,positive,0.045148447155952454,0.017023032531142235,0.937828540802002
GOOGL,IonQ: Is This Quantum Computing Stock A Buy Ahead Of Earnings,https://finnhub.io/api/news?id=ae0a508782f7aa05cea49b2bb4604d4fbd2feae4372fc5c16898610c4adfca3d,2025-08-03T06:27:25Z,positive,0.045148447155952454,0.017023032531142235,0.937828540802002
AMZN,Why Prime Video Is One of Amazon's Most Underrated Assets,https://finnhub.io/api/news?id=74464072244b93f9a436a05fbe2a6aacde6e4b097fb29dc66dcfb71c28825d9a,2025-08-03T05:18:00Z,positive,0.11831319332122803,0.047907840460538864,0.833778977394104
MSFT,Credo's Hyperscaler Clients Upping Their Capex (Rating Downgrade),https://finnhub.io/api/news?id=23d92c577a3c85e4d6ef80b8e80ffaf473ae34bbbfe5d369d4e2a624f0750b88,2025-08-03T04:41:47Z,negative,0.3468224108219147,0.306792676448822,0.3463849723339081
AMZN,Credo's Hyperscaler Clients Upping Their Capex (Rating Downgrade),https://finnhub.io/api/news?id=23d92c577a3c85e4d6ef80b8e80ffaf473ae34bbbfe5d369d4e2a624f0750b88,2025-08-03T04:41:47Z,negative,0.3468224108219147,0.306792676448822,0.3463849723339081
GOOGL,"QQQX: Strong Performance, Still Looks Attractively Discounted",https://finnhub.io/api/news?id=bbd5400610ee3166c17b55b4fbf51b700b7fe874f855442d45690377f4e7c663,2025-08-03T03:30:19Z,negative,0.9503759145736694,0.026670020073652267,0.02295413427054882
AMZN,Microsoft: Don't Get Too Excited About Future Returns,https://finnhub.io/api/news?id=0617f79ed376c20a1c40078cf4946501b591d178693f87cb7a9485cbf7c3cae9,2025-08-03T02:31:10Z,positive,0.05061415955424309,0.036598119884729385,0.9127877354621887
MSFT,Microsoft: Don't Get Too Excited About Future Returns,https://finnhub.io/api/news?id=0617f79ed376c20a1c40078cf4946501b591d178693f87cb7a9485cbf7c3cae9,2025-08-03T02:31:10Z,positive,0.05061415955424309,0.036598119884729385,0.9127877354621887
AAPL,Tim Cook reportedly tells employees Apple ‘must’ win in AI,https://finnhub.io/api/news?id=d5f789ac2a20adb25f4bfb336634c9244e2019022636cfc6251c9da8af0ab196,2025-08-02T21:21:22Z,positive,0.1696729212999344,0.06534036248922348,0.7649866938591003
AAPL,Meta Just Paid $250M To Lure This 24-year-old AI Whiz Kid: A Strategic Move Or A Power Play?,https://finnhub.io/api/news?id=21cb291cfa6f56f62557ba980d12e22870cddca0e5c81b4a25ae165a0ff43af0,2025-08-02T20:39:43Z,positive,0.0496075414121151,0.040875308215618134,0.9095171689987183
NVDA,Nvidia CEO Jensen Huang Just Gave Meta Investors Great News -- or Did He?,https://finnhub.io/api/news?id=49f68072b143b028c87ec67f5a098e260b2aad6448504a35eacfa0ca6443b9d0,2025-08-02T20:14:00Z,positive,0.14034929871559143,0.013756024651229382,0.8458946943283081
AMZN,"Teradyne, Inc. (TER): A Bull Case Theory",https://finnhub.io/api/news?id=e06e1d3c4f9a1d66745fad415ec25386c8325e809825c5b853bd01fc54d7708d,2025-08-02T19:24:26Z,positive,0.04371074214577675,0.023458322510123253,0.9328309297561646
AMZN,Target Corporation (TGT): A Bull Case Theory,https://finnhub.io/api/news?id=e3b9997c32205244abc643f0b842908c8ac3cad91368193e76fcda4c297c1916,2025-08-02T19:22:24Z,positive,0.023266322910785675,0.03823884576559067,0.9384948015213013
AMZN,Oppenheimer Trims Amazon (AMZN) Price Target to $245 — AI Growth Still a Bright Spot,https://finnhub.io/api/news?id=d6853fa95a6c660fb037570dbcbeb2e8621b9efed5e6a4b970c5cc6fe418f777,2025-08-02T19:20:46Z,negative,0.9248039126396179,0.024334585294127464,0.05086152255535126
AAPL,"'I Don't Do Anything Other Than Working,' Says Perplexity CEO Aravind Srinivas As His $14 Billion AI Startup Challenges Tech Giants",https://finnhub.io/api/news?id=8d1372d52d790d464753cd9ed5c9e881ecd4e66f5c9aac23b0fb5f923861bb49,2025-08-02T15:30:27Z,positive,0.07277791947126389,0.040290411561727524,0.8869315981864929
GOOGL,"'I Don't Do Anything Other Than Working,' Says Perplexity CEO Aravind Srinivas As His $14 Billion AI Startup Challenges Tech Giants",https://finnhub.io/api/news?id=8d1372d52d790d464753cd9ed5c9e881ecd4e66f5c9aac23b0fb5f923861bb49,2025-08-02T15:30:27Z,positive,0.07277791947126389,0.040290411561727524,0.8869315981864929
MSFT,"'I Don't Do Anything Other Than Working,' Says Perplexity CEO Aravind Srinivas As His $14 Billion AI Startup Challenges Tech Giants",https://finnhub.io/api/news?id=8d1372d52d790d464753cd9ed5c9e881ecd4e66f5c9aac23b0fb5f923861bb49,2025-08-02T15:30:27Z,positive,0.07277791947126389,0.040290411561727524,0.8869315981864929
NVDA,"Dow Jones Futures: What To Do After Market Sell-Off. Palantir, AMD Lead Big Earnings.",https://finnhub.io/api/news?id=feb0dbc8d88899f7eae4feb895ccfa18af772a6b69047f6143dfa43d28453b0c,2025-08-02T15:18:40Z,positive,0.11454212665557861,0.024723313748836517,0.8607345819473267
MSFT,"Dow Jones Futures: What To Do After Market Sell-Off. Palantir, AMD Lead Big Earnings.",https://finnhub.io/api/news?id=feb0dbc8d88899f7eae4feb895ccfa18af772a6b69047f6143dfa43d28453b0c,2025-08-02T15:18:40Z,positive,0.11454212665557861,0.024723313748836517,0.8607345819473267
MSFT,Microsoft CEO sends a surprising message on quantum computing,https://finnhub.io/api/news?id=fe8562d74ce23da46e2962b52c5c631e14894d5c77748e41963963d8c975a8f2,2025-08-02T14:37:00Z,negative,0.5677563548088074,0.016052819788455963,0.4161908030509949
AAPL,Apple Third Quarter 2025 Earnings: Beats Expectations,https://finnhub.io/api/news?id=8b40504cc5674c8d16eb254660c50a5ef3c93a02cfa55d6da208dc52ff4596da,2025-08-02T13:50:07Z,negative,0.9329697489738464,0.03313007950782776,0.033900175243616104
