ticker,title,link,pubDate,sentiment,p_negative,p_neutral,p_positive
AAPL,Fidelity Freedom 2030 Fund Q2 2025 Commentary,https://finnhub.io/api/news?id=10c84f514170f308a2c9766dc3f52ef0a880d84a255203a25ff5a9e7bddde13b,2025-07-28T20:40:00Z,positive,0.04267369583249092,0.015030786395072937,0.9422955513000488
AAPL,Analysts consider new Apple stock target price ahead of earnings,https://finnhub.io/api/news?id=c2fa54cf4a37f0b3e44443c2306a94a442f410ac3904525a04db6d1e4eb9f035,2025-07-28T20:39:49Z,positive,0.07749444246292114,0.02002575807273388,0.9024797677993774
GOOGL,Analysts consider new Apple stock target price ahead of earnings,https://finnhub.io/api/news?id=c2fa54cf4a37f0b3e44443c2306a94a442f410ac3904525a04db6d1e4eb9f035,2025-07-28T20:39:49Z,positive,0.07749444246292114,0.02002575807273388,0.9024797677993774
MSFT,"Top Stock Reports for Microsoft, SAP & AMD",https://finnhub.io/api/news?id=b9d4a93e2a403656756afcfbd7f571f679ea2c55055bfdccbcfad6caebf0a376,2025-07-28T20:39:00Z,positive,0.02448408119380474,0.04553517326712608,0.9299807548522949
NVDA,"Nvidia Partner, Rival Lead S&P 500 Stocks Monday",https://finnhub.io/api/news?id=0b2603903b5179e4d06ff6b579b9bbad565a5301f283ce9adbe1ab332636135d,2025-07-28T20:32:07Z,positive,0.28354182839393616,0.03443939611315727,0.6820187568664551
NVDA,Fidelity Freedom 2025 Fund Q2 2025 Commentary,https://finnhub.io/api/news?id=2568f7138327756d13a3322d99db698caa96ab2d56e39669fdd283748f45a11b,2025-07-28T20:25:00Z,positive,0.04431477561593056,0.01597122848033905,0.9397140145301819
AAPL,Fidelity Freedom 2025 Fund Q2 2025 Commentary,https://finnhub.io/api/news?id=2568f7138327756d13a3322d99db698caa96ab2d56e39669fdd283748f45a11b,2025-07-28T20:25:00Z,positive,0.04431477561593056,0.01597122848033905,0.9397140145301819
AAPL,"Microsoft, Meta, Apple, Amazon: How to play Big Tech earnings",https://finnhub.io/api/news?id=7ad71a1b8bba78c04bfb5e3e2e8a88659df61bcbf8f7c681a3c238080e7114f6,2025-07-28T20:18:44Z,positive,0.041732192039489746,0.019164536148309708,0.9391033053398132
AMZN,"Microsoft, Meta, Apple, Amazon: How to play Big Tech earnings",https://finnhub.io/api/news?id=7ad71a1b8bba78c04bfb5e3e2e8a88659df61bcbf8f7c681a3c238080e7114f6,2025-07-28T20:18:44Z,positive,0.041732192039489746,0.019164536148309708,0.9391033053398132
NVDA,"Microsoft, Meta, Apple, Amazon: How to play Big Tech earnings",https://finnhub.io/api/news?id=7ad71a1b8bba78c04bfb5e3e2e8a88659df61bcbf8f7c681a3c238080e7114f6,2025-07-28T20:18:44Z,positive,0.041732192039489746,0.019164536148309708,0.9391033053398132
MSFT,"Microsoft, Meta, Apple, Amazon: How to play Big Tech earnings",https://finnhub.io/api/news?id=7ad71a1b8bba78c04bfb5e3e2e8a88659df61bcbf8f7c681a3c238080e7114f6,2025-07-28T20:18:44Z,positive,0.041732192039489746,0.019164536148309708,0.9391033053398132
NVDA,Josh Brown Gives Followers ‘Permission’ to Sell NVIDIA (NVDA) Shares – Here’s Why,https://finnhub.io/api/news?id=d505b914b374e471f7feca89629a877949cd1cc8007b9e40eaeac4ce15399b16,2025-07-28T20:16:44Z,positive,0.05290998890995979,0.01629815436899662,0.9307918548583984
AAPL,Apple (AAPL) Bull Says iPhone Will Be a ‘Great’ AI Catalyst – ‘We Feel Stock is Very Attractive’,https://finnhub.io/api/news?id=ed22b9d186e385dbe31999fbdfd2b58721839e0bdd364eca0b349156ef57d3db,2025-07-28T20:15:15Z,negative,0.8261646032333374,0.007063002325594425,0.16677244007587433
MSFT,Microsoft Challenges Google's AI Search With 'Copilot Mode' for Edge,https://finnhub.io/api/news?id=f8ad2f7768f2078d039240d589df0ce112b6ecf795e66d8cbc546a1d4503fb4a,2025-07-28T20:12:12Z,positive,0.3551368713378906,0.015651235356926918,0.6292119026184082
GOOGL,Microsoft Challenges Google's AI Search With 'Copilot Mode' for Edge,https://finnhub.io/api/news?id=f8ad2f7768f2078d039240d589df0ce112b6ecf795e66d8cbc546a1d4503fb4a,2025-07-28T20:12:12Z,positive,0.3551368713378906,0.015651235356926918,0.6292119026184082
GOOGL,Spotify set to report earnings as investor optimism meets cautious guidance,https://finnhub.io/api/news?id=c41ae2bd049243c0c037e974cc5c2b89b4a8fbf2f59694b4c177ceb63c4ec08c,2025-07-28T20:10:26Z,negative,0.8883873224258423,0.0434730239212513,0.06813964247703552
AMZN,Josh Brown Highlights His New Best Industrial Stock Pick in 2025,https://finnhub.io/api/news?id=b7f634453dab49d320c75b3d1e3dfbbcec7382e371fbfd2d486bd3e74b78e5f9,2025-07-28T20:09:37Z,negative,0.665604829788208,0.016958020627498627,0.3174371123313904
MSFT,"US Equity Markets Mixed on US-EU Trade Deal; Fed Rate Decision, Flood of Earnings Loom",https://finnhub.io/api/news?id=d23d8b463ce6749375c8628532b2aa6500ebe287479bbce0dd0491b369a7aeed,2025-07-28T20:09:31Z,neutral,0.20240047574043274,0.7608446478843689,0.03675488755106926
AAPL,"US Equity Markets Mixed on US-EU Trade Deal; Fed Rate Decision, Flood of Earnings Loom",https://finnhub.io/api/news?id=d23d8b463ce6749375c8628532b2aa6500ebe287479bbce0dd0491b369a7aeed,2025-07-28T20:09:31Z,neutral,0.20240047574043274,0.7608446478843689,0.03675488755106926
AMZN,"US Equity Markets Mixed on US-EU Trade Deal; Fed Rate Decision, Flood of Earnings Loom",https://finnhub.io/api/news?id=d23d8b463ce6749375c8628532b2aa6500ebe287479bbce0dd0491b369a7aeed,2025-07-28T20:09:31Z,neutral,0.20240047574043274,0.7608446478843689,0.03675488755106926
AMZN,"Stock market today: S&P 500, Nasdaq eke out records as markets kick off huge week for US economy",https://finnhub.io/api/news?id=bac5b6d2200e3ea8c64ffc5713ae267e34e73177c6f6d295630c4d15400a4697,2025-07-28T20:05:00Z,negative,0.8667206764221191,0.053088124841451645,0.08019120246171951
AAPL,"Stock market today: S&P 500, Nasdaq eke out records as markets kick off huge week for US economy",https://finnhub.io/api/news?id=bac5b6d2200e3ea8c64ffc5713ae267e34e73177c6f6d295630c4d15400a4697,2025-07-28T20:05:00Z,negative,0.8667206764221191,0.053088124841451645,0.08019120246171951
MSFT,"Stock market today: S&P 500, Nasdaq eke out records as markets kick off huge week for US economy",https://finnhub.io/api/news?id=bac5b6d2200e3ea8c64ffc5713ae267e34e73177c6f6d295630c4d15400a4697,2025-07-28T20:05:00Z,negative,0.8667206764221191,0.053088124841451645,0.08019120246171951
NVDA,Cadence Reports Second Quarter 2025 Financial Results,https://finnhub.io/api/news?id=2efd0bebc51f2d15dcd2f7543661b5a5e01cb63cbbb04d361dff611a4dc45262,2025-07-28T20:02:00Z,positive,0.029027879238128662,0.07902899384498596,0.891943097114563
GOOGL,Alphabet: Near Unstoppable AI Leader,https://finnhub.io/api/news?id=09661348ffd967072a90d69085335708a2d71b7a1ab3adeb172f4fdce8f7be3e,2025-07-28T20:00:00Z,positive,0.08599334955215454,0.024510053917765617,0.8894966244697571
MSFT,Wall Street on Edge: Big Tech's $11 Trillion Earnings Could Ignite--or Derail--the Market Rally,https://finnhub.io/api/news?id=8ddb607b1d1782b32b99d61006c8a405d011f638800f5c208d8b0a351dc8e0ba,2025-07-28T19:55:07Z,neutral,0.01236630231142044,0.9263642430305481,0.06126948446035385
AAPL,How to avoid capital gains taxes with highly appreciated stocks,https://finnhub.io/api/news?id=2bfb32a0be82bcfcc7aea66a96dd9bdb83991adf58d3675eff5c0483acef13cc,2025-07-28T19:54:27Z,positive,0.08978695422410965,0.022310221567749977,0.8879028558731079
MSFT,Tech Earnings Create $11 Trillion Hurdle for S&P 500,https://finnhub.io/api/news?id=8c56a6f067475faaf3f3f34431237cda775eb4270606a1d7b593f17ca296eaea,2025-07-28T19:51:53Z,neutral,0.19393761456012726,0.5242784023284912,0.2817838788032532
AAPL,Tech Earnings Create $11 Trillion Hurdle for S&P 500,https://finnhub.io/api/news?id=8c56a6f067475faaf3f3f34431237cda775eb4270606a1d7b593f17ca296eaea,2025-07-28T19:51:53Z,neutral,0.19393761456012726,0.5242784023284912,0.2817838788032532
MSFT,Sector Update: Tech Stocks Advance Late Afternoon,https://finnhub.io/api/news?id=93348e78d289fb1a53bdb07334ebfbd92830eba7e4d37c55ee6f85fe350fe05d,2025-07-28T19:44:00Z,negative,0.7223667502403259,0.18030624091625214,0.09732700139284134
AAPL,Transitions in the Semiconductor Space,https://finnhub.io/api/news?id=96647c1a415da948e8bb675cf8c65b32379091cbc5c5037d38fca62e172052ea,2025-07-28T19:40:51Z,positive,0.04387972503900528,0.042250778526067734,0.9138694405555725
AMZN,Transitions in the Semiconductor Space,https://finnhub.io/api/news?id=96647c1a415da948e8bb675cf8c65b32379091cbc5c5037d38fca62e172052ea,2025-07-28T19:40:51Z,positive,0.04387972503900528,0.042250778526067734,0.9138694405555725
NVDA,Huawei Unveils AI System to Challenge Nvidia's Flagship Model,https://finnhub.io/api/news?id=3dc0451e1468666e512b71f1b9e9394718fb1f038daffe031992d8ba99dded50,2025-07-28T19:31:55Z,negative,0.676531970500946,0.010122993029654026,0.3133451044559479
AMZN,Amazon (AMZN) Stock Climb on Massive Price Target Hike From UBS,https://finnhub.io/api/news?id=622ad0f12530b8d669f90478c5ed2077a3c846bdfdc3ea80523634e0de0d9fca,2025-07-28T19:27:46Z,negative,0.8457129597663879,0.11506631970405579,0.03922077640891075
GOOGL,Alphabet's Sundar Pichai Joins Billionaire Ranks--But Leaves $1 Billion on the Table,https://finnhub.io/api/news?id=96d1c2c5edc4d370432695c7feba97834d485550f1ac30f840631b5719c5f4bc,2025-07-28T19:27:44Z,positive,0.03401864320039749,0.15217265486717224,0.8138086795806885
MSFT,Stock Market Today: Dow Dips Even As EU Deal Boosts Boeing; Cathie Wood Loads Up On This Stock Amid 47% Plunge (Live Coverage),https://finnhub.io/api/news?id=af57981bc9b3de40a834aa0980ecae19cc6d9bc8a8739f6f421f6026600c0176,2025-07-28T19:19:57Z,neutral,0.0604039765894413,0.9114880561828613,0.028107915073633194
NVDA,Stock Market Today: Dow Dips Even As EU Deal Boosts Boeing; Cathie Wood Loads Up On This Stock Amid 47% Plunge (Live Coverage),https://finnhub.io/api/news?id=af57981bc9b3de40a834aa0980ecae19cc6d9bc8a8739f6f421f6026600c0176,2025-07-28T19:19:57Z,neutral,0.0604039765894413,0.9114880561828613,0.028107915073633194
AAPL,Stock Market Today: Dow Dips Even As EU Deal Boosts Boeing; Cathie Wood Loads Up On This Stock Amid 47% Plunge (Live Coverage),https://finnhub.io/api/news?id=af57981bc9b3de40a834aa0980ecae19cc6d9bc8a8739f6f421f6026600c0176,2025-07-28T19:19:57Z,neutral,0.0604039765894413,0.9114880561828613,0.028107915073633194
GOOGL,These four threats could ’upset’ bullish S&P 500 momentum: Sevens Report,https://finnhub.io/api/news?id=69c251a01eb257d5ac28bbcb204addb9b85cee6b7c842dff4c9e0250dccd6f70,2025-07-28T19:15:48Z,neutral,0.0296943299472332,0.7406646609306335,0.22964100539684296
NVDA,S&P 500 Rally Faces $11 Trillion Gauntlet of Big Tech Earnings,https://finnhub.io/api/news?id=4f47071a5b38879dbf6bfddb38632d2d71319def8fd399671eefde4e345acf83,2025-07-28T19:10:24Z,positive,0.11672335118055344,0.2569808065891266,0.6262958645820618
MSFT,S&P 500 Rally Faces $11 Trillion Gauntlet of Big Tech Earnings,https://finnhub.io/api/news?id=4f47071a5b38879dbf6bfddb38632d2d71319def8fd399671eefde4e345acf83,2025-07-28T19:10:24Z,positive,0.11672335118055344,0.2569808065891266,0.6262958645820618
AAPL,S&P 500 Rally Faces $11 Trillion Gauntlet of Big Tech Earnings,https://finnhub.io/api/news?id=4f47071a5b38879dbf6bfddb38632d2d71319def8fd399671eefde4e345acf83,2025-07-28T19:10:24Z,positive,0.11672335118055344,0.2569808065891266,0.6262958645820618
GOOGL,S&P 500 Rally Faces $11 Trillion Gauntlet of Big Tech Earnings,https://finnhub.io/api/news?id=4f47071a5b38879dbf6bfddb38632d2d71319def8fd399671eefde4e345acf83,2025-07-28T19:10:24Z,positive,0.11672335118055344,0.2569808065891266,0.6262958645820618
AMZN,S&P 500 Rally Faces $11 Trillion Gauntlet of Big Tech Earnings,https://finnhub.io/api/news?id=4f47071a5b38879dbf6bfddb38632d2d71319def8fd399671eefde4e345acf83,2025-07-28T19:10:24Z,positive,0.11672335118055344,0.2569808065891266,0.6262958645820618
MSFT,"This Stock Smashes Nvidia, All Mag 7 Members — With A New Breakout Ahead",https://finnhub.io/api/news?id=9b821136d4ea59145600c6f648f4e8f968ba054344562780e7afc0598cebb7f3,2025-07-28T19:02:57Z,positive,0.30914220213890076,0.18825648725032806,0.5026013255119324
NVDA,"This Stock Smashes Nvidia, All Mag 7 Members — With A New Breakout Ahead",https://finnhub.io/api/news?id=9b821136d4ea59145600c6f648f4e8f968ba054344562780e7afc0598cebb7f3,2025-07-28T19:02:57Z,positive,0.30914220213890076,0.18825648725032806,0.5026013255119324
NVDA,AMD Stock Jumps as AI Chip Prices Soar Ahead of Q2 Earnings,https://finnhub.io/api/news?id=f3a6641087d11748286a66419b5d14b43e162acd87fe3ed5ab65bbbfdb7b56e4,2025-07-28T18:46:02Z,neutral,0.19993539154529572,0.6265303492546082,0.17353422939777374
AMZN,Amazon Q2 Earnings Preview: What to Expect From Upcoming Report,https://finnhub.io/api/news?id=621e5fe36e3155a46b96edd00b47d4a1ce3ac7255ce784e0454002a2509ae0c6,2025-07-28T18:44:10Z,positive,0.0354725606739521,0.05650914087891579,0.9080182909965515
AMZN,Amazon disputes report that it raised prices of popular items since Trump took office,https://finnhub.io/api/news?id=ceb2fb5d2935eb13922fbe938540222ae64ab7f341a2f88fdc9edeb88cf0c557,2025-07-28T18:39:13Z,negative,0.9199251532554626,0.02030721865594387,0.0597677156329155
MSFT,"Dear Microsoft Stock Fans, Mark Your Calendars for Aug. 1",https://finnhub.io/api/news?id=acba7751b866f9987265574dc573367e9733c0c556255b98fb31ec2a8dcac3e3,2025-07-28T18:33:17Z,positive,0.025235425680875778,0.04305357113480568,0.9317110180854797
AMZN,Dollar Climbs Most Since May as Trade Jitters Ease: Markets Wrap,https://finnhub.io/api/news?id=d88e6691539bd9dff68b90b2c67e6bf78298091f42c1289926ba4b92ed6d283d,2025-07-28T18:31:10Z,neutral,0.3558743894100189,0.5751981139183044,0.06892745196819305
MSFT,Dollar Climbs Most Since May as Trade Jitters Ease: Markets Wrap,https://finnhub.io/api/news?id=d88e6691539bd9dff68b90b2c67e6bf78298091f42c1289926ba4b92ed6d283d,2025-07-28T18:31:10Z,neutral,0.3558743894100189,0.5751981139183044,0.06892745196819305
AAPL,Dollar Climbs Most Since May as Trade Jitters Ease: Markets Wrap,https://finnhub.io/api/news?id=d88e6691539bd9dff68b90b2c67e6bf78298091f42c1289926ba4b92ed6d283d,2025-07-28T18:31:10Z,neutral,0.3558743894100189,0.5751981139183044,0.06892745196819305
AAPL,Nasdaq Reaches for Another Record as Bad Breadth Plagues S&P 500,https://finnhub.io/api/news?id=61975ab5922e311c1523f3cc96b970e6f25632c69451258fea1f7acb215e7766,2025-07-28T18:21:36Z,neutral,0.038027845323085785,0.8767129778862,0.08525922149419785
GOOGL,Nasdaq Reaches for Another Record as Bad Breadth Plagues S&P 500,https://finnhub.io/api/news?id=61975ab5922e311c1523f3cc96b970e6f25632c69451258fea1f7acb215e7766,2025-07-28T18:21:36Z,neutral,0.038027845323085785,0.8767129778862,0.08525922149419785
AMZN,Nasdaq Reaches for Another Record as Bad Breadth Plagues S&P 500,https://finnhub.io/api/news?id=61975ab5922e311c1523f3cc96b970e6f25632c69451258fea1f7acb215e7766,2025-07-28T18:21:36Z,neutral,0.038027845323085785,0.8767129778862,0.08525922149419785
AAPL,"Equities Mixed Intraday as Focus Shifts From EU Deal to Earnings, Fed Decision",https://finnhub.io/api/news?id=780e59c1cdb02ed4387450b3f6792dbb0439eb41a781412c4dce5b925f139814,2025-07-28T18:18:25Z,neutral,0.31634530425071716,0.3674633502960205,0.31619128584861755
AMZN,"Equities Mixed Intraday as Focus Shifts From EU Deal to Earnings, Fed Decision",https://finnhub.io/api/news?id=780e59c1cdb02ed4387450b3f6792dbb0439eb41a781412c4dce5b925f139814,2025-07-28T18:18:25Z,neutral,0.31634530425071716,0.3674633502960205,0.31619128584861755
MSFT,"Equities Mixed Intraday as Focus Shifts From EU Deal to Earnings, Fed Decision",https://finnhub.io/api/news?id=780e59c1cdb02ed4387450b3f6792dbb0439eb41a781412c4dce5b925f139814,2025-07-28T18:18:25Z,neutral,0.31634530425071716,0.3674633502960205,0.31619128584861755
GOOGL,Morgan Stanley names tech stock winner from One Big Beautiful Bill Act,https://finnhub.io/api/news?id=3b26c58f55f88786cc918afb88f73362c09f287674c95e5eeb6d9495d7e7a9b8,2025-07-28T18:17:00Z,positive,0.16948089003562927,0.0162808895111084,0.8142382502555847
AMZN,Morgan Stanley names tech stock winner from One Big Beautiful Bill Act,https://finnhub.io/api/news?id=3b26c58f55f88786cc918afb88f73362c09f287674c95e5eeb6d9495d7e7a9b8,2025-07-28T18:17:00Z,positive,0.16948089003562927,0.0162808895111084,0.8142382502555847
MSFT,"Opendoor (OPEN) Stock Trades Down, Here Is Why",https://finnhub.io/api/news?id=22378f8627faede3f92483506c1b785e8584512b910f250ee12e6d64a1fcf333,2025-07-28T18:15:54Z,neutral,0.02575063705444336,0.6759916543960571,0.2982577383518219
GOOGL,"Opendoor (OPEN) Stock Trades Down, Here Is Why",https://finnhub.io/api/news?id=22378f8627faede3f92483506c1b785e8584512b910f250ee12e6d64a1fcf333,2025-07-28T18:15:54Z,neutral,0.02575063705444336,0.6759916543960571,0.2982577383518219
GOOGL,Why Are Super Micro (SMCI) Shares Soaring Today,https://finnhub.io/api/news?id=34193999fe744069231c8383efa3d0fa17878ff5815e8e96b38307ce660e1440,2025-07-28T18:15:41Z,positive,0.31746095418930054,0.13401828706264496,0.5485207438468933
MSFT,Why Are Super Micro (SMCI) Shares Soaring Today,https://finnhub.io/api/news?id=34193999fe744069231c8383efa3d0fa17878ff5815e8e96b38307ce660e1440,2025-07-28T18:15:41Z,positive,0.31746095418930054,0.13401828706264496,0.5485207438468933
GOOGL,YouTube vs Netflix: User-led 'open' platforms rise in popularity,https://finnhub.io/api/news?id=88e26d0beeaf1091bb53e2d2eca750ee73a6105228804bc6bec7d16a55ce4a8b,2025-07-28T18:00:00Z,negative,0.9307835102081299,0.03510464355349541,0.03411184251308441
AMZN,DoD tests AI models that make it easy to switch from vendors like Palantir,https://finnhub.io/api/news?id=20878e381f8f4f22c6d413502c690d2d76f992f52405c0c52eaaafab1f4682ad,2025-07-28T17:51:03Z,positive,0.24545328319072723,0.009349365718662739,0.7451974153518677
MSFT,DoD tests AI models that make it easy to switch from vendors like Palantir,https://finnhub.io/api/news?id=20878e381f8f4f22c6d413502c690d2d76f992f52405c0c52eaaafab1f4682ad,2025-07-28T17:51:03Z,positive,0.24545328319072723,0.009349365718662739,0.7451974153518677
AAPL,Google Will Soon Be Told How to End Its Monopoly. What That Means for Apple.,https://finnhub.io/api/news?id=f8324a9fdaf49829cd2ab473e02d03e1c564a364cbc6c32fc2485aaef9842252,2025-07-28T17:49:00Z,positive,0.050213493406772614,0.021564243361353874,0.9282222390174866
GOOGL,Google Will Soon Be Told How to End Its Monopoly. What That Means for Apple.,https://finnhub.io/api/news?id=f8324a9fdaf49829cd2ab473e02d03e1c564a364cbc6c32fc2485aaef9842252,2025-07-28T17:49:00Z,positive,0.050213493406772614,0.021564243361353874,0.9282222390174866
AAPL,Can Apple's Slim iPhone And Cheaper Macs Reverse The 2025 Stock Slump?,https://finnhub.io/api/news?id=045d715afabd8ab01813429c16f7f4651c3e56d7f76667a536367f32d722c586,2025-07-28T17:48:58Z,positive,0.3677592873573303,0.08644621074199677,0.5457945466041565
GOOGL,Can Apple's Slim iPhone And Cheaper Macs Reverse The 2025 Stock Slump?,https://finnhub.io/api/news?id=045d715afabd8ab01813429c16f7f4651c3e56d7f76667a536367f32d722c586,2025-07-28T17:48:58Z,positive,0.3677592873573303,0.08644621074199677,0.5457945466041565
AMZN,What Analysts Think of Amazon Stock Ahead of Earnings,https://finnhub.io/api/news?id=6e582ed633fbadf9851674e01f137264f8aab1a7a375e222ed5c2deb6bcc9fa5,2025-07-28T17:44:40Z,positive,0.02597738243639469,0.03795458748936653,0.9360679984092712
NVDA,Mark Cuban has a four-word blunt response to memes,https://finnhub.io/api/news?id=6cb4dfab7d5399da4bfc3af35510a5cf2bbc078612e3457e3060f4a76b8dfddb,2025-07-28T17:37:12Z,positive,0.053305260837078094,0.18778176605701447,0.758912980556488
AAPL,Magsafe Accessories Market Size to Grow USD 16140 Million by 2031 at a CAGR of 4.7% | Valuates Reports,https://finnhub.io/api/news?id=4ce468492861748f701adfb61363890e6a1a44afe21f9398c4817b74ada2bbc0,2025-07-28T17:35:00Z,negative,0.9254466891288757,0.008973835036158562,0.06557944416999817
GOOGL,Google Parent Alphabet's Legal Woes May Create Buying Opportunity: Analyst,https://finnhub.io/api/news?id=f182722bdf8c40cd192e63084bbbf0b79e7a13a18ac6c7471e5af60ebde77605,2025-07-28T17:31:26Z,positive,0.20537564158439636,0.05343550443649292,0.7411888837814331
AMZN,"Tariffs will likely raise toy prices, toymaker warns",https://finnhub.io/api/news?id=0f1da03e4bc24d2db509e2e2320d0160a9757b2f33e7f7cea81b039d9f180900,2025-07-28T17:30:37Z,neutral,0.3771067261695862,0.5840011835098267,0.03889212757349014
NVDA,Tempus AI or NVIDIA: Which is the Smarter Bet in AI-Backed Healthcare?,https://finnhub.io/api/news?id=f700ccf433e5fa395f86edf4850f9e39bde85d0db4609169aaa917819f90cf7d,2025-07-28T17:30:00Z,positive,0.04746488109230995,0.019086532294750214,0.9334486722946167
MSFT,Is Applied Digital Stock a Smart Buy Before Q4 Earnings Report?,https://finnhub.io/api/news?id=d07d7d632dc882946adeaea7f596f0790aa7078931be6ba89042484815e3db91,2025-07-28T17:04:00Z,positive,0.06678453087806702,0.019916962832212448,0.913298487663269
GOOGL,Is Applied Digital Stock a Smart Buy Before Q4 Earnings Report?,https://finnhub.io/api/news?id=d07d7d632dc882946adeaea7f596f0790aa7078931be6ba89042484815e3db91,2025-07-28T17:04:00Z,positive,0.06678453087806702,0.019916962832212448,0.913298487663269
GOOGL,Microsoft’s Copilot Will Browse the Web With You in New Update,https://finnhub.io/api/news?id=d9084199f40fee468bc54617e325e1fad0148d0f8f6347e86567541a8c287ee2,2025-07-28T17:00:00Z,positive,0.048317279666662216,0.014450552873313427,0.9372321367263794
MSFT,Microsoft’s Copilot Will Browse the Web With You in New Update,https://finnhub.io/api/news?id=d9084199f40fee468bc54617e325e1fad0148d0f8f6347e86567541a8c287ee2,2025-07-28T17:00:00Z,positive,0.048317279666662216,0.014450552873313427,0.9372321367263794
GOOGL,Google Chrome adds AI-powered store summaries to help US shoppers,https://finnhub.io/api/news?id=f7490e75b568c29a3f2d9b0736fefdb71cd81cde639e1b8c68acd4d98a2cf5e3,2025-07-28T17:00:00Z,positive,0.1396283507347107,0.012792450375854969,0.8475791811943054
MSFT,"Stock market today: Dow, S&P 500, Nasdaq waver as Trump-EU trade deal kicks off huge week",https://finnhub.io/api/news?id=88d92db9ae1caaebd0dc7b2adbfd9f0f875036f416cf71a77c0734a1aa1320a7,2025-07-28T16:53:27Z,neutral,0.08122964948415756,0.6886757612228394,0.23009462654590607
AMZN,"Stock market today: Dow, S&P 500, Nasdaq waver as Trump-EU trade deal kicks off huge week",https://finnhub.io/api/news?id=88d92db9ae1caaebd0dc7b2adbfd9f0f875036f416cf71a77c0734a1aa1320a7,2025-07-28T16:53:27Z,neutral,0.08122964948415756,0.6886757612228394,0.23009462654590607
AAPL,"Stock market today: Dow, S&P 500, Nasdaq waver as Trump-EU trade deal kicks off huge week",https://finnhub.io/api/news?id=88d92db9ae1caaebd0dc7b2adbfd9f0f875036f416cf71a77c0734a1aa1320a7,2025-07-28T16:53:27Z,neutral,0.08122964948415756,0.6886757612228394,0.23009462654590607
NVDA,"AMD Raises AI Chip Price, Confident It Can Compete With Nvidia",https://finnhub.io/api/news?id=cdfe47925a6d85bdf598259b5336c26200b73d592907c9e6051345a373cfe3dd,2025-07-28T16:40:07Z,negative,0.9460600018501282,0.01899806782603264,0.03494185954332352
NVDA,"AMD Stock Is Rising. Its AI Chip Business Is Improving, Says Analyst.",https://finnhub.io/api/news?id=57a289ed0c9908a70c6b680b9455c76e69ad39e8d481f0641d6096e780be5a45,2025-07-28T16:40:00Z,negative,0.9578077793121338,0.017714468762278557,0.024477658793330193
AMZN,META Enhances Teen Privacy Measures: Will It Drive Ad Revenue Growth?,https://finnhub.io/api/news?id=dae0ee8b9e35d8ce12f5f8956bb8bf363877642f0c99534fa2fe93b17605a777,2025-07-28T16:40:00Z,positive,0.3787141442298889,0.008346470072865486,0.6129393577575684
MSFT,META Enhances Teen Privacy Measures: Will It Drive Ad Revenue Growth?,https://finnhub.io/api/news?id=dae0ee8b9e35d8ce12f5f8956bb8bf363877642f0c99534fa2fe93b17605a777,2025-07-28T16:40:00Z,positive,0.3787141442298889,0.008346470072865486,0.6129393577575684
AAPL,What Analysts Think of Apple Stock Ahead of Earnings,https://finnhub.io/api/news?id=13b2dce23b9211fe81c88e6622aa3784acc3bf9224a6773a96f3e3fba36d0958,2025-07-28T16:38:47Z,positive,0.02503369003534317,0.04684775695204735,0.9281185269355774
GOOGL,What Analysts Think of Apple Stock Ahead of Earnings,https://finnhub.io/api/news?id=13b2dce23b9211fe81c88e6622aa3784acc3bf9224a6773a96f3e3fba36d0958,2025-07-28T16:38:47Z,positive,0.02503369003534317,0.04684775695204735,0.9281185269355774
AAPL,Stock Market Today: Dow Dips As Microsoft Slips Ahead Of Earnings; Cathie Wood Loads Up On This Stock Amid 47% Plunge (Live Coverage),https://finnhub.io/api/news?id=0ec92c180be8031a9cd583b4fb96d9cf29d25d8d81ecf1245fd508bfbac1416a,2025-07-28T16:38:02Z,neutral,0.015484631061553955,0.9597815871238708,0.024733789265155792
AMZN,"Amazon set to Outperform due to Investments Across Ecommerce, AWS, and Kuiper, UBS Says",https://finnhub.io/api/news?id=dcda84aa045e918aa275bb3bc5db5959187cc7654f567d650e1a62822bba9e75,2025-07-28T16:35:23Z,negative,0.9525272250175476,0.020820975303649902,0.02665184997022152
AMZN,Will Higher Ad Revenues Aid Meta Platforms in Q2 Earnings?,https://finnhub.io/api/news?id=d3bf246603f3917644e82d44c772858e5669d9d89cfb22310967cc0ad0be2a04,2025-07-28T16:33:00Z,negative,0.8843063712120056,0.01627534069120884,0.09941831231117249
GOOGL,Will Higher Ad Revenues Aid Meta Platforms in Q2 Earnings?,https://finnhub.io/api/news?id=d3bf246603f3917644e82d44c772858e5669d9d89cfb22310967cc0ad0be2a04,2025-07-28T16:33:00Z,negative,0.8843063712120056,0.01627534069120884,0.09941831231117249
GOOGL,Tesla and 3 More Stocks Whose Charts Point to Post-Earnings Gains,https://finnhub.io/api/news?id=1fd724706cc2f9b5a5a9c835603cee3c9fd16062eeb66f2387ee40dceb9e0b7c,2025-07-28T16:27:00Z,positive,0.06183323636651039,0.054983701556921005,0.8831830620765686
AAPL,ARM to Post Q1 Earnings: Should the Stock be in Your Portfolio?,https://finnhub.io/api/news?id=fd618981ae4c5aca5d1a1fcdba7e31977397fc97f76526b5a63ed84dad452879,2025-07-28T16:25:00Z,positive,0.0332738496363163,0.02731967903673649,0.9394065141677856
AAPL,"US smartphone market sees sluggish growth as India-made phones surge, Canalys says",https://finnhub.io/api/news?id=c00d6874cc87cb5030279dfaee8f1c14b0ee58ad28ba0464e0ae6527b4af9983,2025-07-28T16:22:23Z,neutral,0.028958281502127647,0.9354701638221741,0.03557148948311806
