ticker,title,link,pubDate,sentiment,p_negative,p_neutral,p_positive
AAPL,Apple Loses German Case On Green Marketing Pledge,https://finnhub.io/api/news?id=2ce75c880408058d8a276d83753fe01903ac146b8c6b12ab0e798d1b2418f5b2,2025-08-26T12:52:24Z,neutral,0.0889587253332138,0.7856122851371765,0.1254289746284485
GOOGL,SEO Optimizers Launches Next-Gen AI SEO Services to Help Businesses Rank in AI Search and LLM Results,https://finnhub.io/api/news?id=e239fb22a9d3f829106a5c13f88b8fb96242af92a2df3498b30107f56e42ecfa,2025-08-26T12:51:00Z,negative,0.5282257795333862,0.008858607150614262,0.4629155695438385
AMZN,Coca-Cola's failed coffee investment faces uncertain future as sale rumors brew,https://finnhub.io/api/news?id=86687226e6505d951ac65ea47a374ee0bd066b0e12574cac2a46d006708792fb,2025-08-26T12:47:04Z,neutral,0.01573951728641987,0.8655244708061218,0.11873597651720047
AAPL,EU Defends Digital Taxes After Trump Calls Them Unfair on US,https://finnhub.io/api/news?id=7de834c2295cd83ee6630cf06bc371f15816a768702ce246a190d1133a4baa23,2025-08-26T12:44:32Z,neutral,0.12343281507492065,0.7001034021377563,0.17646388709545135
GOOGL,EU Defends Digital Taxes After Trump Calls Them Unfair on US,https://finnhub.io/api/news?id=7de834c2295cd83ee6630cf06bc371f15816a768702ce246a190d1133a4baa23,2025-08-26T12:44:32Z,neutral,0.12343281507492065,0.7001034021377563,0.17646388709545135
AMZN,Dr. Eric Berg and Dr. Berg Nutritionals Announce Key Milestones and Health Initiatives,https://finnhub.io/api/news?id=947067a7c98337b343ce4a7d7254a83eadd191d03c11219e724810f3426fddce,2025-08-26T12:44:00Z,positive,0.26310282945632935,0.008303362876176834,0.7285938262939453
GOOGL,Latest News In Cloud AI - Aurasell Transforms CRM Landscape With AI-Native Platform Launch,https://finnhub.io/api/news?id=207ea8323e1b58d3848a4374d82364443f6b0455e6408f0507c116e10ddbf39c,2025-08-26T12:43:28Z,positive,0.1989467293024063,0.010114280506968498,0.7909389734268188
MSFT,Latest News In Cloud AI - Aurasell Transforms CRM Landscape With AI-Native Platform Launch,https://finnhub.io/api/news?id=207ea8323e1b58d3848a4374d82364443f6b0455e6408f0507c116e10ddbf39c,2025-08-26T12:43:28Z,positive,0.1989467293024063,0.010114280506968498,0.7909389734268188
AAPL,Latest News In Cloud AI - Aurasell Transforms CRM Landscape With AI-Native Platform Launch,https://finnhub.io/api/news?id=207ea8323e1b58d3848a4374d82364443f6b0455e6408f0507c116e10ddbf39c,2025-08-26T12:43:28Z,positive,0.1989467293024063,0.010114280506968498,0.7909389734268188
GOOGL,AI Powers AR: Spotselfie Debuts Real-World Ad Marketplace for Brands & Creators,https://finnhub.io/api/news?id=90be422c09d26a51591bdec839617db7929d82f81f97ba77a05df28e656398a3,2025-08-26T12:32:00Z,positive,0.16014859080314636,0.008460529148578644,0.831390917301178
AAPL,AI Powers AR: Spotselfie Debuts Real-World Ad Marketplace for Brands & Creators,https://finnhub.io/api/news?id=90be422c09d26a51591bdec839617db7929d82f81f97ba77a05df28e656398a3,2025-08-26T12:32:00Z,positive,0.16014859080314636,0.008460529148578644,0.831390917301178
GOOGL,"Alphabet: Momentum Keeps Building, And The Stock Remains A Buy",https://finnhub.io/api/news?id=20f5f8c627f4b08892c41e9ecddf61c00f445481ae2b709aee5085792fdbeae3,2025-08-26T12:31:36Z,negative,0.8460190296173096,0.015881149098277092,0.138099804520607
MSFT,Corpay Cross-Border Partners with SKsoft to Power Seamless Global Payments,https://finnhub.io/api/news?id=ccc4fbd7534af3382776bc9a0e145e6ac9b53cacdaef674b669211389ede02ce,2025-08-26T12:30:00Z,negative,0.5602049231529236,0.007325279526412487,0.4324698746204376
NVDA,2 Reasons AMD Stock Is Rising Today,https://finnhub.io/api/news?id=c9c91e6b57748093722235ba9f9864af4e0ad3fd8a3ea7774973e57ac597578a,2025-08-26T12:24:00Z,negative,0.9356381297111511,0.014999797567725182,0.04936208203434944
GOOGL,Alphabet: Fear Pushes Price To Bargain Levels Investors Dream Of,https://finnhub.io/api/news?id=aca1cdd9c5c81d9206d00c5b7b52e3102ad8ef80606a5bf0599a2bc7d0db2806,2025-08-26T12:18:42Z,neutral,0.07939805835485458,0.5302324295043945,0.39036956429481506
AMZN,"Boring Is Better Than Amazon, Apple, and Alphabet. These 3 Stocks Prove It.",https://finnhub.io/api/news?id=91abe67ba7809fa434c3ca366e8a93ff76cea29a866a1272fd1007da924b21f8,2025-08-26T12:16:00Z,positive,0.3578023910522461,0.011102558113634586,0.6310949921607971
AAPL,"Boring Is Better Than Amazon, Apple, and Alphabet. These 3 Stocks Prove It.",https://finnhub.io/api/news?id=91abe67ba7809fa434c3ca366e8a93ff76cea29a866a1272fd1007da924b21f8,2025-08-26T12:16:00Z,positive,0.3578023910522461,0.011102558113634586,0.6310949921607971
MSFT,"Boring Is Better Than Amazon, Apple, and Alphabet. These 3 Stocks Prove It.",https://finnhub.io/api/news?id=91abe67ba7809fa434c3ca366e8a93ff76cea29a866a1272fd1007da924b21f8,2025-08-26T12:16:00Z,positive,0.3578023910522461,0.011102558113634586,0.6310949921607971
GOOGL,"Boring Is Better Than Amazon, Apple, and Alphabet. These 3 Stocks Prove It.",https://finnhub.io/api/news?id=91abe67ba7809fa434c3ca366e8a93ff76cea29a866a1272fd1007da924b21f8,2025-08-26T12:16:00Z,positive,0.3578023910522461,0.011102558113634586,0.6310949921607971
MSFT,Microsoft Corporation’s (MSFT) AI Investment Gained Confidence Amid Operational Discipline,https://finnhub.io/api/news?id=1db5265a0d024faba4831f85d83c4bb536a359213a68e77f89d8520e5d54d1b9,2025-08-26T12:06:37Z,negative,0.9558292627334595,0.015254207886755466,0.028916552662849426
MSFT,Dhisana AI Aims to Be Cursor for Sales Teams,https://finnhub.io/api/news?id=ab039f4fa9c14fc696e4b6381954eb4d066b2eba8f5c6cc64721b59038db3776,2025-08-26T12:00:00Z,positive,0.11650346964597702,0.00852072425186634,0.8749758005142212
AMZN,Luxury Presence Accelerates Growth Through $75M ARR with Key Executive Hires and Expanded AI Product Team,https://finnhub.io/api/news?id=2656e6ea3ec5a475c0b4077cf7527ad4107091598dadc3fc41329474ac64c90f,2025-08-26T12:00:00Z,negative,0.9468787312507629,0.012258523143827915,0.04086273908615112
AMZN,"Tekumo, Inc. Launches Strategic Pilot Project with Major OEM to Support Amazon's Nationwide Pharmacy Expansion",https://finnhub.io/api/news?id=0d53ac94ab051b4692c658e384ad3536c928ae6c07b16dadc7e01d264984e5be,2025-08-26T12:00:00Z,negative,0.9323145151138306,0.01308448612689972,0.054600995033979416
GOOGL,Frontier buys $31M worth of antacids for the ocean,https://finnhub.io/api/news?id=5ca5a39dfa8c773cd9f574519ba71ccec662e73f4c3d0699d675f8c40dfa21d9,2025-08-26T12:00:00Z,positive,0.26723113656044006,0.00871986337006092,0.7240490913391113
GOOGL,"IBM-AMD Alliance Targets Drug Discovery, Climate Modeling With Quantum Supercomputers",https://finnhub.io/api/news?id=bbae6fc3dc2ecf2ec91058c0538681d47fdc2a7152a41c78f5fe2720759c14e8,2025-08-26T11:53:02Z,positive,0.21225547790527344,0.007456262595951557,0.7802882194519043
MSFT,The AI Revolution Is Devouring Everything,https://finnhub.io/api/news?id=a96b3a6589be31174cca33efbcab529bb7bccb122e0d4c314d2bf0f14a4393ed,2025-08-26T11:36:40Z,positive,0.025647053495049477,0.1482163667678833,0.8261366486549377
GOOGL,The AI Revolution Is Devouring Everything,https://finnhub.io/api/news?id=a96b3a6589be31174cca33efbcab529bb7bccb122e0d4c314d2bf0f14a4393ed,2025-08-26T11:36:40Z,positive,0.025647053495049477,0.1482163667678833,0.8261366486549377
AMZN,The AI Revolution Is Devouring Everything,https://finnhub.io/api/news?id=a96b3a6589be31174cca33efbcab529bb7bccb122e0d4c314d2bf0f14a4393ed,2025-08-26T11:36:40Z,positive,0.025647053495049477,0.1482163667678833,0.8261366486549377
AAPL,"Tech, Media & Telecom Roundup: Market Talk",https://finnhub.io/api/news?id=6f3c57dee3ef235b9c03327c1368efb31c146d3c0770094cd015d9072c9ee71b,2025-08-26T11:15:00Z,positive,0.050609517842531204,0.0198239516466856,0.929566502571106
GOOGL,Alphabet's YouTube Says Fox Channels Could Go Dark Over Payment Issue,https://finnhub.io/api/news?id=113d3f797af14b296102af1812314bfc747a9ce4dc9a79bf075542a2fb883406,2025-08-26T11:09:22Z,neutral,0.01170023437589407,0.848254382610321,0.1400453895330429
GOOGL,Apple’s August Stock Revival Gives Hope to Concerned Investors,https://finnhub.io/api/news?id=d4af929538b268228162d9bd3115adb945972a5278888c20ddcf0732ece89dc8,2025-08-26T11:01:00Z,negative,0.5289307832717896,0.26665475964546204,0.204414501786232
AAPL,Apple’s August Stock Revival Gives Hope to Concerned Investors,https://finnhub.io/api/news?id=d4af929538b268228162d9bd3115adb945972a5278888c20ddcf0732ece89dc8,2025-08-26T11:01:00Z,negative,0.5289307832717896,0.26665475964546204,0.204414501786232
GOOGL,Aehr Test Systems: Narrative Has Shifted To AI (Rating Upgrade),https://finnhub.io/api/news?id=7a2837b3a29d1e01bce13c4bcbe7f216ef77d500c127db9834d1458fb9d228aa,2025-08-26T10:52:43Z,positive,0.10796850174665451,0.01727403700351715,0.8747574090957642
GOOGL,Could Alphabet Be About to Start Mining Bitcoin?,https://finnhub.io/api/news?id=0c08db986677e57be2cd907c2432ff15765c0c9e58126c8a20345b7a7827cb63,2025-08-26T10:50:00Z,positive,0.0325237400829792,0.029712047427892685,0.9377642869949341
AMZN,"Exploring Trends Across Asset Classes, Mega-Caps, And Banks",https://finnhub.io/api/news?id=e261ed2b3678ac77557c1b354cdc074ed03a8137a6ce9fe9d83108f769ba1221,2025-08-26T10:38:00Z,positive,0.06301042437553406,0.015482043847441673,0.9215074777603149
MSFT,"Exploring Trends Across Asset Classes, Mega-Caps, And Banks",https://finnhub.io/api/news?id=e261ed2b3678ac77557c1b354cdc074ed03a8137a6ce9fe9d83108f769ba1221,2025-08-26T10:38:00Z,positive,0.06301042437553406,0.015482043847441673,0.9215074777603149
AAPL,"Exploring Trends Across Asset Classes, Mega-Caps, And Banks",https://finnhub.io/api/news?id=e261ed2b3678ac77557c1b354cdc074ed03a8137a6ce9fe9d83108f769ba1221,2025-08-26T10:38:00Z,positive,0.06301042437553406,0.015482043847441673,0.9215074777603149
AAPL,Trump Fires Another Shot at the Fed. The Economy Could Be Collateral Damage.,https://finnhub.io/api/news?id=feea0a87baf07a24584e4e8b8248a325a74996a515c6f040e4bcbf11919f7830,2025-08-26T10:30:00Z,neutral,0.01839306950569153,0.8795160055160522,0.10209089517593384
GOOGL,BUZZ Investing: Stocks Push Higher Amid Low Volatility And Policy Crosscurrents,https://finnhub.io/api/news?id=e2cfbe60b069850f8467db10a3e35071ba303d39ed505c5cdc886d184601c603,2025-08-26T10:25:00Z,negative,0.9390476942062378,0.028989186510443687,0.031963154673576355
MSFT,Viasat’s SouthPAN Satellite Contract Win Might Change the Case for Investing in VSAT,https://finnhub.io/api/news?id=dbe2607104af8a77b766bc9f6b2206891ff63f4c85fd9205f58c925f39fdec18,2025-08-26T10:16:03Z,positive,0.12883400917053223,0.021603764966130257,0.8495622277259827
MSFT,Willdan Group (WLDN) Is Up 5.9% After Analysts Boost Earnings Estimates and Raise Outlook – What's Changed,https://finnhub.io/api/news?id=96b03a1c0d1e4cb1e7d53ccb5571db2b018cf51b6a1254203e36ef7e748e1319,2025-08-26T10:14:56Z,negative,0.9459211230278015,0.02646520547568798,0.02761376090347767
MSFT,How Nike's Trail Running Launch and Push in China Could Shape the NKE Investment Narrative,https://finnhub.io/api/news?id=1b6223c5480e5a3d46651a46d9bac5f3d48a07e9ee975d52f12732838fb0c62c,2025-08-26T10:12:44Z,positive,0.1169314980506897,0.009424015879631042,0.8736445307731628
MSFT,How XP’s Strong Q2 Earnings and Revenue Beat May Shape Its Investment Outlook (XP),https://finnhub.io/api/news?id=a6ed94da39ba20e21fa787810214cd36449b4d3e742353a5523feaa420b962aa,2025-08-26T10:09:26Z,positive,0.1260240226984024,0.015516665764153004,0.8584593534469604
MSFT,Nvidia results to spotlight fallout of China-US trade war,https://finnhub.io/api/news?id=477a260b89c7e99d0fc820b9d7c33f220939f3e4d6c1794159f8c64b359492a4,2025-08-26T10:06:57Z,positive,0.0524551160633564,0.43562549352645874,0.511919379234314
MSFT,How Investors May Respond To Weibo (WB) Reporting Higher Q2 Earnings and Net Income,https://finnhub.io/api/news?id=36cbc895395794eb5107f6b382f07a3a1a6cbed2a6ef3a22551fcab1366df1e1,2025-08-26T10:06:41Z,negative,0.8123908042907715,0.07121853530406952,0.11639069765806198
GOOGL,Apple-Google Likely Tie-Up for Siri Revamp Puts These ETFs in Focus,https://finnhub.io/api/news?id=94c168d3e743b209b245da5b32ecc7207d844937d4d278cf72a515e5a0057625,2025-08-26T10:00:00Z,positive,0.08700749278068542,0.01606549322605133,0.8969269394874573
AAPL,Apple-Google Likely Tie-Up for Siri Revamp Puts These ETFs in Focus,https://finnhub.io/api/news?id=94c168d3e743b209b245da5b32ecc7207d844937d4d278cf72a515e5a0057625,2025-08-26T10:00:00Z,positive,0.08700749278068542,0.01606549322605133,0.8969269394874573
AAPL,"Circular Economy Market to Soar from $149.86 Billion in 2024 to $355.44 Billion by 2032, Driven by ESG Adoption and Recycling Innovation | Report by DataM Intelligence",https://finnhub.io/api/news?id=7ae834401cec373cbbebc6770403f421198ff3a98febd8a0a916ffaf4027c8bb,2025-08-26T10:00:00Z,negative,0.9441908597946167,0.023813704028725624,0.03199547156691551
AAPL,"Apple Watch not a 'CO2-neutral product,' German court finds",https://finnhub.io/api/news?id=6bba43b58fbaa3325141222ddf982d019366b4f7af671d3278bcea9d588d4ec3,2025-08-26T09:58:49Z,positive,0.06369355320930481,0.11654184758663177,0.8197645545005798
AMZN,Is Amazon's Golden Goose Turning Into a Red Flag?,https://finnhub.io/api/news?id=4f1fe204153e78c12150c3bbbe888b5901d166a558d1c81e4f34a4a8a13e13ed,2025-08-26T09:35:00Z,neutral,0.04219263046979904,0.4855693578720093,0.47223803400993347
GOOGL,Ex-MiniMax co-founder's new venture aims to challenge Tencent and Google in 3D AI models,https://finnhub.io/api/news?id=2956288f0318ef54facb82af44d5eb894561f3943fb302447a63269266f51bf5,2025-08-26T09:30:00Z,positive,0.3759748935699463,0.00813766848295927,0.6158874034881592
GOOGL,"Tech Weekly: Intel's activist investor, Google's new salesman",https://finnhub.io/api/news?id=b718f366e86a72f8c5ada70a849c114e058d776fdccfc3e04cfb99ffd5b45200,2025-08-26T09:20:47Z,positive,0.07085776329040527,0.018929705023765564,0.910212516784668
AAPL,Elon Musk’s xAI files lawsuit against Apple and OpenAI,https://finnhub.io/api/news?id=d4ee4300cb2fbdea35e2495786189edac83b6f9f477ab491f5251d1a371f90e6,2025-08-26T09:06:45Z,neutral,0.02846379764378071,0.7053092122077942,0.2662268877029419
AAPL,"Elon Musk Sues Apple, OpenAI Over iPhone AI 'Monopoly'",https://finnhub.io/api/news?id=eb6c93280471945b15f63b8433082dc950ee64a93ed4fedc248ad5d566b1c58b,2025-08-26T09:01:03Z,neutral,0.03229624032974243,0.6266195774078369,0.34108421206474304
MSFT,A Warning To Dividend Investors,https://finnhub.io/api/news?id=e4197eeb19695697d6b9e62d7c02df05d2c50aec750252ecc67225d40e84a698,2025-08-26T09:00:00Z,positive,0.04318802058696747,0.15129168331623077,0.8055202960968018
AMZN,Labour accused of abandoning UK tech in AI push,https://finnhub.io/api/news?id=afa0535831fcd97266559a9d37f57a658c3075f6d66955f03b2c79cb1ff64bb0,2025-08-26T09:00:00Z,neutral,0.0330108106136322,0.8089388608932495,0.15805038809776306
AAPL,Labour accused of abandoning UK tech in AI push,https://finnhub.io/api/news?id=afa0535831fcd97266559a9d37f57a658c3075f6d66955f03b2c79cb1ff64bb0,2025-08-26T09:00:00Z,neutral,0.0330108106136322,0.8089388608932495,0.15805038809776306
GOOGL,Trump Vows to Retaliate Over Taxes on Tech Giants,https://finnhub.io/api/news?id=b1e9b4e8646a1c61fc0b10222375a0805e6046f6dce0eade1310c277c5734322,2025-08-26T08:58:09Z,neutral,0.04119308292865753,0.8738462924957275,0.08496057987213135
AMZN,3 Things Investors Should Know About the New Deal Between Amazon and Hertz,https://finnhub.io/api/news?id=d71e8b3a2e94dba75eebda3209fb6c988342833277fd84f1e1d38fd324dc405a,2025-08-26T08:55:00Z,positive,0.06030154600739479,0.014987440779805183,0.9247109889984131
GOOGL,Trump threatens tariffs on nations imposing digital taxes on US tech,https://finnhub.io/api/news?id=b776efdb64af47c5fe1e927b709c73cbe5c9c0d14ced2ac5e16a21f1476bbb8e,2025-08-26T08:46:55Z,neutral,0.025368351489305496,0.6101685166358948,0.36446303129196167
AAPL,Trump threatens tariffs on nations imposing digital taxes on US tech,https://finnhub.io/api/news?id=b776efdb64af47c5fe1e927b709c73cbe5c9c0d14ced2ac5e16a21f1476bbb8e,2025-08-26T08:46:55Z,neutral,0.025368351489305496,0.6101685166358948,0.36446303129196167
AMZN,Trump threatens tariffs on nations imposing digital taxes on US tech,https://finnhub.io/api/news?id=b776efdb64af47c5fe1e927b709c73cbe5c9c0d14ced2ac5e16a21f1476bbb8e,2025-08-26T08:46:55Z,neutral,0.025368351489305496,0.6101685166358948,0.36446303129196167
MSFT,Trump threatens tariffs on nations imposing digital taxes on US tech,https://finnhub.io/api/news?id=b776efdb64af47c5fe1e927b709c73cbe5c9c0d14ced2ac5e16a21f1476bbb8e,2025-08-26T08:46:55Z,neutral,0.025368351489305496,0.6101685166358948,0.36446303129196167
MSFT,Prediction: 2 Stocks That'll Be Worth More Than Berkshire Hathaway 5 Years From Now,https://finnhub.io/api/news?id=f33417a3a5a437980a5180f2bf5f6287f63409452b581252b1955fcea7108cbc,2025-08-26T08:40:00Z,positive,0.20552752912044525,0.00966570619493723,0.7848067879676819
GOOGL,Prediction: 2 Stocks That'll Be Worth More Than Berkshire Hathaway 5 Years From Now,https://finnhub.io/api/news?id=f33417a3a5a437980a5180f2bf5f6287f63409452b581252b1955fcea7108cbc,2025-08-26T08:40:00Z,positive,0.20552752912044525,0.00966570619493723,0.7848067879676819
AAPL,Prediction: 2 Stocks That'll Be Worth More Than Berkshire Hathaway 5 Years From Now,https://finnhub.io/api/news?id=f33417a3a5a437980a5180f2bf5f6287f63409452b581252b1955fcea7108cbc,2025-08-26T08:40:00Z,positive,0.20552752912044525,0.00966570619493723,0.7848067879676819
MSFT,"This Beaten-Down Growth Stock Could Soar 32%, According to Wall Street",https://finnhub.io/api/news?id=e7b5d4d59642daa71887fae91dc1a669c1132c4e64a4aa88e601717091ded4e5,2025-08-26T08:23:00Z,neutral,0.3175618350505829,0.407835990190506,0.2746022045612335
GOOGL,"This Beaten-Down Growth Stock Could Soar 32%, According to Wall Street",https://finnhub.io/api/news?id=e7b5d4d59642daa71887fae91dc1a669c1132c4e64a4aa88e601717091ded4e5,2025-08-26T08:23:00Z,neutral,0.3175618350505829,0.407835990190506,0.2746022045612335
MSFT,"Uber, Capital One, and 6 More Growth Stocks to Buy That Aren’t Technology",https://finnhub.io/api/news?id=4a12616666923de0f0fca81d57ca5f36703d353d48dfda2ee2946ccfc6f07093,2025-08-26T08:22:00Z,positive,0.06426306068897247,0.012421357445418835,0.9233155250549316
GOOGL,Alphabet Inc. (GOOGL): A Bull Case Theory,https://finnhub.io/api/news?id=519a9a5034710e90d119a7d0cd1f6924ce016810bcf9783f9020d3c559db9b87,2025-08-26T08:15:22Z,positive,0.03482963144779205,0.02454845979809761,0.9406219124794006
AMZN,"Wall Street Breakfast Podcast: Trump Fires Cook, Threatens More Tariffs",https://finnhub.io/api/news?id=dfb538777ae981067d19edc7864c752efabdf58a28713289109d61c75297a09b,2025-08-26T08:07:00Z,neutral,0.02439803071320057,0.5067284107208252,0.468873530626297
AAPL,"Wall Street Breakfast Podcast: Trump Fires Cook, Threatens More Tariffs",https://finnhub.io/api/news?id=dfb538777ae981067d19edc7864c752efabdf58a28713289109d61c75297a09b,2025-08-26T08:07:00Z,neutral,0.02439803071320057,0.5067284107208252,0.468873530626297
GOOGL,"Wall Street Breakfast Podcast: Trump Fires Cook, Threatens More Tariffs",https://finnhub.io/api/news?id=dfb538777ae981067d19edc7864c752efabdf58a28713289109d61c75297a09b,2025-08-26T08:07:00Z,neutral,0.02439803071320057,0.5067284107208252,0.468873530626297
AMZN,Amazon: Why We Built A Position Amid Tariff-Related Volatility,https://finnhub.io/api/news?id=cd6a780464f2ba02baa2bbad84e842b9d3041c13cbf0e9a6192c56d51c574186,2025-08-26T08:00:00Z,negative,0.9190943241119385,0.027041494846343994,0.05386412516236305
AAPL,Heard on the Street Monday Recap: Trump’s New Deal,https://finnhub.io/api/news?id=31535f8995229bc9f0c38c870b6e861a6d0c18dd7d1ea1cab9a0c56060fb920e,2025-08-26T07:37:58Z,positive,0.1471080183982849,0.030512569472193718,0.8223794102668762
AAPL,"Elon Musk's xAI sues Apple, OpenAI over competition claims",https://finnhub.io/api/news?id=20e1a5980ae6bfeaa51588fb7adf04a8a77455ce6b836af5680092325a6affbf,2025-08-26T07:07:08Z,neutral,0.01828964799642563,0.8745701313018799,0.1071401834487915
AMZN,"United Parcel Service Stock Looks Cheap, But Can Its 7%+ Yielding Dividend Survive?",https://finnhub.io/api/news?id=f336c4c8ab26e930d4201e748e51014f8871b8b4247b856435b3f10cdb68f7eb,2025-08-26T07:05:39Z,positive,0.12088117748498917,0.020465867593884468,0.8586529493331909
GOOGL,"Prediction: This Unstoppable Stock Will Join Nvidia, Microsoft, and Apple in the $3 Trillion Club Before 2028",https://finnhub.io/api/news?id=0a902a286165aa31474fa39cd6d738bff751ff0a50ada011825d386ccd1e8ec8,2025-08-26T07:02:00Z,positive,0.4633917212486267,0.009152932092547417,0.5274553298950195
MSFT,"Prediction: This Unstoppable Stock Will Join Nvidia, Microsoft, and Apple in the $3 Trillion Club Before 2028",https://finnhub.io/api/news?id=0a902a286165aa31474fa39cd6d738bff751ff0a50ada011825d386ccd1e8ec8,2025-08-26T07:02:00Z,positive,0.4633917212486267,0.009152932092547417,0.5274553298950195
AAPL,"Prediction: This Unstoppable Stock Will Join Nvidia, Microsoft, and Apple in the $3 Trillion Club Before 2028",https://finnhub.io/api/news?id=0a902a286165aa31474fa39cd6d738bff751ff0a50ada011825d386ccd1e8ec8,2025-08-26T07:02:00Z,positive,0.4633917212486267,0.009152932092547417,0.5274553298950195
AMZN,"Prediction: This Unstoppable Stock Will Join Nvidia, Microsoft, and Apple in the $3 Trillion Club Before 2028",https://finnhub.io/api/news?id=0a902a286165aa31474fa39cd6d738bff751ff0a50ada011825d386ccd1e8ec8,2025-08-26T07:02:00Z,positive,0.4633917212486267,0.009152932092547417,0.5274553298950195
GOOGL,Xtend Unveils Marketplace-First Ecommerce Solution to Boost Brand Visibility and Conversions in Southeast Asia,https://finnhub.io/api/news?id=7d92425cf9bd602d96be727a4138a4964a2d0e0adc2c56e710528a7008f2070a,2025-08-26T05:05:00Z,negative,0.9193470478057861,0.007458842825144529,0.07319413870573044
AAPL,How to close the menopause pay gap,https://finnhub.io/api/news?id=4a9e22064b284c05ab6ed13378a663bd282d07b3a51b0d5867a7b0d0b20b906d,2025-08-26T05:00:35Z,positive,0.03192261978983879,0.11645710468292236,0.8516202569007874
AAPL,Trump vows retaliation against countries proposing digital taxes or regulation on American tech giants,https://finnhub.io/api/news?id=ce623059cb32952ee4c09957bbb8fecad99152bf240a69a20402253669f856ee,2025-08-26T04:14:25Z,neutral,0.03188245743513107,0.7386032342910767,0.22951428592205048
GOOGL,Trump vows retaliation against countries proposing digital taxes or regulation on American tech giants,https://finnhub.io/api/news?id=ce623059cb32952ee4c09957bbb8fecad99152bf240a69a20402253669f856ee,2025-08-26T04:14:25Z,neutral,0.03188245743513107,0.7386032342910767,0.22951428592205048
AAPL,The $5.5bn cup of coffee,https://finnhub.io/api/news?id=b784bf1bbf51f2a7ae66430e9a9fe87f284667b812b7af3558f0ad86558cc92e,2025-08-26T04:00:26Z,positive,0.18103039264678955,0.011872532777488232,0.8070970773696899
GOOGL,"China-Linked Hackers Targeted Diplomats in Asia, Google Says",https://finnhub.io/api/news?id=4ef97316ae7135508440b0923a3e6193592455e1ba46d04ac22bd0ddbb4b240f,2025-08-26T02:28:38Z,neutral,0.02713896706700325,0.8745203018188477,0.09834077954292297
MSFT,"If Alphabet 'Missed The AI Boat', What Does That Mean For Microsoft?",https://finnhub.io/api/news?id=1a5fda955c03aaba998730fccc86e289a1629019092450ece4a16e982f6379de,2025-08-26T01:50:00Z,positive,0.03050255961716175,0.3560272455215454,0.613470196723938
GOOGL,"If Alphabet 'Missed The AI Boat', What Does That Mean For Microsoft?",https://finnhub.io/api/news?id=1a5fda955c03aaba998730fccc86e289a1629019092450ece4a16e982f6379de,2025-08-26T01:50:00Z,positive,0.03050255961716175,0.3560272455215454,0.613470196723938
GOOGL,Trump Threatens New Tariffs on Countries That Tax Tech Companies,https://finnhub.io/api/news?id=40829cb218a0c64c450131095cd028fb0da1b27d42713a74bae23c7935ef7f59,2025-08-26T01:49:00Z,neutral,0.04060055688023567,0.5498055815696716,0.4095939099788666
GOOGL,Trump threatens more tariffs for countries with digital taxes,https://finnhub.io/api/news?id=158d43b906a9f5cfd2f23c1c977dc0489641527df24f67c58eca58a86b3ecf75,2025-08-26T01:37:10Z,neutral,0.03573276102542877,0.7100644707679749,0.25420278310775757
AAPL,"Phinge®, Home of Netverse® and Netaverse™ With Verified and Safer AI Announces ""Test the Waters"" Campaign for Potential Regulation A+ Offering",https://finnhub.io/api/news?id=23effc0ec59ab92a7532012a0b3ec4f1493fc83f940cb4d7bdc783cc24d844ee,2025-08-26T01:31:00Z,negative,0.6322445273399353,0.008252517320215702,0.3595029413700104
GOOGL,"Phinge®, Home of Netverse® and Netaverse™ With Verified and Safer AI Announces ""Test the Waters"" Campaign for Potential Regulation A+ Offering",https://finnhub.io/api/news?id=23effc0ec59ab92a7532012a0b3ec4f1493fc83f940cb4d7bdc783cc24d844ee,2025-08-26T01:31:00Z,negative,0.6322445273399353,0.008252517320215702,0.3595029413700104
AMZN,"Trump Vows Export Curbs, Tariffs in Digital Tax Reprisal",https://finnhub.io/api/news?id=655e6dd8d99466fae9b98f1072eea5bea56b4c69d783721fc023177ee175fc30,2025-08-26T01:19:15Z,positive,0.17143958806991577,0.12088946998119354,0.7076709270477295
GOOGL,"Trump Vows Export Curbs, Tariffs in Digital Tax Reprisal",https://finnhub.io/api/news?id=655e6dd8d99466fae9b98f1072eea5bea56b4c69d783721fc023177ee175fc30,2025-08-26T01:19:15Z,positive,0.17143958806991577,0.12088946998119354,0.7076709270477295
AAPL,Jeff Bezos Said He Would Have 'Felt Icky' Had He Taken Any More Shares Of Amazon: 'I Just Didn't Feel Good...',https://finnhub.io/api/news?id=93c751516e3666864e8c2e9ae96f5d91f74e81629b54bd48d507cb0dc4368d85,2025-08-26T00:31:09Z,neutral,0.035162944346666336,0.5745271444320679,0.3903099298477173
AMZN,Jeff Bezos Said He Would Have 'Felt Icky' Had He Taken Any More Shares Of Amazon: 'I Just Didn't Feel Good...',https://finnhub.io/api/news?id=93c751516e3666864e8c2e9ae96f5d91f74e81629b54bd48d507cb0dc4368d85,2025-08-26T00:31:09Z,neutral,0.035162944346666336,0.5745271444320679,0.3903099298477173
GOOGL,Corrections & Amplifications,https://finnhub.io/api/news?id=5c13a042ef0b8e1e759cb7751d970fe77ba6a23db8ffc45d04d039cc9ed18ccd,2025-08-25T23:47:00Z,positive,0.024790266528725624,0.03852730244398117,0.936682403087616
