ticker,title,link,pubDate,sentiment,p_negative,p_neutral,p_positive
AMZN,"Dow Jones Futures: Broadcom Rises Late, Jobs Report Looms; Amazon, Netflix Flash Buy Signals",https://finnhub.io/api/news?id=ae89bf47793d3586f42c18639f59d4dd42f55ca993c35766b8da30a45c36796e,2025-09-05T02:47:45Z,positive,0.25703102350234985,0.06645052880048752,0.6765184998512268
AAPL,Tech CEOs Take Turns Praising Trump at White House Dinner,https://finnhub.io/api/news?id=1b49a09cb0e0f433747e1a7e803c1bf136db2df7474d124ed4101df744490c59,2025-09-05T02:45:00Z,positive,0.05327136442065239,0.06308114528656006,0.8836475014686584
GOOGL,"OpenAI set to start mass production of its own AI chips with Broadcom in 2026, FT reports",https://finnhub.io/api/news?id=ce0d4ad1956d5bfa930dc255f4b332234b092da29f75cdf1170d85760ea1905e,2025-09-05T01:39:06Z,positive,0.13857613503932953,0.007727292366325855,0.8536965847015381
NVDA,"OpenAI set to start mass production of its own AI chips with Broadcom in 2026, FT reports",https://finnhub.io/api/news?id=ce0d4ad1956d5bfa930dc255f4b332234b092da29f75cdf1170d85760ea1905e,2025-09-05T01:39:06Z,positive,0.13857613503932953,0.007727292366325855,0.8536965847015381
AMZN,Walmart's AI Super Agents Are The Threat Amazon Didn't Price In,https://finnhub.io/api/news?id=3f321acb9f6df18308ed10d223dbf191562250e5799f508f89d2e69cb8179993,2025-09-05T01:30:26Z,positive,0.07939442247152328,0.03032095544040203,0.8902845978736877
AAPL,Trump to impose tariffs on semiconductor imports from firms not moving production to US,https://finnhub.io/api/news?id=140c31e76ecd587bea1957ba4d34898989278d7eeb761d468ad30575adc94d46,2025-09-05T01:22:39Z,positive,0.050400447100400925,0.10626006871461868,0.8433394432067871
NVDA,Interview Discusses How Trump Plans to Break China’s Stranglehold on U.S. Industry,https://finnhub.io/api/news?id=e980bc9875f9d5eac9589f361719c6ceafcb2de1246e8c2cb0facf4322a1f37b,2025-09-05T01:00:00Z,positive,0.17053556442260742,0.015974776819348335,0.8134896755218506
AAPL,"Wall Street's latest semiconductor darling, Broadcom, teases higher growth after starting production on OpenAI chip",https://finnhub.io/api/news?id=b69453352f81b2898db466d759494d82627982962f4e7edabca2cf0c3701273f,2025-09-05T00:50:05Z,negative,0.9327812194824219,0.0184017326682806,0.0488169901072979
GOOGL,"Wall Street's latest semiconductor darling, Broadcom, teases higher growth after starting production on OpenAI chip",https://finnhub.io/api/news?id=b69453352f81b2898db466d759494d82627982962f4e7edabca2cf0c3701273f,2025-09-05T00:50:05Z,negative,0.9327812194824219,0.0184017326682806,0.0488169901072979
NVDA,"Wall Street's latest semiconductor darling, Broadcom, teases higher growth after starting production on OpenAI chip",https://finnhub.io/api/news?id=b69453352f81b2898db466d759494d82627982962f4e7edabca2cf0c3701273f,2025-09-05T00:50:05Z,negative,0.9327812194824219,0.0184017326682806,0.0488169901072979
GOOGL,Bret Taylor’s Sierra raises $350M at a $10B valuation,https://finnhub.io/api/news?id=ee6d40bc35c1c8ab8eaf3fe7cbdce1b52898e0c89f971d95a4dc1c5f1ad372fd,2025-09-05T00:33:40Z,positive,0.3937820792198181,0.01906622387468815,0.5871517062187195
GOOGL,Why Meta Platforms Stock Outpaced the Market Today,https://finnhub.io/api/news?id=196ca66af1f0b39bdfc1fd94a81f9e5d228dd924203e3b577657599dc7088820,2025-09-05T00:24:57Z,positive,0.1355232149362564,0.06168828159570694,0.8027885556221008
NVDA,Meet the Skyrocketing Artificial Intelligence (AI) Stock That's Leaving Nvidia in the Dust,https://finnhub.io/api/news?id=ff2e7d0d6d1162a7742f3da8e5c59b6b1306b92c1d3562f607d480bb9dd99514,2025-09-05T00:14:00Z,neutral,0.022675881162285805,0.9272910952568054,0.050033047795295715
AAPL,Apple Stock (AAPL) Backed by Analysts Ahead of iPhone Launch Event,https://finnhub.io/api/news?id=68dbca3bd56634eeefb734214a6f85d150ac8984a9d5cfd27cc0094738a0d5c7,2025-09-04T23:56:41Z,positive,0.09154250472784042,0.016088103875517845,0.8923693895339966
GOOGL,Broadcom (AVGO) Remains a Top Pick as Cantor Fitzgerald Lifts Price Target to $350,https://finnhub.io/api/news?id=931164cda1c2e5deb14388224537dc6a669e1fa7e220bf96ab94dedb8035f6f3,2025-09-04T23:54:09Z,negative,0.9249871969223022,0.013221497647464275,0.0617913194000721
NVDA,Alphabet (GOOGL) Outlook: Analysts See Google TPUs as Strong NVIDIA Alternative,https://finnhub.io/api/news?id=b14da51175da05dfda206eaa9653ca24c4d790cfcdd001d9048bb39746eb5984,2025-09-04T23:50:31Z,negative,0.9536973237991333,0.015379105694591999,0.030923523008823395
GOOGL,Alphabet (GOOGL) Outlook: Analysts See Google TPUs as Strong NVIDIA Alternative,https://finnhub.io/api/news?id=b14da51175da05dfda206eaa9653ca24c4d790cfcdd001d9048bb39746eb5984,2025-09-04T23:50:31Z,negative,0.9536973237991333,0.015379105694591999,0.030923523008823395
MSFT,Hilton Global Associates Inc. Ranks No. 885 on the 2025 Inc. 5000 List of America’s Fastest-Growing Private Companies,https://finnhub.io/api/news?id=2eaad73dbf0a697210794bf58da69659bac1363dfd275dd6a1b9e6438b25a6b1,2025-09-04T23:48:00Z,positive,0.3813296854496002,0.01645612344145775,0.6022142171859741
AAPL,"Cerence AI Files Lawsuit Against Apple, Alleging Patent Infringement",https://finnhub.io/api/news?id=dafe79f4ae6d07e03ae2da4b3cfa2886044373aef3a34ba7531d33e5165eafd6,2025-09-04T23:29:00Z,neutral,0.01563427969813347,0.8754631876945496,0.10890248417854309
AAPL,Apple Plans Major Siri Upgrade With AI Search,https://finnhub.io/api/news?id=31fc2006f1a2a0ca81511be64b406e2115fe00fa5114aacadb8e20bfc6cb64b9,2025-09-04T22:49:12Z,positive,0.47799360752105713,0.008862398564815521,0.5131440758705139
GOOGL,Tracking Chase Coleman's Tiger Global Portfolio - Q2 2025 Update,https://finnhub.io/api/news?id=83aed2800796d0c43e541f21fb0841272d278531f0cd1cbcd4c162ee1fa54f29,2025-09-04T22:48:27Z,positive,0.03988031670451164,0.016147397458553314,0.9439722895622253
AMZN,Tracking Chase Coleman's Tiger Global Portfolio - Q2 2025 Update,https://finnhub.io/api/news?id=83aed2800796d0c43e541f21fb0841272d278531f0cd1cbcd4c162ee1fa54f29,2025-09-04T22:48:27Z,positive,0.03988031670451164,0.016147397458553314,0.9439722895622253
MSFT,Tracking Chase Coleman's Tiger Global Portfolio - Q2 2025 Update,https://finnhub.io/api/news?id=83aed2800796d0c43e541f21fb0841272d278531f0cd1cbcd4c162ee1fa54f29,2025-09-04T22:48:27Z,positive,0.03988031670451164,0.016147397458553314,0.9439722895622253
NVDA,Tracking Chase Coleman's Tiger Global Portfolio - Q2 2025 Update,https://finnhub.io/api/news?id=83aed2800796d0c43e541f21fb0841272d278531f0cd1cbcd4c162ee1fa54f29,2025-09-04T22:48:27Z,positive,0.03988031670451164,0.016147397458553314,0.9439722895622253
NVDA,Markets Stride Higher on Rate Cut Expectations,https://finnhub.io/api/news?id=ab76986ea90ecefdcde38e1606060e5ac48529950b6bd4b551904249c0193848,2025-09-04T22:33:00Z,negative,0.8141281008720398,0.11475298553705215,0.07111900299787521
AMZN,"Today's moving stocks: American Eagle, Figma, T. Rowe Price, Amazon, Sanofi",https://finnhub.io/api/news?id=4524c13a77c57e095601db52bc086220a72ccce179fe74618d15ab022b6a5b4e,2025-09-04T22:28:51Z,positive,0.031176961958408356,0.021134724840521812,0.9476882815361023
AMZN,"S&P 500 Gains and Losses Today: T. Rowe Price, Amazon Stocks Rise; Salesforce Sinks After Soft Guidance",https://finnhub.io/api/news?id=5e4c3cb85e475a183265badb4d9d3efb135b4818998a636be3bdb7a25cbd9d4f,2025-09-04T22:21:56Z,neutral,0.05544576793909073,0.92753666639328,0.017017493024468422
GOOGL,Elon Musk’s SpaceX Could Have a ‘Natural Monopoly’,https://finnhub.io/api/news?id=fbca11092696621ba5607cd89a329b29b92d17080fe09e8fefdbd442ac1c542e,2025-09-04T22:15:00Z,positive,0.1007266640663147,0.01626298762857914,0.8830103278160095
AMZN,Elon Musk’s SpaceX Could Have a ‘Natural Monopoly’,https://finnhub.io/api/news?id=fbca11092696621ba5607cd89a329b29b92d17080fe09e8fefdbd442ac1c542e,2025-09-04T22:15:00Z,positive,0.1007266640663147,0.01626298762857914,0.8830103278160095
AAPL,Cerence AI Files Patent Infringement Suit Against Apple,https://finnhub.io/api/news?id=361ce93cde40936bb53c000c09da6bfdbf463b22d26bad2e99f991f00a42c8b5,2025-09-04T22:15:00Z,neutral,0.020895149558782578,0.7991167902946472,0.17998798191547394
NVDA,Broadcom's Revenue Reaches Record High on Strong AI Demand,https://finnhub.io/api/news?id=e7eaa79a3943ce8cfb02e3419984c2d1217416853ee77508ba984b46fb753553,2025-09-04T22:12:05Z,negative,0.9477484822273254,0.01803848333656788,0.03421304374933243
NVDA,Market Chatter: Nvidia Leases Own AI Chips From Lambda Ahead of the Cloud Provider's Planned IPO,https://finnhub.io/api/news?id=bca6d92fa09fe89f399bbe452862302ba9a8709024686774af5639c392046925,2025-09-04T22:01:06Z,positive,0.12768878042697906,0.009944240562617779,0.8623670339584351
NVDA,Cadence Design to buy Hexagon's design and engineering unit for $3.16 billion,https://finnhub.io/api/news?id=fe935d67cb16a9454375172fb3e921e518e82e1e9f3782433151a1b046b571c9,2025-09-04T21:40:29Z,positive,0.07308407127857208,0.012158561497926712,0.9147573709487915
MSFT,Microsoft (MSFT) Tightens Chinese Access to Cyber Early Warning System,https://finnhub.io/api/news?id=c3d3116f40db0b3cd49dfe2ff11863513b6a777c6401aa1152c65fb92735298b,2025-09-04T21:37:12Z,neutral,0.025105319917201996,0.8743414282798767,0.10055328905582428
AMZN,Jim Cramer Believes Broadcom Inc. (AVGO) Just Has The Best CEO,https://finnhub.io/api/news?id=5852fe72542a7dcfe2001cbabdbb557390ae91f95563e2c94f2657352b50d89e,2025-09-04T21:32:29Z,negative,0.6145623922348022,0.009815252386033535,0.37562236189842224
NVDA,Jim Cramer Believes Broadcom Inc. (AVGO) Just Has The Best CEO,https://finnhub.io/api/news?id=5852fe72542a7dcfe2001cbabdbb557390ae91f95563e2c94f2657352b50d89e,2025-09-04T21:32:29Z,negative,0.6145623922348022,0.009815252386033535,0.37562236189842224
MSFT,China's Secret AI Weapon: DeepSeek's R2 Agent Set to Disrupt OpenAI's Lead,https://finnhub.io/api/news?id=0456e46b33486820bc71eb0fe56370c4314b97b19e3cb6e7e537db26c345252e,2025-09-04T21:30:53Z,positive,0.04559532180428505,0.10031455010175705,0.85409015417099
GOOGL,"How AI is changing the news, and what businesses need to know",https://finnhub.io/api/news?id=b0e6092a10424ef9cb68fc379a3d916143672175778bcfb02d50a45b98a012a3,2025-09-04T21:30:06Z,positive,0.03411122038960457,0.026888184249401093,0.9390006065368652
NVDA,"Earnings live: Lululemon stock drops on lowered outlook, DocuSign jumps, American Eagle soars",https://finnhub.io/api/news?id=13136ba1914c26bc10137163f2a87aa3905eceb4f19a3dcae56cf895ed0e5708,2025-09-04T21:29:21Z,neutral,0.012991628609597683,0.9607541561126709,0.02625422365963459
AAPL,"Top Stock Reports for Apple, Novartis & Charles Schwab",https://finnhub.io/api/news?id=35e43ea63fe98513e8e7cef41d1a388d0c4b4e629ebbbe80d6803033e6e749a7,2025-09-04T21:29:00Z,positive,0.028025483712553978,0.04388069361448288,0.9280938506126404
AAPL,"Apple could be raising iPhone prices, Morgan Stanley predicts",https://finnhub.io/api/news?id=6952127fd7eaa56d9b8582efd87da46dcae44ceb2e82fe8456c0b0c619f52beb,2025-09-04T21:27:56Z,negative,0.8991320729255676,0.05513998866081238,0.04572801664471626
AMZN,Why Amazon (AMZN) Shares Are Moving Upwards Today,https://finnhub.io/api/news?id=4bc01199e52a364037842684cb6cabba736168b76624eb2f5abb395198b9f828,2025-09-04T21:25:30Z,positive,0.43789753317832947,0.031647082418203354,0.5304554104804993
AAPL,Trump Snubs Musk. Tesla Stock Rises on Robo-Taxi News.,https://finnhub.io/api/news?id=320fb75ed65c8e2bbaffd97837342a158f95b4545db57e06767738918537f09a,2025-09-04T21:23:00Z,neutral,0.2603670656681061,0.3705366849899292,0.3690963089466095
AMZN,"US Equity Indexes Gain Amid Private Jobs, Economic Activity Reports",https://finnhub.io/api/news?id=5fdf28a7186377e23ec47c8f2ab749cc0058c3277360a718a751d56f82bf6665,2025-09-04T21:22:26Z,negative,0.45107221603393555,0.3899950385093689,0.15893276035785675
MSFT,Microsoft Secures Multibillion-Dollar Cloud Savings Deal With US Government,https://finnhub.io/api/news?id=60e4617e436f42b5f2ebe84c298f5a359815afc609fb3c9891efffdcb85f0b6e,2025-09-04T21:20:46Z,negative,0.9510524868965149,0.01544784102588892,0.03349975496530533
AAPL,Jamf Announces Upcoming Conference Participation,https://finnhub.io/api/news?id=513cf086a5ee791d45c53ac0a623da186ce2ae8515a8957ccca6acb191445d95,2025-09-04T21:20:00Z,positive,0.024572348222136497,0.07145795226097107,0.9039696455001831
MSFT,Lucid Stock Is Tanking. It Isn‘t About Fundamentals.,https://finnhub.io/api/news?id=af8b9f6d7ac16de268a8abfc4ddc19a9823648c9df850822aae9d4c73801a49f,2025-09-04T21:14:00Z,positive,0.04305058345198631,0.17127948999404907,0.7856699228286743
AMZN,Are You Ready for Some Football? These Streaming Stocks Are.,https://finnhub.io/api/news?id=4349069b0170d7d7a3305fcd37c39984a60b6fab6387f086b2120f7a045dabde,2025-09-04T21:14:00Z,positive,0.06744919717311859,0.03184037283062935,0.90071040391922
NVDA,Stock Market Today: Dow Gains 350 Points; A Biotech Name Tumbles Hard (Live Coverage),https://finnhub.io/api/news?id=d970369dbca1d246632f6ddae884a2fb11826cd1cb870101a47820964f99d1c3,2025-09-04T21:12:39Z,neutral,0.38519445061683655,0.41631630063056946,0.1984892189502716
AMZN,Stock Market Today: Dow Gains 350 Points; A Biotech Name Tumbles Hard (Live Coverage),https://finnhub.io/api/news?id=d970369dbca1d246632f6ddae884a2fb11826cd1cb870101a47820964f99d1c3,2025-09-04T21:12:39Z,neutral,0.38519445061683655,0.41631630063056946,0.1984892189502716
MSFT,UiPath Reports Second Quarter Fiscal 2026 Financial Results,https://finnhub.io/api/news?id=bcadefe72ae81dcb14954be60160de5ed68c495f74776e91aa158f3f713570cc,2025-09-04T21:10:00Z,positive,0.03677024319767952,0.12234482169151306,0.8408849835395813
NVDA,"Nvidia, Palantir Pull Off This Three-Peat. But So Does This Financial Powerhouse.",https://finnhub.io/api/news?id=99487d6ebb02e9ca6698231ddd39681c29a2f10539cb7515eb5035951eff2fc9,2025-09-04T21:03:12Z,positive,0.42804154753685,0.009453564882278442,0.5625049471855164
GOOGL,Alphabet Jumps 8% as Google Avoids Breakup in Antitrust Case,https://finnhub.io/api/news?id=196b80d5608f6dbb477e41e054d9edfc4a01a2e178775ed93cdf16381e5a7863,2025-09-04T20:56:28Z,negative,0.8688013553619385,0.08407288789749146,0.04712572693824768
MSFT,"OpenAI Plans to Launch Jobs Platforms, AI Certification Program for AI Roles",https://finnhub.io/api/news?id=8ceaf97443893f71a08b60439b4580f969331403d8b52ef9b9c4c84327082e15,2025-09-04T20:54:17Z,positive,0.2034173607826233,0.006761403288692236,0.7898212671279907
AMZN,"Stocks to Watch Thursday: Amazon, T. Rowe,  Honeywell",https://finnhub.io/api/news?id=9f79870a41af4e6dbc4d4a0ac5d1cb41be006d2fd16bf24b3c79278f563225c7,2025-09-04T20:46:49Z,positive,0.026003405451774597,0.03990190848708153,0.9340946674346924
NVDA,"Stocks to Watch Thursday: Amazon, T. Rowe,  Honeywell",https://finnhub.io/api/news?id=9f79870a41af4e6dbc4d4a0ac5d1cb41be006d2fd16bf24b3c79278f563225c7,2025-09-04T20:46:49Z,positive,0.026003405451774597,0.03990190848708153,0.9340946674346924
AAPL,"Apple upgrade, Ciena earnings, AMD downgrade: Trending Tickers",https://finnhub.io/api/news?id=5b37d563775dd29175b76743975eae6f0dcf5fe76e4b91ef9632c4eba886bf43,2025-09-04T20:41:30Z,neutral,0.036826230585575104,0.7490643262863159,0.2141094207763672
AMZN,"US Equity Indexes Rise Amid Private Sector Jobs, Economic Activity Reports",https://finnhub.io/api/news?id=efb227419eb8a06af35ceca184a92b5c910d4f545e7388c0528619b8dbf27278,2025-09-04T20:37:04Z,negative,0.424052357673645,0.40263479948043823,0.17331282794475555
GOOGL,Alphabet (GOOG) Jumps 9% as Firm Spared From Forced Google Chrome Sale,https://finnhub.io/api/news?id=a79d03b177135ec2c7d585cf5eaff5261f9f61c364ac8eb9a34df4f19d4f6dd6,2025-09-04T20:36:46Z,negative,0.8424936532974243,0.1148952916264534,0.04261106997728348
AMZN,"Microsoft Corporation (MSFT) Was Weighed Down Due To Software Industry Woes, Says JIm Cramer",https://finnhub.io/api/news?id=480786ddc276b50080f0a737747bd7bb4523d4085673f075b9036caa02f41ae1,2025-09-04T20:30:23Z,neutral,0.018968122079968452,0.9596593379974365,0.021372448652982712
NVDA,"Microsoft Corporation (MSFT) Was Weighed Down Due To Software Industry Woes, Says JIm Cramer",https://finnhub.io/api/news?id=480786ddc276b50080f0a737747bd7bb4523d4085673f075b9036caa02f41ae1,2025-09-04T20:30:23Z,neutral,0.018968122079968452,0.9596593379974365,0.021372448652982712
MSFT,"Microsoft Corporation (MSFT) Was Weighed Down Due To Software Industry Woes, Says JIm Cramer",https://finnhub.io/api/news?id=480786ddc276b50080f0a737747bd7bb4523d4085673f075b9036caa02f41ae1,2025-09-04T20:30:23Z,neutral,0.018968122079968452,0.9596593379974365,0.021372448652982712
AMZN,"Jim Cramer Dismisses Worries About Amazon.com, Inc. (AMZN)’s Prime Business That Sent Stock Lower",https://finnhub.io/api/news?id=55c2bd8434b2eac84c79450aa340628feac476019151d0ce9d5e51a96e4ec9ed,2025-09-04T20:29:42Z,neutral,0.031323712319135666,0.9210458993911743,0.04763035103678703
NVDA,"Jim Cramer Dismisses Worries About Amazon.com, Inc. (AMZN)’s Prime Business That Sent Stock Lower",https://finnhub.io/api/news?id=55c2bd8434b2eac84c79450aa340628feac476019151d0ce9d5e51a96e4ec9ed,2025-09-04T20:29:42Z,neutral,0.031323712319135666,0.9210458993911743,0.04763035103678703
AMZN,"First they came for Netflix passwords. Now, some free Amazon deliveries are ending",https://finnhub.io/api/news?id=02ef1c17b17c2dd5f8060d26a1e7b18a034d5fbdf22931f2628613a73a6e675a,2025-09-04T20:28:04Z,positive,0.07135315984487534,0.018146749585866928,0.9105001091957092
AMZN,Amazon stock pops after Project Kuiper lands JetBlue internet deal,https://finnhub.io/api/news?id=b7e8db945c6bd021551b7491d6f2040d2483e5c186b4fd3360aebb3e05b678ca,2025-09-04T20:16:52Z,positive,0.21758009493350983,0.35256776213645935,0.429852157831192
GOOGL,Apple Stock Jumps As iPhone Air Buzz Builds,https://finnhub.io/api/news?id=c8171c2ade2ab9bbe7d51001b775e19b5f84c4fa7fe2f560306a4263312ad3a2,2025-09-04T20:11:40Z,positive,0.2924567461013794,0.15722642838954926,0.5503168106079102
NVDA,"Nvidia vs. Palantir: Wall Street Analysts Say to Buy One, but Think the Other Is Overvalued",https://finnhub.io/api/news?id=d0b0624987e527c2edba41962b22c68657f87d6d0e7ea9384dd03819527e7452,2025-09-04T20:11:00Z,negative,0.6355687975883484,0.0732482299208641,0.2911829650402069
AMZN,"Amazon (AMZN) Maintains Lead in US E-Commerce Retail, per JPM",https://finnhub.io/api/news?id=5eca9b5aba87d2b192be891d178cc3da0bbbf602e4ac14d67844b91299c1561e,2025-09-04T20:05:34Z,negative,0.6856638193130493,0.009378152899444103,0.3049580156803131
AAPL,Apple Watch (AAPL) Blood Oxygen Feature Reintroduced in US After Legal Battle,https://finnhub.io/api/news?id=7fbb35b3c3d76d460a23ad2989251da11edc9ba5db364daba65d355358cbb93e,2025-09-04T20:03:38Z,negative,0.8665229678153992,0.019108863547444344,0.11436820775270462
GOOGL,"Florida is now the 2nd most financially distressed state in the US — topped only by Texas, Google helps reveal",https://finnhub.io/api/news?id=94a552e41843cba05656d7039e5d3368750646af3d6fd3146e092c3182165859,2025-09-04T20:03:00Z,neutral,0.03774230554699898,0.9194355607032776,0.04282209649682045
GOOGL,Citizens JMP Confirms Market Perform Rating on Uber Technologies (UBER),https://finnhub.io/api/news?id=5461f40df33693bd846216b982b48b641fd53423daafde8adebad5366e68f104,2025-09-04T20:02:25Z,negative,0.5621741414070129,0.012971213087439537,0.4248546361923218
NVDA,"Nvidia Invests in Honeywell’s Quantinuum. What It Means for D-Wave, IonQ, and Quantum Stocks.",https://finnhub.io/api/news?id=8907a1df9ade6b2dc8dc0a60c4b6ab8c73776b91ab9c32053465ef343cf26727,2025-09-04T19:54:00Z,positive,0.050491541624069214,0.010931411758065224,0.9385769963264465
NVDA,Veteran trader has two words of advice for nervous Nvidia investors,https://finnhub.io/api/news?id=113f4ecb281cc63bae5e8719de85383854017abf84f8bb07812acd79ea9db072,2025-09-04T19:52:33Z,positive,0.12603117525577545,0.019106267020106316,0.8548625707626343
GOOGL,'The problem of monopoly': Why Google's light anti-trust penalties could pose a dilemma for Canada,https://finnhub.io/api/news?id=7cd32dd2a48dc5c8cce952f8c7b4e4d956e9bb2fa746ded5d5b2b51ccd515795,2025-09-04T19:30:38Z,neutral,0.03671365603804588,0.6119146943092346,0.3513716459274292
NVDA,"China’s ‘Dark Horse’ AI Startup Says It Will Use Domestic Chips, Not Nvidia’s, for Its Latest Models. What Does That Mean for NVDA Stock?",https://finnhub.io/api/news?id=50ceed3779453210f55d7943fed777c7f7e6e2f043a1a3b6f06c632faf299415,2025-09-04T19:28:23Z,positive,0.027260079979896545,0.037339311093091965,0.9354006052017212
AMZN,Carnegie Learning Appoints Former Amazon and Walmart UX Leader Jim Machajewski as Senior Vice President of UX & Design,https://finnhub.io/api/news?id=17a65731f3835619f5a38d2aa36ca15a79737c7645f01053cec773c6401f1b54,2025-09-04T19:18:00Z,positive,0.02812718227505684,0.06756347417831421,0.9043093919754028
GOOGL,"Gap expands into beauty, Wall Street bullish on Google's TPU chips",https://finnhub.io/api/news?id=6c3b3dabfe0c0b8607d709d366f032fdab7bc6fa24fb6671471d9b95cc275a39,2025-09-04T19:13:20Z,negative,0.5224679112434387,0.06934934854507446,0.4081827998161316
AAPL,"Market Underestimating Negative Impact of Autonomous Vehicles on Uber, Lyft, Wedbush Says",https://finnhub.io/api/news?id=4ac68c6447564130ea81af23da0a0342d9b677757d9fbf6941bc098ddd71861b,2025-09-04T19:09:58Z,neutral,0.0436287522315979,0.8840854167938232,0.07228577882051468
AMZN,Make Your September Shopping List. Which Consumer Stocks Make the Cut.,https://finnhub.io/api/news?id=d1766dd7d1f680d68b8706d5f41863bb7e8f53a6b81c57ee9b797a59812e703d,2025-09-04T19:07:00Z,positive,0.03118624910712242,0.13013853132724762,0.8386752009391785
GOOGL,"Screenguy Sam Hits 350 Google 5-Star Reviews, Cementing Position as Best All Around Bug Screen Provider in Metro Vancouver",https://finnhub.io/api/news?id=cc9f431a341d10ed94ed9fbcef849c71e466931743b550130d9da93c163549a7,2025-09-04T18:54:00Z,negative,0.9520142674446106,0.016463078558444977,0.03152269497513771
AAPL,Apple: Why I Am Upgrading To Buy Despite Headwinds,https://finnhub.io/api/news?id=1d7a2e1bedb3d78b4770c37fb7dd26e7a97cff7fd3327812f147d6fa13a12abc,2025-09-04T18:36:13Z,negative,0.6202530264854431,0.018966594710946083,0.36078035831451416
GOOGL,FTC to Review AI Chatbot Risks With Focus on Privacy Harms,https://finnhub.io/api/news?id=dea42eaf39c885a333475783babe2d7399b0093e6218caf6c0fd6cd91f192e57,2025-09-04T18:32:56Z,positive,0.04704251140356064,0.042971085757017136,0.9099864363670349
MSFT,Microsoft’s (MSFT) Cloud Deal Boosts Federal Market Presence,https://finnhub.io/api/news?id=e9cefb00501d33e9d15198952737f61417b94f2a0be7eb7765363db88d483ab0,2025-09-04T18:30:40Z,negative,0.877087414264679,0.03567346930503845,0.08723911643028259
GOOGL,"France Fines Google, Shein Hundreds of Millions Over Cookies",https://finnhub.io/api/news?id=0556a0286964132d7dbfcc6f5a1634bfff6ec5f22bbe0e08cc6292ec92dcf102,2025-09-04T18:28:44Z,neutral,0.01771959662437439,0.8839191794395447,0.09836126863956451
GOOGL,Alphabet (GOOGL) Reports Strong Year-Over-Year Gains in Q2 Earnings,https://finnhub.io/api/news?id=446ebf2a424a8625ae50dcb362f7061267e53c23c421ebc6a127b216f61392d9,2025-09-04T18:16:17Z,negative,0.9514693021774292,0.022273866459727287,0.026256894692778587
MSFT,Microsoft (MSFT) Joins Forces With DeepIQ To Revolutionize Energy Sector With Agentic AI,https://finnhub.io/api/news?id=9332200f2c2d6da306c469b92affdc1775f420cfab41d2bcf4ac28ca57d8e582,2025-09-04T18:15:04Z,negative,0.7232604622840881,0.008014017716050148,0.26872554421424866
GOOGL,Can TeraWulf’s (WULF) Pivot Beyond Bitcoin Mining Secure Its Future?,https://finnhub.io/api/news?id=a2194f9badf42f74d0b2eed4b2692683fe76a323719995158a9d7400f32439e4,2025-09-04T18:14:12Z,positive,0.40877029299736023,0.007941794581711292,0.5832879543304443
AAPL,Should You Bet on Apple-Heavy ETFs Now?,https://finnhub.io/api/news?id=4358f9bf27cfa16832b808f36c8858f5f8b435888b92eadb503d7002ec080fcf,2025-09-04T18:06:00Z,positive,0.05804334953427315,0.032058924436569214,0.9098976850509644
MSFT,"Cantor Fitzgerald Initiates Buy on CoreWeave (CRWV), Citing AI Growth",https://finnhub.io/api/news?id=8b927caa732bad3b0098873ef091a00d1198c48d33d7eba13a3666cc669903a6,2025-09-04T17:55:58Z,positive,0.03699341416358948,0.14980079233646393,0.8132057785987854
MSFT,Sector Update: Tech Stocks Advance Thursday Afternoon,https://finnhub.io/api/news?id=85be70210e327e7d6a6b9edc67c7c74f28e2555157b40dfc8cdd8334042dcd22,2025-09-04T17:49:40Z,negative,0.4642452001571655,0.2711178660392761,0.26463693380355835
AAPL,Trump is hosting tech leaders at the White House: What to expect,https://finnhub.io/api/news?id=b9cdbb727806fde9d999da5a78f2a21462da07b302a90d6fe4a13f859328ab48,2025-09-04T17:31:33Z,positive,0.03313996642827988,0.02618529461324215,0.9406747221946716
MSFT,Trump is hosting tech leaders at the White House: What to expect,https://finnhub.io/api/news?id=b9cdbb727806fde9d999da5a78f2a21462da07b302a90d6fe4a13f859328ab48,2025-09-04T17:31:33Z,positive,0.03313996642827988,0.02618529461324215,0.9406747221946716
AMZN,Amazon's Satellite Internet Service Lands This Major Airline. Get Ready For 1 Gbps Speeds.,https://finnhub.io/api/news?id=381d8f20fbbce0271caf8b6a379189738e6c24a8bf43869fe6ac8ee1a70dc902,2025-09-04T17:31:21Z,positive,0.12617704272270203,0.009329431690275669,0.8644935488700867
AAPL,CEO who ran tech unicorn once valued at $1.2 billion charged with fraud after allegedly spending millions on his wedding and art classes,https://finnhub.io/api/news?id=3d74291556494bf0dd0ad23da158a3d5891fcb974870342fb70b035a845f5dd1,2025-09-04T17:30:40Z,neutral,0.025563804432749748,0.7893428802490234,0.18509334325790405
MSFT,Jim Cramer Calls NVIDIA the Greatest Stock He Has Ever Laid Eyes On,https://finnhub.io/api/news?id=54de52c6e5f9b3900bad31d0b6be955080ddac6cbaa7db5ca6daa064d628bedc,2025-09-04T17:17:52Z,positive,0.20472541451454163,0.011030463501811028,0.784244179725647
AAPL,Jim Cramer Says Court Ruling in Favor of Alphabet is “Also a Big Win for Apple”,https://finnhub.io/api/news?id=3ff6631b80323a8268ff4a8b3645ba57de5cb057f9f4f1ebe246ab8b8d4508a4,2025-09-04T17:17:46Z,negative,0.9169808626174927,0.017992068082094193,0.06502701342105865
